Sheet: Feuille1
A1: p | B1: sampling rate | C1: of:=0.0001 -> 0.0001 | E1: of:=0.0001 -> 0.0001
A2: l | B2: limit in words | C2: of:=[.C4]/[.C1] -> 230000 | E2: of:=[.E3]/8*1024 -> 13107200
B3: limit in KiB | C3: of:=[.C2]*8/1024 -> 1796.875 | E3: of:=100*1024 -> 102400
A4: k | B4: memprof calls | C4: 23 | E4: of:=FLOOR([.E2]*[.E1]) -> 1310
A5: n | B5: allocation in words
A6: P(n) | B6: I_p(k,n-k+1)
D7: Per samples | F7: Per allocation limit
A8: step | B8: n/l | C8: n | D8: of:="P (l="&TEXT([.C3];"#,##0")&" KiB, k="&TEXT([.C4];"0")&", p="&TEXT([.C1];"0E+0")&")" -> P (l=1,797 KiB, k=23, p=1E-4) | E8: n | F8: of:="P (l="&TEXT([.E3];"#,##0")&" KiB, k="&TEXT([.E4];"0")&", p="&TEXT([.E1];"0E+0")&")" -> P (l=102,400 KiB, k=1310, p=1E-4)
A9: 0 | B9: of:=[.A9]*0.01 -> 0 | C9: 0 | D9: 0 | E9: 0 | F9: 0
A10: 1 | B10: of:=[.A10]*0.01 -> 0.01 | C10: of:=[.B10]*[.C$2] -> 2300 | D10: of:=BETADIST([.C$1];[.C$4];[.C10]-[.C$4]+1) -> 5.81516323246769E-038 | E10: of:=[.$B10]*[.E$2] -> 131072 | F10: of:=BETADIST([.E$1];[.E$4];[.E10]-[.E$4]+1) -> 0
A11: 2 | B11: of:=[.A11]*0.01 -> 0.02 | C11: of:=[.B11]*[.C$2] -> 4600 | D11: of:=BETADIST([.C$1];[.C$4];[.C11]-[.C$4]+1) -> 4.13600022830298E-031 | E11: of:=[.$B11]*[.E$2] -> 262144 | F11: of:=BETADIST([.E$1];[.E$4];[.E11]-[.E$4]+1) -> 0
A12: 3 | B12: of:=[.A12]*0.01 -> 0.03 | C12: of:=[.B12]*[.C$2] -> 6900 | D12: of:=BETADIST([.C$1];[.C$4];[.C12]-[.C$4]+1) -> 3.79337901461712E-027 | E12: of:=[.$B12]*[.E$2] -> 393216 | F12: of:=BETADIST([.E$1];[.E$4];[.E12]-[.E$4]+1) -> 0
A13: 4 | B13: of:=[.A13]*0.01 -> 0.04 | C13: of:=[.B13]*[.C$2] -> 9200 | D13: of:=BETADIST([.C$1];[.C$4];[.C13]-[.C$4]+1) -> 2.296187248347E-024 | E13: of:=[.$B13]*[.E$2] -> 524288 | F13: of:=BETADIST([.E$1];[.E$4];[.E13]-[.E$4]+1) -> 0
A14: 5 | B14: of:=[.A14]*0.01 -> 0.05 | C14: of:=[.B14]*[.C$2] -> 11500 | D14: of:=BETADIST([.C$1];[.C$4];[.C14]-[.C$4]+1) -> 3.13884895685929E-022 | E14: of:=[.$B14]*[.E$2] -> 655360 | F14: of:=BETADIST([.E$1];[.E$4];[.E14]-[.E$4]+1) -> 0
A15: 6 | B15: of:=[.A15]*0.01 -> 0.06 | C15: of:=[.B15]*[.C$2] -> 13800 | D15: of:=BETADIST([.C$1];[.C$4];[.C15]-[.C$4]+1) -> 1.67499659952832E-020 | E15: of:=[.$B15]*[.E$2] -> 786432 | F15: of:=BETADIST([.E$1];[.E$4];[.E15]-[.E$4]+1) -> 0
A16: 7 | B16: of:=[.A16]*0.01 -> 0.07 | C16: of:=[.B16]*[.C$2] -> 16100 | D16: of:=BETADIST([.C$1];[.C$4];[.C16]-[.C$4]+1) -> 4.67142877445247E-019 | E16: of:=[.$B16]*[.E$2] -> 917504 | F16: of:=BETADIST([.E$1];[.E$4];[.E16]-[.E$4]+1) -> 0
A17: 8 | B17: of:=[.A17]*0.01 -> 0.08 | C17: of:=[.B17]*[.C$2] -> 18400 | D17: of:=BETADIST([.C$1];[.C$4];[.C17]-[.C$4]+1) -> 8.10364856566706E-018 | E17: of:=[.$B17]*[.E$2] -> 1048576 | F17: of:=BETADIST([.E$1];[.E$4];[.E17]-[.E$4]+1) -> 0
A18: 9 | B18: of:=[.A18]*0.01 -> 0.09 | C18: of:=[.B18]*[.C$2] -> 20700 | D18: of:=BETADIST([.C$1];[.C$4];[.C18]-[.C$4]+1) -> 9.78265659058709E-017 | E18: of:=[.$B18]*[.E$2] -> 1179648 | F18: of:=BETADIST([.E$1];[.E$4];[.E18]-[.E$4]+1) -> 0
A19: 10 | B19: of:=[.A19]*0.01 -> 0.1 | C19: of:=[.B19]*[.C$2] -> 23000 | D19: of:=BETADIST([.C$1];[.C$4];[.C19]-[.C$4]+1) -> 8.87272608842061E-016 | E19: of:=[.$B19]*[.E$2] -> 1310720 | F19: of:=BETADIST([.E$1];[.E$4];[.E19]-[.E$4]+1) -> 0
A20: 11 | B20: of:=[.A20]*0.01 -> 0.11 | C20: of:=[.B20]*[.C$2] -> 25300 | D20: of:=BETADIST([.C$1];[.C$4];[.C20]-[.C$4]+1) -> 6.38577462304094E-015 | E20: of:=[.$B20]*[.E$2] -> 1441792 | F20: of:=BETADIST([.E$1];[.E$4];[.E20]-[.E$4]+1) -> 0
A21: 12 | B21: of:=[.A21]*0.01 -> 0.12 | C21: of:=[.B21]*[.C$2] -> 27600 | D21: of:=BETADIST([.C$1];[.C$4];[.C21]-[.C$4]+1) -> 0.0000000000000379705532268642 | E21: of:=[.$B21]*[.E$2] -> 1572864 | F21: of:=BETADIST([.E$1];[.E$4];[.E21]-[.E$4]+1) -> 0
A22: 13 | B22: of:=[.A22]*0.01 -> 0.13 | C22: of:=[.B22]*[.C$2] -> 29900 | D22: of:=BETADIST([.C$1];[.C$4];[.C22]-[.C$4]+1) -> 0.000000000000192336180571007 | E22: of:=[.$B22]*[.E$2] -> 1703936 | F22: of:=BETADIST([.E$1];[.E$4];[.E22]-[.E$4]+1) -> 0
A23: 14 | B23: of:=[.A23]*0.01 -> 0.14 | C23: of:=[.B23]*[.C$2] -> 32200 | D23: of:=BETADIST([.C$1];[.C$4];[.C23]-[.C$4]+1) -> 0.000000000000849955602906727 | E23: of:=[.$B23]*[.E$2] -> 1835008 | F23: of:=BETADIST([.E$1];[.E$4];[.E23]-[.E$4]+1) -> 0
A24: 15 | B24: of:=[.A24]*0.01 -> 0.15 | C24: of:=[.B24]*[.C$2] -> 34500 | D24: of:=BETADIST([.C$1];[.C$4];[.C24]-[.C$4]+1) -> 0.00000000000333925358945218 | E24: of:=[.$B24]*[.E$2] -> 1966080 | F24: of:=BETADIST([.E$1];[.E$4];[.E24]-[.E$4]+1) -> 0
A25: 16 | B25: of:=[.A25]*0.01 -> 0.16 | C25: of:=[.B25]*[.C$2] -> 36800 | D25: of:=BETADIST([.C$1];[.C$4];[.C25]-[.C$4]+1) -> 0.0000000000118420789597954 | E25: of:=[.$B25]*[.E$2] -> 2097152 | F25: of:=BETADIST([.E$1];[.E$4];[.E25]-[.E$4]+1) -> 0
A26: 17 | B26: of:=[.A26]*0.01 -> 0.17 | C26: of:=[.B26]*[.C$2] -> 39100 | D26: of:=BETADIST([.C$1];[.C$4];[.C26]-[.C$4]+1) -> 0.0000000000383827608446381 | E26: of:=[.$B26]*[.E$2] -> 2228224 | F26: of:=BETADIST([.E$1];[.E$4];[.E26]-[.E$4]+1) -> 0
A27: 18 | B27: of:=[.A27]*0.01 -> 0.18 | C27: of:=[.B27]*[.C$2] -> 41400 | D27: of:=BETADIST([.C$1];[.C$4];[.C27]-[.C$4]+1) -> 0.000000000114881696045147 | E27: of:=[.$B27]*[.E$2] -> 2359296 | F27: of:=BETADIST([.E$1];[.E$4];[.E27]-[.E$4]+1) -> 0
A28: 19 | B28: of:=[.A28]*0.01 -> 0.19 | C28: of:=[.B28]*[.C$2] -> 43700 | D28: of:=BETADIST([.C$1];[.C$4];[.C28]-[.C$4]+1) -> 0.000000000320274054765848 | E28: of:=[.$B28]*[.E$2] -> 2490368 | F28: of:=BETADIST([.E$1];[.E$4];[.E28]-[.E$4]+1) -> 0
A29: 20 | B29: of:=[.A29]*0.01 -> 0.2 | C29: of:=[.B29]*[.C$2] -> 46000 | D29: of:=BETADIST([.C$1];[.C$4];[.C29]-[.C$4]+1) -> 0.000000000837763518262497 | E29: of:=[.$B29]*[.E$2] -> 2621440 | F29: of:=BETADIST([.E$1];[.E$4];[.E29]-[.E$4]+1) -> 0
A30: 21 | B30: of:=[.A30]*0.01 -> 0.21 | C30: of:=[.B30]*[.C$2] -> 48300 | D30: of:=BETADIST([.C$1];[.C$4];[.C30]-[.C$4]+1) -> 0.00000000206898697751613 | E30: of:=[.$B30]*[.E$2] -> 2752512 | F30: of:=BETADIST([.E$1];[.E$4];[.E30]-[.E$4]+1) -> 0
A31: 22 | B31: of:=[.A31]*0.01 -> 0.22 | C31: of:=[.B31]*[.C$2] -> 50600 | D31: of:=BETADIST([.C$1];[.C$4];[.C31]-[.C$4]+1) -> 0.00000000485020941947473 | E31: of:=[.$B31]*[.E$2] -> 2883584 | F31: of:=BETADIST([.E$1];[.E$4];[.E31]-[.E$4]+1) -> 0
A32: 23 | B32: of:=[.A32]*0.01 -> 0.23 | C32: of:=[.B32]*[.C$2] -> 52900 | D32: of:=BETADIST([.C$1];[.C$4];[.C32]-[.C$4]+1) -> 0.0000000108429802229248 | E32: of:=[.$B32]*[.E$2] -> 3014656 | F32: of:=BETADIST([.E$1];[.E$4];[.E32]-[.E$4]+1) -> 0
A33: 24 | B33: of:=[.A33]*0.01 -> 0.24 | C33: of:=[.B33]*[.C$2] -> 55200 | D33: of:=BETADIST([.C$1];[.C$4];[.C33]-[.C$4]+1) -> 0.0000000232104460044429 | E33: of:=[.$B33]*[.E$2] -> 3145728 | F33: of:=BETADIST([.E$1];[.E$4];[.E33]-[.E$4]+1) -> 0
A34: 25 | B34: of:=[.A34]*0.01 -> 0.25 | C34: of:=[.B34]*[.C$2] -> 57500 | D34: of:=BETADIST([.C$1];[.C$4];[.C34]-[.C$4]+1) -> 0.0000000477430847184687 | E34: of:=[.$B34]*[.E$2] -> 3276800 | F34: of:=BETADIST([.E$1];[.E$4];[.E34]-[.E$4]+1) -> 0
A35: 26 | B35: of:=[.A35]*0.01 -> 0.26 | C35: of:=[.B35]*[.C$2] -> 59800 | D35: of:=BETADIST([.C$1];[.C$4];[.C35]-[.C$4]+1) -> 0.000000094665851819263 | E35: of:=[.$B35]*[.E$2] -> 3407872 | F35: of:=BETADIST([.E$1];[.E$4];[.E35]-[.E$4]+1) -> 0
A36: 27 | B36: of:=[.A36]*0.01 -> 0.27 | C36: of:=[.B36]*[.C$2] -> 62100 | D36: of:=BETADIST([.C$1];[.C$4];[.C36]-[.C$4]+1) -> 0.000000181443523010684 | E36: of:=[.$B36]*[.E$2] -> 3538944 | F36: of:=BETADIST([.E$1];[.E$4];[.E36]-[.E$4]+1) -> 0
A37: 28 | B37: of:=[.A37]*0.01 -> 0.28 | C37: of:=[.B37]*[.C$2] -> 64400 | D37: of:=BETADIST([.C$1];[.C$4];[.C37]-[.C$4]+1) -> 0.000000337001895134744 | E37: of:=[.$B37]*[.E$2] -> 3670016 | F37: of:=BETADIST([.E$1];[.E$4];[.E37]-[.E$4]+1) -> 0
A38: 29 | B38: of:=[.A38]*0.01 -> 0.29 | C38: of:=[.B38]*[.C$2] -> 66700 | D38: of:=BETADIST([.C$1];[.C$4];[.C38]-[.C$4]+1) -> 0.000000607897170738581 | E38: of:=[.$B38]*[.E$2] -> 3801088 | F38: of:=BETADIST([.E$1];[.E$4];[.E38]-[.E$4]+1) -> 1.10184403533469E-302
A39: 30 | B39: of:=[.A39]*0.01 -> 0.3 | C39: of:=[.B39]*[.C$2] -> 69000 | D39: of:=BETADIST([.C$1];[.C$4];[.C39]-[.C$4]+1) -> 0.00000106708987964987 | E39: of:=[.$B39]*[.E$2] -> 3932160 | F39: of:=BETADIST([.E$1];[.E$4];[.E39]-[.E$4]+1) -> 4.42931239651305E-289
A40: 31 | B40: of:=[.A40]*0.01 -> 0.31 | C40: of:=[.B40]*[.C$2] -> 71300 | D40: of:=BETADIST([.C$1];[.C$4];[.C40]-[.C$4]+1) -> 0.00000182610637964365 | E40: of:=[.$B40]*[.E$2] -> 4063232 | F40: of:=BETADIST([.E$1];[.E$4];[.E40]-[.E$4]+1) -> 4.14895486533812E-276
A41: 32 | B41: of:=[.A41]*0.01 -> 0.32 | C41: of:=[.B41]*[.C$2] -> 73600 | D41: of:=BETADIST([.C$1];[.C$4];[.C41]-[.C$4]+1) -> 0.00000305149140307274 | E41: of:=[.$B41]*[.E$2] -> 4194304 | F41: of:=BETADIST([.E$1];[.E$4];[.E41]-[.E$4]+1) -> 9.93386525070397E-264
A42: 33 | B42: of:=[.A42]*0.01 -> 0.33 | C42: of:=[.B42]*[.C$2] -> 75900 | D42: of:=BETADIST([.C$1];[.C$4];[.C42]-[.C$4]+1) -> 0.000004986558427606 | E42: of:=[.$B42]*[.E$2] -> 4325376 | F42: of:=BETADIST([.E$1];[.E$4];[.E42]-[.E$4]+1) -> 6.61233021269276E-252
A43: 34 | B43: of:=[.A43]*0.01 -> 0.34 | C43: of:=[.B43]*[.C$2] -> 78200 | D43: of:=BETADIST([.C$1];[.C$4];[.C43]-[.C$4]+1) -> 0.00000797951861511595 | E43: of:=[.$B43]*[.E$2] -> 4456448 | F43: of:=BETADIST([.E$1];[.E$4];[.E43]-[.E$4]+1) -> 1.32086703927854E-240
A44: 35 | B44: of:=[.A44]*0.01 -> 0.35 | C44: of:=[.B44]*[.C$2] -> 80500 | D44: of:=BETADIST([.C$1];[.C$4];[.C44]-[.C$4]+1) -> 0.0000125191008343428 | E44: of:=[.$B44]*[.E$2] -> 4587520 | F44: of:=BETADIST([.E$1];[.E$4];[.E44]-[.E$4]+1) -> 8.49091899358927E-230
A45: 36 | B45: of:=[.A45]*0.01 -> 0.36 | C45: of:=[.B45]*[.C$2] -> 82800 | D45: of:=BETADIST([.C$1];[.C$4];[.C45]-[.C$4]+1) -> 0.000019278752334469 | E45: of:=[.$B45]*[.E$2] -> 4718592 | F45: of:=BETADIST([.E$1];[.E$4];[.E45]-[.E$4]+1) -> 1.87240964223694E-219
A46: 37 | B46: of:=[.A46]*0.01 -> 0.37 | C46: of:=[.B46]*[.C$2] -> 85100 | D46: of:=BETADIST([.C$1];[.C$4];[.C46]-[.C$4]+1) -> 0.000029170420810815 | E46: of:=[.$B46]*[.E$2] -> 4849664 | F46: of:=BETADIST([.E$1];[.E$4];[.E46]-[.E$4]+1) -> 1.50201768277142E-209
A47: 38 | B47: of:=[.A47]*0.01 -> 0.38 | C47: of:=[.B47]*[.C$2] -> 87400 | D47: of:=BETADIST([.C$1];[.C$4];[.C47]-[.C$4]+1) -> 0.0000434087551764331 | E47: of:=[.$B47]*[.E$2] -> 4980736 | F47: of:=BETADIST([.E$1];[.E$4];[.E47]-[.E$4]+1) -> 4.62611145764649E-200
A48: 39 | B48: of:=[.A48]*0.01 -> 0.39 | C48: of:=[.B48]*[.C$2] -> 89700 | D48: of:=BETADIST([.C$1];[.C$4];[.C48]-[.C$4]+1) -> 0.0000635863190255858 | E48: of:=[.$B48]*[.E$2] -> 5111808 | F48: of:=BETADIST([.E$1];[.E$4];[.E48]-[.E$4]+1) -> 5.74958136533357E-191
A49: 40 | B49: of:=[.A49]*0.01 -> 0.4 | C49: of:=[.B49]*[.C$2] -> 92000 | D49: of:=BETADIST([.C$1];[.C$4];[.C49]-[.C$4]+1) -> 0.0000917600865020064 | E49: of:=[.$B49]*[.E$2] -> 5242880 | F49: of:=BETADIST([.E$1];[.E$4];[.E49]-[.E$4]+1) -> 3.01929875515524E-182
A50: 41 | B50: of:=[.A50]*0.01 -> 0.41 | C50: of:=[.B50]*[.C$2] -> 94300 | D50: of:=BETADIST([.C$1];[.C$4];[.C50]-[.C$4]+1) -> 0.000130549088860476 | E50: of:=[.$B50]*[.E$2] -> 5373952 | F50: of:=BETADIST([.E$1];[.E$4];[.E50]-[.E$4]+1) -> 6.99064069959188E-174
A51: 42 | B51: of:=[.A51]*0.01 -> 0.42 | C51: of:=[.B51]*[.C$2] -> 96600 | D51: of:=BETADIST([.C$1];[.C$4];[.C51]-[.C$4]+1) -> 0.000183242610349285 | E51: of:=[.$B51]*[.E$2] -> 5505024 | F51: of:=BETADIST([.E$1];[.E$4];[.E51]-[.E$4]+1) -> 7.42375319239597E-166
A52: 43 | B52: of:=[.A52]*0.01 -> 0.43 | C52: of:=[.B52]*[.C$2] -> 98900 | D52: of:=BETADIST([.C$1];[.C$4];[.C52]-[.C$4]+1) -> 0.000253917808116718 | E52: of:=[.$B52]*[.E$2] -> 5636096 | F52: of:=BETADIST([.E$1];[.E$4];[.E52]-[.E$4]+1) -> 3.75119418029125E-158
A53: 44 | B53: of:=[.A53]*0.01 -> 0.44 | C53: of:=[.B53]*[.C$2] -> 101200 | D53: of:=BETADIST([.C$1];[.C$4];[.C53]-[.C$4]+1) -> 0.00034756507127646 | E53: of:=[.$B53]*[.E$2] -> 5767168 | F53: of:=BETADIST([.E$1];[.E$4];[.E53]-[.E$4]+1) -> 9.33253193265332E-151
A54: 45 | B54: of:=[.A54]*0.01 -> 0.45 | C54: of:=[.B54]*[.C$2] -> 103500 | D54: of:=BETADIST([.C$1];[.C$4];[.C54]-[.C$4]+1) -> 0.00047021886157195 | E54: of:=[.$B54]*[.E$2] -> 5898240 | F54: of:=BETADIST([.E$1];[.E$4];[.E54]-[.E$4]+1) -> 1.18020455375279E-143
A55: 46 | B55: of:=[.A55]*0.01 -> 0.46 | C55: of:=[.B55]*[.C$2] -> 105800 | D55: of:=BETADIST([.C$1];[.C$4];[.C55]-[.C$4]+1) -> 0.000629091217634342 | E55: of:=[.$B55]*[.E$2] -> 6029312 | F55: of:=BETADIST([.E$1];[.E$4];[.E55]-[.E$4]+1) -> 7.81581770362357E-137
A56: 47 | B56: of:=[.A56]*0.01 -> 0.47 | C56: of:=[.B56]*[.C$2] -> 108100 | D56: of:=BETADIST([.C$1];[.C$4];[.C56]-[.C$4]+1) -> 0.000832704583601726 | E56: of:=[.$B56]*[.E$2] -> 6160384 | F56: of:=BETADIST([.E$1];[.E$4];[.E56]-[.E$4]+1) -> 2.78707364856636E-130
A57: 48 | B57: of:=[.A57]*0.01 -> 0.48 | C57: of:=[.B57]*[.C$2] -> 110400 | D57: of:=BETADIST([.C$1];[.C$4];[.C57]-[.C$4]+1) -> 0.00109102016800978 | E57: of:=[.$B57]*[.E$2] -> 6291456 | F57: of:=BETADIST([.E$1];[.E$4];[.E57]-[.E$4]+1) -> 5.4930466109042E-124
A58: 49 | B58: of:=[.A58]*0.01 -> 0.49 | C58: of:=[.B58]*[.C$2] -> 112700 | D58: of:=BETADIST([.C$1];[.C$4];[.C58]-[.C$4]+1) -> 0.00141555767624587 | E58: of:=[.$B58]*[.E$2] -> 6422528 | F58: of:=BETADIST([.E$1];[.E$4];[.E58]-[.E$4]+1) -> 6.13200191849905E-118
A59: 50 | B59: of:=[.A59]*0.01 -> 0.5 | C59: of:=[.B59]*[.C$2] -> 115000 | D59: of:=BETADIST([.C$1];[.C$4];[.C59]-[.C$4]+1) -> 0.00181950201264025 | E59: of:=[.$B59]*[.E$2] -> 6553600 | F59: of:=BETADIST([.E$1];[.E$4];[.E59]-[.E$4]+1) -> 3.96738984377434E-112
A60: 51 | B60: of:=[.A60]*0.01 -> 0.51 | C60: of:=[.B60]*[.C$2] -> 117300 | D60: of:=BETADIST([.C$1];[.C$4];[.C60]-[.C$4]+1) -> 0.00231779243559773 | E60: of:=[.$B60]*[.E$2] -> 6684672 | F60: of:=BETADIST([.E$1];[.E$4];[.E60]-[.E$4]+1) -> 1.5202593158599E-106
A61: 52 | B61: of:=[.A61]*0.01 -> 0.52 | C61: of:=[.B61]*[.C$2] -> 119600 | D61: of:=BETADIST([.C$1];[.C$4];[.C61]-[.C$4]+1) -> 0.00292718968511053 | E61: of:=[.$B61]*[.E$2] -> 6815744 | F61: of:=BETADIST([.E$1];[.E$4];[.E61]-[.E$4]+1) -> 3.52119887684091E-101
A62: 53 | B62: of:=[.A62]*0.01 -> 0.53 | C62: of:=[.B62]*[.C$2] -> 121900 | D62: of:=BETADIST([.C$1];[.C$4];[.C62]-[.C$4]+1) -> 0.00366631679464803 | E62: of:=[.$B62]*[.E$2] -> 6946816 | F62: of:=BETADIST([.E$1];[.E$4];[.E62]-[.E$4]+1) -> 5.02537429384454E-096
A63: 54 | B63: of:=[.A63]*0.01 -> 0.54 | C63: of:=[.B63]*[.C$2] -> 124200 | D63: of:=BETADIST([.C$1];[.C$4];[.C63]-[.C$4]+1) -> 0.00455566965047397 | E63: of:=[.$B63]*[.E$2] -> 7077888 | F63: of:=BETADIST([.E$1];[.E$4];[.E63]-[.E$4]+1) -> 4.50017068314709E-091
A64: 55 | B64: of:=[.A64]*0.01 -> 0.55 | C64: of:=[.B64]*[.C$2] -> 126500 | D64: of:=BETADIST([.C$1];[.C$4];[.C64]-[.C$4]+1) -> 0.00561759386595258 | E64: of:=[.$B64]*[.E$2] -> 7208960 | F64: of:=BETADIST([.E$1];[.E$4];[.E64]-[.E$4]+1) -> 2.57227393577003E-086
A65: 56 | B65: of:=[.A65]*0.01 -> 0.56 | C65: of:=[.B65]*[.C$2] -> 128800 | D65: of:=BETADIST([.C$1];[.C$4];[.C65]-[.C$4]+1) -> 0.00687622518492841 | E65: of:=[.$B65]*[.E$2] -> 7340032 | F65: of:=BETADIST([.E$1];[.E$4];[.E65]-[.E$4]+1) -> 9.53842224013587E-082
A66: 57 | B66: of:=[.A66]*0.01 -> 0.57 | C66: of:=[.B66]*[.C$2] -> 131100 | D66: of:=BETADIST([.C$1];[.C$4];[.C66]-[.C$4]+1) -> 0.00835739139940713 | E66: of:=[.$B66]*[.E$2] -> 7471104 | F66: of:=BETADIST([.E$1];[.E$4];[.E66]-[.E$4]+1) -> 2.33011530074619E-077
A67: 58 | B67: of:=[.A67]*0.01 -> 0.58 | C67: of:=[.B67]*[.C$2] -> 133400 | D67: of:=BETADIST([.C$1];[.C$4];[.C67]-[.C$4]+1) -> 0.0100884746398325 | E67: of:=[.$B67]*[.E$2] -> 7602176 | F67: of:=BETADIST([.E$1];[.E$4];[.E67]-[.E$4]+1) -> 3.80490069452395E-073
A68: 59 | B68: of:=[.A68]*0.01 -> 0.59 | C68: of:=[.B68]*[.C$2] -> 135700 | D68: of:=BETADIST([.C$1];[.C$4];[.C68]-[.C$4]+1) -> 0.0120982338443214 | E68: of:=[.$B68]*[.E$2] -> 7733248 | F68: of:=BETADIST([.E$1];[.E$4];[.E68]-[.E$4]+1) -> 4.21089763386292E-069
A69: 60 | B69: of:=[.A69]*0.01 -> 0.6 | C69: of:=[.B69]*[.C$2] -> 138000 | D69: of:=BETADIST([.C$1];[.C$4];[.C69]-[.C$4]+1) -> 0.0144165882062995 | E69: of:=[.$B69]*[.E$2] -> 7864320 | F69: of:=BETADIST([.E$1];[.E$4];[.E69]-[.E$4]+1) -> 3.20015204542272E-065
A70: 61 | B70: of:=[.A70]*0.01 -> 0.61 | C70: of:=[.B70]*[.C$2] -> 140300 | D70: of:=BETADIST([.C$1];[.C$4];[.C70]-[.C$4]+1) -> 0.0170743634062077 | E70: of:=[.$B70]*[.E$2] -> 7995392 | F70: of:=BETADIST([.E$1];[.E$4];[.E70]-[.E$4]+1) -> 1.69102109381563E-061
A71: 62 | B71: of:=[.A71]*0.01 -> 0.62 | C71: of:=[.B71]*[.C$2] -> 142600 | D71: of:=BETADIST([.C$1];[.C$4];[.C71]-[.C$4]+1) -> 0.0201030034199575 | E71: of:=[.$B71]*[.E$2] -> 8126464 | F71: of:=BETADIST([.E$1];[.E$4];[.E71]-[.E$4]+1) -> 6.28731253209176E-058
A72: 63 | B72: of:=[.A72]*0.01 -> 0.63 | C72: of:=[.B72]*[.C$2] -> 144900 | D72: of:=BETADIST([.C$1];[.C$4];[.C72]-[.C$4]+1) -> 0.0235342516331668 | E72: of:=[.$B72]*[.E$2] -> 8257536 | F72: of:=BETADIST([.E$1];[.E$4];[.E72]-[.E$4]+1) -> 1.66351993047494E-054
A73: 64 | B73: of:=[.A73]*0.01 -> 0.64 | C73: of:=[.B73]*[.C$2] -> 147200 | D73: of:=BETADIST([.C$1];[.C$4];[.C73]-[.C$4]+1) -> 0.0273998058461898 | E73: of:=[.$B73]*[.E$2] -> 8388608 | F73: of:=BETADIST([.E$1];[.E$4];[.E73]-[.E$4]+1) -> 3.16604499200216E-051
A74: 65 | B74: of:=[.A74]*0.01 -> 0.65 | C74: of:=[.B74]*[.C$2] -> 149500 | D74: of:=BETADIST([.C$1];[.C$4];[.C74]-[.C$4]+1) -> 0.0317309525042564 | E74: of:=[.$B74]*[.E$2] -> 8519680 | F74: of:=BETADIST([.E$1];[.E$4];[.E74]-[.E$4]+1) -> 4.37921000753516E-048
A75: 66 | B75: of:=[.A75]*0.01 -> 0.66 | C75: of:=[.B75]*[.C$2] -> 151800 | D75: of:=BETADIST([.C$1];[.C$4];[.C75]-[.C$4]+1) -> 0.0365581861070941 | E75: of:=[.$B75]*[.E$2] -> 8650752 | F75: of:=BETADIST([.E$1];[.E$4];[.E75]-[.E$4]+1) -> 4.44554791208134E-045
A76: 67 | B76: of:=[.A76]*0.01 -> 0.67 | C76: of:=[.B76]*[.C$2] -> 154100 | D76: of:=BETADIST([.C$1];[.C$4];[.C76]-[.C$4]+1) -> 0.041910820225422 | E76: of:=[.$B76]*[.E$2] -> 8781824 | F76: of:=BETADIST([.E$1];[.E$4];[.E76]-[.E$4]+1) -> 3.34331265829314E-042
A77: 68 | B77: of:=[.A77]*0.01 -> 0.68 | C77: of:=[.B77]*[.C$2] -> 156400 | D77: of:=BETADIST([.C$1];[.C$4];[.C77]-[.C$4]+1) -> 0.0478165968651168 | E77: of:=[.$B77]*[.E$2] -> 8912896 | F77: of:=BETADIST([.E$1];[.E$4];[.E77]-[.E$4]+1) -> 1.87950662566541E-039
A78: 69 | B78: of:=[.A78]*0.01 -> 0.69 | C78: of:=[.B78]*[.C$2] -> 158700 | D78: of:=BETADIST([.C$1];[.C$4];[.C78]-[.C$4]+1) -> 0.0543013010664482 | E78: of:=[.$B78]*[.E$2] -> 9043968 | F78: of:=BETADIST([.E$1];[.E$4];[.E78]-[.E$4]+1) -> 7.96620130173471E-037
A79: 70 | B79: of:=[.A79]*0.01 -> 0.7 | C79: of:=[.B79]*[.C$2] -> 161000 | D79: of:=BETADIST([.C$1];[.C$4];[.C79]-[.C$4]+1) -> 0.0613883876036338 | E79: of:=[.$B79]*[.E$2] -> 9175040 | F79: of:=BETADIST([.E$1];[.E$4];[.E79]-[.E$4]+1) -> 2.56665204137018E-034
A80: 71 | B80: of:=[.A80]*0.01 -> 0.71 | C80: of:=[.B80]*[.C$2] -> 163300 | D80: of:=BETADIST([.C$1];[.C$4];[.C80]-[.C$4]+1) -> 0.0690986264629808 | E80: of:=[.$B80]*[.E$2] -> 9306112 | F80: of:=BETADIST([.E$1];[.E$4];[.E80]-[.E$4]+1) -> 6.33593189310457E-032
A81: 72 | B81: of:=[.A81]*0.01 -> 0.72 | C81: of:=[.B81]*[.C$2] -> 165600 | D81: of:=BETADIST([.C$1];[.C$4];[.C81]-[.C$4]+1) -> 0.0774497734340343 | E81: of:=[.$B81]*[.E$2] -> 9437184 | F81: of:=BETADIST([.E$1];[.E$4];[.E81]-[.E$4]+1) -> 1.20742941569518E-029
A82: 73 | B82: of:=[.A82]*0.01 -> 0.73 | C82: of:=[.B82]*[.C$2] -> 167900 | D82: of:=BETADIST([.C$1];[.C$4];[.C82]-[.C$4]+1) -> 0.0864562716605687 | E82: of:=[.$B82]*[.E$2] -> 9568256 | F82: of:=BETADIST([.E$1];[.E$4];[.E82]-[.E$4]+1) -> 1.78924338077518E-027
A83: 74 | B83: of:=[.A83]*0.01 -> 0.74 | C83: of:=[.B83]*[.C$2] -> 170200 | D83: of:=BETADIST([.C$1];[.C$4];[.C83]-[.C$4]+1) -> 0.0961289893835339 | E83: of:=[.$B83]*[.E$2] -> 9699328 | F83: of:=BETADIST([.E$1];[.E$4];[.E83]-[.E$4]+1) -> 2.07614953686996E-025
A84: 75 | B84: of:=[.A84]*0.01 -> 0.75 | C84: of:=[.B84]*[.C$2] -> 172500 | D84: of:=BETADIST([.C$1];[.C$4];[.C84]-[.C$4]+1) -> 0.106474998385295 | E84: of:=[.$B84]*[.E$2] -> 9830400 | F84: of:=BETADIST([.E$1];[.E$4];[.E84]-[.E$4]+1) -> 1.89905838281663E-023
A85: 76 | B85: of:=[.A85]*0.01 -> 0.76 | C85: of:=[.B85]*[.C$2] -> 174800 | D85: of:=BETADIST([.C$1];[.C$4];[.C85]-[.C$4]+1) -> 0.117497396836347 | E85: of:=[.$B85]*[.E$2] -> 9961472 | F85: of:=BETADIST([.E$1];[.E$4];[.E85]-[.E$4]+1) -> 1.37818711925813E-021
A86: 77 | B86: of:=[.A86]*0.01 -> 0.77 | C86: of:=[.B86]*[.C$2] -> 177100 | D86: of:=BETADIST([.C$1];[.C$4];[.C86]-[.C$4]+1) -> 0.129195179374158 | E86: of:=[.$B86]*[.E$2] -> 10092544 | F86: of:=BETADIST([.E$1];[.E$4];[.E86]-[.E$4]+1) -> 7.98482511263865E-020
A87: 78 | B87: of:=[.A87]*0.01 -> 0.78 | C87: of:=[.B87]*[.C$2] -> 179400 | D87: of:=BETADIST([.C$1];[.C$4];[.C87]-[.C$4]+1) -> 0.141563156334038 | E87: of:=[.$B87]*[.E$2] -> 10223616 | F87: of:=BETADIST([.E$1];[.E$4];[.E87]-[.E$4]+1) -> 3.7154467013042E-018
A88: 79 | B88: of:=[.A88]*0.01 -> 0.79 | C88: of:=[.B88]*[.C$2] -> 181700 | D88: of:=BETADIST([.C$1];[.C$4];[.C88]-[.C$4]+1) -> 0.154591923126045 | E88: of:=[.$B88]*[.E$2] -> 10354688 | F88: of:=BETADIST([.E$1];[.E$4];[.E88]-[.E$4]+1) -> 1.39654924151186E-016
A89: 80 | B89: of:=[.A89]*0.01 -> 0.8 | C89: of:=[.B89]*[.C$2] -> 184000 | D89: of:=BETADIST([.C$1];[.C$4];[.C89]-[.C$4]+1) -> 0.168267879834517 | E89: of:=[.$B89]*[.E$2] -> 10485760 | F89: of:=BETADIST([.E$1];[.E$4];[.E89]-[.E$4]+1) -> 4.26411104292549E-015
A90: 81 | B90: of:=[.A90]*0.01 -> 0.81 | C90: of:=[.B90]*[.C$2] -> 186300 | D90: of:=BETADIST([.C$1];[.C$4];[.C90]-[.C$4]+1) -> 0.182573300227107 | E90: of:=[.$B90]*[.E$2] -> 10616832 | F90: of:=BETADIST([.E$1];[.E$4];[.E90]-[.E$4]+1) -> 0.000000000000106335330429994
A91: 82 | B91: of:=[.A91]*0.01 -> 0.82 | C91: of:=[.B91]*[.C$2] -> 188600 | D91: of:=BETADIST([.C$1];[.C$4];[.C91]-[.C$4]+1) -> 0.197486448519516 | E91: of:=[.$B91]*[.E$2] -> 10747904 | F91: of:=BETADIST([.E$1];[.E$4];[.E91]-[.E$4]+1) -> 0.00000000000217711699723966
A92: 83 | B92: of:=[.A92]*0.01 -> 0.83 | C92: of:=[.B92]*[.C$2] -> 190900 | D92: of:=BETADIST([.C$1];[.C$4];[.C92]-[.C$4]+1) -> 0.212981741465923 | E92: of:=[.$B92]*[.E$2] -> 10878976 | F92: of:=BETADIST([.E$1];[.E$4];[.E92]-[.E$4]+1) -> 0.0000000000367835902831877
A93: 84 | B93: of:=[.A93]*0.01 -> 0.84 | C93: of:=[.B93]*[.C$2] -> 193200 | D93: of:=BETADIST([.C$1];[.C$4];[.C93]-[.C$4]+1) -> 0.229029952648296 | E93: of:=[.$B93]*[.E$2] -> 11010048 | F93: of:=BETADIST([.E$1];[.E$4];[.E93]-[.E$4]+1) -> 0.00000000051540551565106
A94: 85 | B94: of:=[.A94]*0.01 -> 0.85 | C94: of:=[.B94]*[.C$2] -> 195500 | D94: of:=BETADIST([.C$1];[.C$4];[.C94]-[.C$4]+1) -> 0.245598455231903 | E94: of:=[.$B94]*[.E$2] -> 11141120 | F94: of:=BETADIST([.E$1];[.E$4];[.E94]-[.E$4]+1) -> 0.00000000601823941547045
A95: 86 | B95: of:=[.A95]*0.01 -> 0.86 | C95: of:=[.B95]*[.C$2] -> 197800 | D95: of:=BETADIST([.C$1];[.C$4];[.C95]-[.C$4]+1) -> 0.262651498946545 | E95: of:=[.$B95]*[.E$2] -> 11272192 | F95: of:=BETADIST([.E$1];[.E$4];[.E95]-[.E$4]+1) -> 0.0000000588402246242107
A96: 87 | B96: of:=[.A96]*0.01 -> 0.87 | C96: of:=[.B96]*[.C$2] -> 200100 | D96: of:=BETADIST([.C$1];[.C$4];[.C96]-[.C$4]+1) -> 0.280150516650528 | E96: of:=[.$B96]*[.E$2] -> 11403264 | F96: of:=BETADIST([.E$1];[.E$4];[.E96]-[.E$4]+1) -> 0.000000483935517067103
A97: 88 | B97: of:=[.A97]*0.01 -> 0.88 | C97: of:=[.B97]*[.C$2] -> 202400 | D97: of:=BETADIST([.C$1];[.C$4];[.C97]-[.C$4]+1) -> 0.298054455538083 | E97: of:=[.$B97]*[.E$2] -> 11534336 | F97: of:=BETADIST([.E$1];[.E$4];[.E97]-[.E$4]+1) -> 0.00000336362600445642
A98: 89 | B98: of:=[.A98]*0.01 -> 0.89 | C98: of:=[.B98]*[.C$2] -> 204700 | D98: of:=BETADIST([.C$1];[.C$4];[.C98]-[.C$4]+1) -> 0.316320127861065 | E98: of:=[.$B98]*[.E$2] -> 11665408 | F98: of:=BETADIST([.E$1];[.E$4];[.E98]-[.E$4]+1) -> 0.0000198481650462804
A99: 90 | B99: of:=[.A99]*0.01 -> 0.9 | C99: of:=[.B99]*[.C$2] -> 207000 | D99: of:=BETADIST([.C$1];[.C$4];[.C99]-[.C$4]+1) -> 0.334902575949491 | E99: of:=[.$B99]*[.E$2] -> 11796480 | F99: of:=BETADIST([.E$1];[.E$4];[.E99]-[.E$4]+1) -> 0.0000998876868677271
A100: 91 | B100: of:=[.A100]*0.01 -> 0.91 | C100: of:=[.B100]*[.C$2] -> 209300 | D100: of:=BETADIST([.C$1];[.C$4];[.C100]-[.C$4]+1) -> 0.353755446329322 | E100: of:=[.$B100]*[.E$2] -> 11927552 | F100: of:=BETADIST([.E$1];[.E$4];[.E100]-[.E$4]+1) -> 0.000430712732693875
A101: 92 | B101: of:=[.A101]*0.01 -> 0.92 | C101: of:=[.B101]*[.C$2] -> 211600 | D101: of:=BETADIST([.C$1];[.C$4];[.C101]-[.C$4]+1) -> 0.372831367839518 | E101: of:=[.$B101]*[.E$2] -> 12058624 | F101: of:=BETADIST([.E$1];[.E$4];[.E101]-[.E$4]+1) -> 0.00159879897036069
A102: 93 | B102: of:=[.A102]*0.01 -> 0.93 | C102: of:=[.B102]*[.C$2] -> 213900 | D102: of:=BETADIST([.C$1];[.C$4];[.C102]-[.C$4]+1) -> 0.392082328839661 | E102: of:=[.$B102]*[.E$2] -> 12189696 | F102: of:=BETADIST([.E$1];[.E$4];[.E102]-[.E$4]+1) -> 0.00513388325060598
A103: 94 | B103: of:=[.A103]*0.01 -> 0.94 | C103: of:=[.B103]*[.C$2] -> 216200 | D103: of:=BETADIST([.C$1];[.C$4];[.C103]-[.C$4]+1) -> 0.411460048861491 | E103: of:=[.$B103]*[.E$2] -> 12320768 | F103: of:=BETADIST([.E$1];[.E$4];[.E103]-[.E$4]+1) -> 0.0143339353985786
A104: 95 | B104: of:=[.A104]*0.01 -> 0.95 | C104: of:=[.B104]*[.C$2] -> 218500 | D104: of:=BETADIST([.C$1];[.C$4];[.C104]-[.C$4]+1) -> 0.430916340383982 | E104: of:=[.$B104]*[.E$2] -> 12451840 | F104: of:=BETADIST([.E$1];[.E$4];[.E104]-[.E$4]+1) -> 0.0349885722882768
A105: 96 | B105: of:=[.A105]*0.01 -> 0.96 | C105: of:=[.B105]*[.C$2] -> 220800 | D105: of:=BETADIST([.C$1];[.C$4];[.C105]-[.C$4]+1) -> 0.450403456790081 | E105: of:=[.$B105]*[.E$2] -> 12582912 | F105: of:=BETADIST([.E$1];[.E$4];[.E105]-[.E$4]+1) -> 0.075112975352188
A106: 97 | B106: of:=[.A106]*0.01 -> 0.97 | C106: of:=[.B106]*[.C$2] -> 223100 | D106: of:=BETADIST([.C$1];[.C$4];[.C106]-[.C$4]+1) -> 0.469874422983483 | E106: of:=[.$B106]*[.E$2] -> 12713984 | F106: of:=BETADIST([.E$1];[.E$4];[.E106]-[.E$4]+1) -> 0.142759921000588
A107: 98 | B107: of:=[.A107]*0.01 -> 0.98 | C107: of:=[.B107]*[.C$2] -> 225400 | D107: of:=BETADIST([.C$1];[.C$4];[.C107]-[.C$4]+1) -> 0.489283345593943 | E107: of:=[.$B107]*[.E$2] -> 12845056 | F107: of:=BETADIST([.E$1];[.E$4];[.E107]-[.E$4]+1) -> 0.242021451484101
A108: 99 | B108: of:=[.A108]*0.01 -> 0.99 | C108: of:=[.B108]*[.C$2] -> 227700 | D108: of:=BETADIST([.C$1];[.C$4];[.C108]-[.C$4]+1) -> 0.508585700169326 | E108: of:=[.$B108]*[.E$2] -> 12976128 | F108: of:=BETADIST([.E$1];[.E$4];[.E108]-[.E$4]+1) -> 0.369141193567754
A109: 100 | B109: of:=[.A109]*0.01 -> 1 | C109: of:=[.B109]*[.C$2] -> 230000 | D109: of:=BETADIST([.C$1];[.C$4];[.C109]-[.C$4]+1) -> 0.527738593228228 | E109: of:=[.$B109]*[.E$2] -> 13107200 | F109: of:=BETADIST([.E$1];[.E$4];[.E109]-[.E$4]+1) -> 0.511607969543909
A110: 101 | B110: of:=[.A110]*0.01 -> 1.01 | C110: of:=[.B110]*[.C$2] -> 232300 | D110: of:=BETADIST([.C$1];[.C$4];[.C110]-[.C$4]+1) -> 0.546700997562031 | E110: of:=[.$B110]*[.E$2] -> 13238272 | F110: of:=BETADIST([.E$1];[.E$4];[.E110]-[.E$4]+1) -> 0.651701100628451
A111: 102 | B111: of:=[.A111]*0.01 -> 1.02 | C111: of:=[.B111]*[.C$2] -> 234600 | D111: of:=BETADIST([.C$1];[.C$4];[.C111]-[.C$4]+1) -> 0.565433959512132 | E111: of:=[.$B111]*[.E$2] -> 13369344 | F111: of:=BETADIST([.E$1];[.E$4];[.E111]-[.E$4]+1) -> 0.772878922824374
A112: 103 | B112: of:=[.A112]*0.01 -> 1.03 | C112: of:=[.B112]*[.C$2] -> 236900 | D112: of:=BETADIST([.C$1];[.C$4];[.C112]-[.C$4]+1) -> 0.583900777653305 | E112: of:=[.$B112]*[.E$2] -> 13500416 | F112: of:=BETADIST([.E$1];[.E$4];[.E112]-[.E$4]+1) -> 0.865306302689761
A113: 104 | B113: of:=[.A113]*0.01 -> 1.04 | C113: of:=[.B113]*[.C$2] -> 239200 | D113: of:=BETADIST([.C$1];[.C$4];[.C113]-[.C$4]+1) -> 0.602067152487044 | E113: of:=[.$B113]*[.E$2] -> 13631488 | F113: of:=BETADIST([.E$1];[.E$4];[.E113]-[.E$4]+1) -> 0.927620436933033
A114: 105 | B114: of:=[.A114]*0.01 -> 1.05 | C114: of:=[.B114]*[.C$2] -> 241500 | D114: of:=BETADIST([.C$1];[.C$4];[.C114]-[.C$4]+1) -> 0.61990130728645 | E114: of:=[.$B114]*[.E$2] -> 13762560 | F114: of:=BETADIST([.E$1];[.E$4];[.E114]-[.E$4]+1) -> 0.96484147717825
A115: 106 | B115: of:=[.A115]*0.01 -> 1.06 | C115: of:=[.B115]*[.C$2] -> 243800 | D115: of:=BETADIST([.C$1];[.C$4];[.C115]-[.C$4]+1) -> 0.637374080491026 | E115: of:=[.$B115]*[.E$2] -> 13893632 | F115: of:=BETADIST([.E$1];[.E$4];[.E115]-[.E$4]+1) -> 0.984583226186919
A116: 107 | B116: of:=[.A116]*0.01 -> 1.07 | C116: of:=[.B116]*[.C$2] -> 246100 | D116: of:=BETADIST([.C$1];[.C$4];[.C116]-[.C$4]+1) -> 0.654458990682301 | E116: of:=[.$B116]*[.E$2] -> 14024704 | F116: of:=BETADIST([.E$1];[.E$4];[.E116]-[.E$4]+1) -> 0.993901378249156
A117: 108 | B117: of:=[.A117]*0.01 -> 1.08 | C117: of:=[.B117]*[.C$2] -> 248400 | D117: of:=BETADIST([.C$1];[.C$4];[.C117]-[.C$4]+1) -> 0.67113227495672 | E117: of:=[.$B117]*[.E$2] -> 14155776 | F117: of:=BETADIST([.E$1];[.E$4];[.E117]-[.E$4]+1) -> 0.997823731145609
A118: 109 | B118: of:=[.A118]*0.01 -> 1.09 | C118: of:=[.B118]*[.C$2] -> 250700 | D118: of:=BETADIST([.C$1];[.C$4];[.C118]-[.C$4]+1) -> 0.687372902290399 | E118: of:=[.$B118]*[.E$2] -> 14286848 | F118: of:=BETADIST([.E$1];[.E$4];[.E118]-[.E$4]+1) -> 0.999299222607906
A119: 110 | B119: of:=[.A119]*0.01 -> 1.1 | C119: of:=[.B119]*[.C$2] -> 253000 | D119: of:=BETADIST([.C$1];[.C$4];[.C119]-[.C$4]+1) -> 0.70316256328871 | E119: of:=[.$B119]*[.E$2] -> 14417920 | F119: of:=BETADIST([.E$1];[.E$4];[.E119]-[.E$4]+1) -> 0.999796245200501
A120: 111 | B120: of:=[.A120]*0.01 -> 1.11 | C120: of:=[.B120]*[.C$2] -> 255300 | D120: of:=BETADIST([.C$1];[.C$4];[.C120]-[.C$4]+1) -> 0.718485638168674 | E120: of:=[.$B120]*[.E$2] -> 14548992 | F120: of:=BETADIST([.E$1];[.E$4];[.E120]-[.E$4]+1) -> 0.999946461778187
A121: 112 | B121: of:=[.A121]*0.01 -> 1.12 | C121: of:=[.B121]*[.C$2] -> 257600 | D121: of:=BETADIST([.C$1];[.C$4];[.C121]-[.C$4]+1) -> 0.733329144799535 | E121: of:=[.$B121]*[.E$2] -> 14680064 | F121: of:=BETADIST([.E$1];[.E$4];[.E121]-[.E$4]+1) -> 0.999987274198818
A122: 113 | B122: of:=[.A122]*0.01 -> 1.13 | C122: of:=[.B122]*[.C$2] -> 259900 | D122: of:=BETADIST([.C$1];[.C$4];[.C122]-[.C$4]+1) -> 0.747682668717066 | E122: of:=[.$B122]*[.E$2] -> 14811136 | F122: of:=BETADIST([.E$1];[.E$4];[.E122]-[.E$4]+1) -> 0.999997260586479
A123: 114 | B123: of:=[.A123]*0.01 -> 1.14 | C123: of:=[.B123]*[.C$2] -> 262200 | D123: of:=BETADIST([.C$1];[.C$4];[.C123]-[.C$4]+1) -> 0.761538277239375 | E123: of:=[.$B123]*[.E$2] -> 14942208 | F123: of:=BETADIST([.E$1];[.E$4];[.E123]-[.E$4]+1) -> 0.999999465309434
A124: 115 | B124: of:=[.A124]*0.01 -> 1.15 | C124: of:=[.B124]*[.C$2] -> 264500 | D124: of:=BETADIST([.C$1];[.C$4];[.C124]-[.C$4]+1) -> 0.774890419578395 | E124: of:=[.$B124]*[.E$2] -> 15073280 | F124: of:=BETADIST([.E$1];[.E$4];[.E124]-[.E$4]+1) -> 0.999999905253031
A125: 116 | B125: of:=[.A125]*0.01 -> 1.16 | C125: of:=[.B125]*[.C$2] -> 266800 | D125: of:=BETADIST([.C$1];[.C$4];[.C125]-[.C$4]+1) -> 0.787735815153742 | E125: of:=[.$B125]*[.E$2] -> 15204352 | F125: of:=BETADIST([.E$1];[.E$4];[.E125]-[.E$4]+1) -> 0.999999984738139
A126: 117 | B126: of:=[.A126]*0.01 -> 1.17 | C126: of:=[.B126]*[.C$2] -> 269100 | D126: of:=BETADIST([.C$1];[.C$4];[.C126]-[.C$4]+1) -> 0.800073331923364 | E126: of:=[.$B126]*[.E$2] -> 15335424 | F126: of:=BETADIST([.E$1];[.E$4];[.E126]-[.E$4]+1) -> 0.999999997762308
A127: 118 | B127: of:=[.A127]*0.01 -> 1.18 | C127: of:=[.B127]*[.C$2] -> 271400 | D127: of:=BETADIST([.C$1];[.C$4];[.C127]-[.C$4]+1) -> 0.811903856829745 | E127: of:=[.$B127]*[.E$2] -> 15466496 | F127: of:=BETADIST([.E$1];[.E$4];[.E127]-[.E$4]+1) -> 0.999999999700966
A128: 119 | B128: of:=[.A128]*0.01 -> 1.19 | C128: of:=[.B128]*[.C$2] -> 273700 | D128: of:=BETADIST([.C$1];[.C$4];[.C128]-[.C$4]+1) -> 0.823230160169054 | E128: of:=[.$B128]*[.E$2] -> 15597568 | F128: of:=BETADIST([.E$1];[.E$4];[.E128]-[.E$4]+1) -> 0.999999999963529
A129: 120 | B129: of:=[.A129]*0.01 -> 1.2 | C129: of:=[.B129]*[.C$2] -> 276000 | D129: of:=BETADIST([.C$1];[.C$4];[.C129]-[.C$4]+1) -> 0.834056755604805 | E129: of:=[.$B129]*[.E$2] -> 15728640 | F129: of:=BETADIST([.E$1];[.E$4];[.E129]-[.E$4]+1) -> 0.999999999995935
A130: 121 | B130: of:=[.A130]*0.01 -> 1.21 | C130: of:=[.B130]*[.C$2] -> 278300 | D130: of:=BETADIST([.C$1];[.C$4];[.C130]-[.C$4]+1) -> 0.844389757608123 | E130: of:=[.$B130]*[.E$2] -> 15859712 | F130: of:=BETADIST([.E$1];[.E$4];[.E130]-[.E$4]+1) -> 0.999999999999585
A131: 122 | B131: of:=[.A131]*0.01 -> 1.22 | C131: of:=[.B131]*[.C$2] -> 280600 | D131: of:=BETADIST([.C$1];[.C$4];[.C131]-[.C$4]+1) -> 0.854236737734414 | E131: of:=[.$B131]*[.E$2] -> 15990784 | F131: of:=BETADIST([.E$1];[.E$4];[.E131]-[.E$4]+1) -> 0.999999999999961
A132: 123 | B132: of:=[.A132]*0.01 -> 1.23 | C132: of:=[.B132]*[.C$2] -> 282900 | D132: of:=BETADIST([.C$1];[.C$4];[.C132]-[.C$4]+1) -> 0.86360658127522 | E132: of:=[.$B132]*[.E$2] -> 16121856 | F132: of:=BETADIST([.E$1];[.E$4];[.E132]-[.E$4]+1) -> 0.999999999999997
A133: 124 | B133: of:=[.A133]*0.01 -> 1.24 | C133: of:=[.B133]*[.C$2] -> 285200 | D133: of:=BETADIST([.C$1];[.C$4];[.C133]-[.C$4]+1) -> 0.872509345442022 | E133: of:=[.$B133]*[.E$2] -> 16252928 | F133: of:=BETADIST([.E$1];[.E$4];[.E133]-[.E$4]+1) -> 1
A134: 125 | B134: of:=[.A134]*0.01 -> 1.25 | C134: of:=[.B134]*[.C$2] -> 287500 | D134: of:=BETADIST([.C$1];[.C$4];[.C134]-[.C$4]+1) -> 0.880956120338735 | E134: of:=[.$B134]*[.E$2] -> 16384000 | F134: of:=BETADIST([.E$1];[.E$4];[.E134]-[.E$4]+1) -> 1
A135: 126 | B135: of:=[.A135]*0.01 -> 1.26 | C135: of:=[.B135]*[.C$2] -> 289800 | D135: of:=BETADIST([.C$1];[.C$4];[.C135]-[.C$4]+1) -> 0.888958893659587 | E135: of:=[.$B135]*[.E$2] -> 16515072 | F135: of:=BETADIST([.E$1];[.E$4];[.E135]-[.E$4]+1) -> 1
A136: 127 | B136: of:=[.A136]*0.01 -> 1.27 | C136: of:=[.B136]*[.C$2] -> 292100 | D136: of:=BETADIST([.C$1];[.C$4];[.C136]-[.C$4]+1) -> 0.896530420010182 | E136: of:=[.$B136]*[.E$2] -> 16646144 | F136: of:=BETADIST([.E$1];[.E$4];[.E136]-[.E$4]+1) -> 1
A137: 128 | B137: of:=[.A137]*0.01 -> 1.28 | C137: of:=[.B137]*[.C$2] -> 294400 | D137: of:=BETADIST([.C$1];[.C$4];[.C137]-[.C$4]+1) -> 0.903684095593658 | E137: of:=[.$B137]*[.E$2] -> 16777216 | F137: of:=BETADIST([.E$1];[.E$4];[.E137]-[.E$4]+1) -> 1
A138: 129 | B138: of:=[.A138]*0.01 -> 1.29 | C138: of:=[.B138]*[.C$2] -> 296700 | D138: of:=BETADIST([.C$1];[.C$4];[.C138]-[.C$4]+1) -> 0.91043383883943 | E138: of:=[.$B138]*[.E$2] -> 16908288 | F138: of:=BETADIST([.E$1];[.E$4];[.E138]-[.E$4]+1) -> 1
A139: 130 | B139: of:=[.A139]*0.01 -> 1.3 | C139: of:=[.B139]*[.C$2] -> 299000 | D139: of:=BETADIST([.C$1];[.C$4];[.C139]-[.C$4]+1) -> 0.916793977526578 | E139: of:=[.$B139]*[.E$2] -> 17039360 | F139: of:=BETADIST([.E$1];[.E$4];[.E139]-[.E$4]+1) -> 1
A140: 131 | B140: of:=[.A140]*0.01 -> 1.31 | C140: of:=[.B140]*[.C$2] -> 301300 | D140: of:=BETADIST([.C$1];[.C$4];[.C140]-[.C$4]+1) -> 0.922779142719986 | E140: of:=[.$B140]*[.E$2] -> 17170432 | F140: of:=BETADIST([.E$1];[.E$4];[.E140]-[.E$4]+1) -> 1
A141: 132 | B141: of:=[.A141]*0.01 -> 1.32 | C141: of:=[.B141]*[.C$2] -> 303600 | D141: of:=BETADIST([.C$1];[.C$4];[.C141]-[.C$4]+1) -> 0.928404169807162 | E141: of:=[.$B141]*[.E$2] -> 17301504 | F141: of:=BETADIST([.E$1];[.E$4];[.E141]-[.E$4]+1) -> 1
A142: 133 | B142: of:=[.A142]*0.01 -> 1.33 | C142: of:=[.B142]*[.C$2] -> 305900 | D142: of:=BETADIST([.C$1];[.C$4];[.C142]-[.C$4]+1) -> 0.933684006810609 | E142: of:=[.$B142]*[.E$2] -> 17432576 | F142: of:=BETADIST([.E$1];[.E$4];[.E142]-[.E$4]+1) -> 1
A143: 134 | B143: of:=[.A143]*0.01 -> 1.34 | C143: of:=[.B143]*[.C$2] -> 308200 | D143: of:=BETADIST([.C$1];[.C$4];[.C143]-[.C$4]+1) -> 0.938633630054465 | E143: of:=[.$B143]*[.E$2] -> 17563648 | F143: of:=BETADIST([.E$1];[.E$4];[.E143]-[.E$4]+1) -> 1
A144: 135 | B144: of:=[.A144]*0.01 -> 1.35 | C144: of:=[.B144]*[.C$2] -> 310500 | D144: of:=BETADIST([.C$1];[.C$4];[.C144]-[.C$4]+1) -> 0.943267967160782 | E144: of:=[.$B144]*[.E$2] -> 17694720 | F144: of:=BETADIST([.E$1];[.E$4];[.E144]-[.E$4]+1) -> 1
A145: 136 | B145: of:=[.A145]*0.01 -> 1.36 | C145: of:=[.B145]*[.C$2] -> 312800 | D145: of:=BETADIST([.C$1];[.C$4];[.C145]-[.C$4]+1) -> 0.947601827333061 | E145: of:=[.$B145]*[.E$2] -> 17825792 | F145: of:=BETADIST([.E$1];[.E$4];[.E145]-[.E$4]+1) -> 1
A146: 137 | B146: of:=[.A146]*0.01 -> 1.37 | C146: of:=[.B146]*[.C$2] -> 315100 | D146: of:=BETADIST([.C$1];[.C$4];[.C146]-[.C$4]+1) -> 0.951649838762015 | E146: of:=[.$B146]*[.E$2] -> 17956864 | F146: of:=BETADIST([.E$1];[.E$4];[.E146]-[.E$4]+1) -> 1
A147: 138 | B147: of:=[.A147]*0.01 -> 1.38 | C147: of:=[.B147]*[.C$2] -> 317400 | D147: of:=BETADIST([.C$1];[.C$4];[.C147]-[.C$4]+1) -> 0.955426392971224 | E147: of:=[.$B147]*[.E$2] -> 18087936 | F147: of:=BETADIST([.E$1];[.E$4];[.E147]-[.E$4]+1) -> 1
A148: 139 | B148: of:=[.A148]*0.01 -> 1.39 | C148: of:=[.B148]*[.C$2] -> 319700 | D148: of:=BETADIST([.C$1];[.C$4];[.C148]-[.C$4]+1) -> 0.958945595865959 | E148: of:=[.$B148]*[.E$2] -> 18219008 | F148: of:=BETADIST([.E$1];[.E$4];[.E148]-[.E$4]+1) -> 1
A149: 140 | B149: of:=[.A149]*0.01 -> 1.4 | C149: of:=[.B149]*[.C$2] -> 322000 | D149: of:=BETADIST([.C$1];[.C$4];[.C149]-[.C$4]+1) -> 0.962221225194075 | E149: of:=[.$B149]*[.E$2] -> 18350080 | F149: of:=BETADIST([.E$1];[.E$4];[.E149]-[.E$4]+1) -> 1
A150: 141 | B150: of:=[.A150]*0.01 -> 1.41 | C150: of:=[.B150]*[.C$2] -> 324300 | D150: of:=BETADIST([.C$1];[.C$4];[.C150]-[.C$4]+1) -> 0.965266694120503 | E150: of:=[.$B150]*[.E$2] -> 18481152 | F150: of:=BETADIST([.E$1];[.E$4];[.E150]-[.E$4]+1) -> 1
A151: 142 | B151: of:=[.A151]*0.01 -> 1.42 | C151: of:=[.B151]*[.C$2] -> 326600 | D151: of:=BETADIST([.C$1];[.C$4];[.C151]-[.C$4]+1) -> 0.968095020577045 | E151: of:=[.$B151]*[.E$2] -> 18612224 | F151: of:=BETADIST([.E$1];[.E$4];[.E151]-[.E$4]+1) -> 1
A152: 143 | B152: of:=[.A152]*0.01 -> 1.43 | C152: of:=[.B152]*[.C$2] -> 328900 | D152: of:=BETADIST([.C$1];[.C$4];[.C152]-[.C$4]+1) -> 0.97071880203016 | E152: of:=[.$B152]*[.E$2] -> 18743296 | F152: of:=BETADIST([.E$1];[.E$4];[.E152]-[.E$4]+1) -> 1
A153: 144 | B153: of:=[.A153]*0.01 -> 1.44 | C153: of:=[.B153]*[.C$2] -> 331200 | D153: of:=BETADIST([.C$1];[.C$4];[.C153]-[.C$4]+1) -> 0.973150195311799 | E153: of:=[.$B153]*[.E$2] -> 18874368 | F153: of:=BETADIST([.E$1];[.E$4];[.E153]-[.E$4]+1) -> 1
A154: 145 | B154: of:=[.A154]*0.01 -> 1.45 | C154: of:=[.B154]*[.C$2] -> 333500 | D154: of:=BETADIST([.C$1];[.C$4];[.C154]-[.C$4]+1) -> 0.975400901137463 | E154: of:=[.$B154]*[.E$2] -> 19005440 | F154: of:=BETADIST([.E$1];[.E$4];[.E154]-[.E$4]+1) -> 1
A155: 146 | B155: of:=[.A155]*0.01 -> 1.46 | C155: of:=[.B155]*[.C$2] -> 335800 | D155: of:=BETADIST([.C$1];[.C$4];[.C155]-[.C$4]+1) -> 0.977482152933276 | E155: of:=[.$B155]*[.E$2] -> 19136512 | F155: of:=BETADIST([.E$1];[.E$4];[.E155]-[.E$4]+1) -> 1
A156: 147 | B156: of:=[.A156]*0.01 -> 1.47 | C156: of:=[.B156]*[.C$2] -> 338100 | D156: of:=BETADIST([.C$1];[.C$4];[.C156]-[.C$4]+1) -> 0.979404709613505 | E156: of:=[.$B156]*[.E$2] -> 19267584 | F156: of:=BETADIST([.E$1];[.E$4];[.E156]-[.E$4]+1) -> 1
A157: 148 | B157: of:=[.A157]*0.01 -> 1.48 | C157: of:=[.B157]*[.C$2] -> 340400 | D157: of:=BETADIST([.C$1];[.C$4];[.C157]-[.C$4]+1) -> 0.981178851936839 | E157: of:=[.$B157]*[.E$2] -> 19398656 | F157: of:=BETADIST([.E$1];[.E$4];[.E157]-[.E$4]+1) -> 1
A158: 149 | B158: of:=[.A158]*0.01 -> 1.49 | C158: of:=[.B158]*[.C$2] -> 342700 | D158: of:=BETADIST([.C$1];[.C$4];[.C158]-[.C$4]+1) -> 0.982814382081807 | E158: of:=[.$B158]*[.E$2] -> 19529728 | F158: of:=BETADIST([.E$1];[.E$4];[.E158]-[.E$4]+1) -> 1
A159: 150 | B159: of:=[.A159]*0.01 -> 1.5 | C159: of:=[.B159]*[.C$2] -> 345000 | D159: of:=BETADIST([.C$1];[.C$4];[.C159]-[.C$4]+1) -> 0.984320626111143 | E159: of:=[.$B159]*[.E$2] -> 19660800 | F159: of:=BETADIST([.E$1];[.E$4];[.E159]-[.E$4]+1) -> 1
A160: 151 | B160: of:=[.A160]*0.01 -> 1.51 | C160: of:=[.B160]*[.C$2] -> 347300 | D160: of:=BETADIST([.C$1];[.C$4];[.C160]-[.C$4]+1) -> 0.985706438975769 | E160: of:=[.$B160]*[.E$2] -> 19791872 | F160: of:=BETADIST([.E$1];[.E$4];[.E160]-[.E$4]+1) -> 1
A161: 152 | B161: of:=[.A161]*0.01 -> 1.52 | C161: of:=[.B161]*[.C$2] -> 349600 | D161: of:=BETADIST([.C$1];[.C$4];[.C161]-[.C$4]+1) -> 0.98698021176279 | E161: of:=[.$B161]*[.E$2] -> 19922944 | F161: of:=BETADIST([.E$1];[.E$4];[.E161]-[.E$4]+1) -> 1
A162: 153 | B162: of:=[.A162]*0.01 -> 1.53 | C162: of:=[.B162]*[.C$2] -> 351900 | D162: of:=BETADIST([.C$1];[.C$4];[.C162]-[.C$4]+1) -> 0.988149880877732 | E162: of:=[.$B162]*[.E$2] -> 20054016 | F162: of:=BETADIST([.E$1];[.E$4];[.E162]-[.E$4]+1) -> 1
A163: 154 | B163: of:=[.A163]*0.01 -> 1.54 | C163: of:=[.B163]*[.C$2] -> 354200 | D163: of:=BETADIST([.C$1];[.C$4];[.C163]-[.C$4]+1) -> 0.989222938882163 | E163: of:=[.$B163]*[.E$2] -> 20185088 | F163: of:=BETADIST([.E$1];[.E$4];[.E163]-[.E$4]+1) -> 1
A164: 155 | B164: of:=[.A164]*0.01 -> 1.55 | C164: of:=[.B164]*[.C$2] -> 356500 | D164: of:=BETADIST([.C$1];[.C$4];[.C164]-[.C$4]+1) -> 0.990206446731264 | E164: of:=[.$B164]*[.E$2] -> 20316160 | F164: of:=BETADIST([.E$1];[.E$4];[.E164]-[.E$4]+1) -> 1
A165: 156 | B165: of:=[.A165]*0.01 -> 1.56 | C165: of:=[.B165]*[.C$2] -> 358800 | D165: of:=BETADIST([.C$1];[.C$4];[.C165]-[.C$4]+1) -> 0.991107047162091 | E165: of:=[.$B165]*[.E$2] -> 20447232 | F165: of:=BETADIST([.E$1];[.E$4];[.E165]-[.E$4]+1) -> 1
A166: 157 | B166: of:=[.A166]*0.01 -> 1.57 | C166: of:=[.B166]*[.C$2] -> 361100 | D166: of:=BETADIST([.C$1];[.C$4];[.C166]-[.C$4]+1) -> 0.991930979011003 | E166: of:=[.$B166]*[.E$2] -> 20578304 | F166: of:=BETADIST([.E$1];[.E$4];[.E166]-[.E$4]+1) -> 1
A167: 158 | B167: of:=[.A167]*0.01 -> 1.58 | C167: of:=[.B167]*[.C$2] -> 363400 | D167: of:=BETADIST([.C$1];[.C$4];[.C167]-[.C$4]+1) -> 0.992684092255533 | E167: of:=[.$B167]*[.E$2] -> 20709376 | F167: of:=BETADIST([.E$1];[.E$4];[.E167]-[.E$4]+1) -> 1
A168: 159 | B168: of:=[.A168]*0.01 -> 1.59 | C168: of:=[.B168]*[.C$2] -> 365700 | D168: of:=BETADIST([.C$1];[.C$4];[.C168]-[.C$4]+1) -> 0.993371863592037 | E168: of:=[.$B168]*[.E$2] -> 20840448 | F168: of:=BETADIST([.E$1];[.E$4];[.E168]-[.E$4]+1) -> 1
A169: 160 | B169: of:=[.A169]*0.01 -> 1.6 | C169: of:=[.B169]*[.C$2] -> 368000 | D169: of:=BETADIST([.C$1];[.C$4];[.C169]-[.C$4]+1) -> 0.993999412382323 | E169: of:=[.$B169]*[.E$2] -> 20971520 | F169: of:=BETADIST([.E$1];[.E$4];[.E169]-[.E$4]+1) -> 1
A170: 161 | B170: of:=[.A170]*0.01 -> 1.61 | C170: of:=[.B170]*[.C$2] -> 370300 | D170: of:=BETADIST([.C$1];[.C$4];[.C170]-[.C$4]+1) -> 0.994571516815683 | E170: of:=[.$B170]*[.E$2] -> 21102592 | F170: of:=BETADIST([.E$1];[.E$4];[.E170]-[.E$4]+1) -> 1
A171: 162 | B171: of:=[.A171]*0.01 -> 1.62 | C171: of:=[.B171]*[.C$2] -> 372600 | D171: of:=BETADIST([.C$1];[.C$4];[.C171]-[.C$4]+1) -> 0.995092630151422 | E171: of:=[.$B171]*[.E$2] -> 21233664 | F171: of:=BETADIST([.E$1];[.E$4];[.E171]-[.E$4]+1) -> 1
A172: 163 | B172: of:=[.A172]*0.01 -> 1.63 | C172: of:=[.B172]*[.C$2] -> 374900 | D172: of:=BETADIST([.C$1];[.C$4];[.C172]-[.C$4]+1) -> 0.995566896923374 | E172: of:=[.$B172]*[.E$2] -> 21364736 | F172: of:=BETADIST([.E$1];[.E$4];[.E172]-[.E$4]+1) -> 1
A173: 164 | B173: of:=[.A173]*0.01 -> 1.64 | C173: of:=[.B173]*[.C$2] -> 377200 | D173: of:=BETADIST([.C$1];[.C$4];[.C173]-[.C$4]+1) -> 0.995998169001371 | E173: of:=[.$B173]*[.E$2] -> 21495808 | F173: of:=BETADIST([.E$1];[.E$4];[.E173]-[.E$4]+1) -> 1
A174: 165 | B174: of:=[.A174]*0.01 -> 1.65 | C174: of:=[.B174]*[.C$2] -> 379500 | D174: of:=BETADIST([.C$1];[.C$4];[.C174]-[.C$4]+1) -> 0.996390021417725 | E174: of:=[.$B174]*[.E$2] -> 21626880 | F174: of:=BETADIST([.E$1];[.E$4];[.E174]-[.E$4]+1) -> 1
A175: 166 | B175: of:=[.A175]*0.01 -> 1.66 | C175: of:=[.B175]*[.C$2] -> 381800 | D175: of:=BETADIST([.C$1];[.C$4];[.C175]-[.C$4]+1) -> 0.996745767883838 | E175: of:=[.$B175]*[.E$2] -> 21757952 | F175: of:=BETADIST([.E$1];[.E$4];[.E175]-[.E$4]+1) -> 1
A176: 167 | B176: of:=[.A176]*0.01 -> 1.67 | C176: of:=[.B176]*[.C$2] -> 384100 | D176: of:=BETADIST([.C$1];[.C$4];[.C176]-[.C$4]+1) -> 0.997068475928338 | E176: of:=[.$B176]*[.E$2] -> 21889024 | F176: of:=BETADIST([.E$1];[.E$4];[.E176]-[.E$4]+1) -> 1
A177: 168 | B177: of:=[.A177]*0.01 -> 1.68 | C177: of:=[.B177]*[.C$2] -> 386400 | D177: of:=BETADIST([.C$1];[.C$4];[.C177]-[.C$4]+1) -> 0.997360981604779 | E177: of:=[.$B177]*[.E$2] -> 22020096 | F177: of:=BETADIST([.E$1];[.E$4];[.E177]-[.E$4]+1) -> 1
A178: 169 | B178: of:=[.A178]*0.01 -> 1.69 | C178: of:=[.B178]*[.C$2] -> 388700 | D178: of:=BETADIST([.C$1];[.C$4];[.C178]-[.C$4]+1) -> 0.997625903722784 | E178: of:=[.$B178]*[.E$2] -> 22151168 | F178: of:=BETADIST([.E$1];[.E$4];[.E178]-[.E$4]+1) -> 1
A179: 170 | B179: of:=[.A179]*0.01 -> 1.7 | C179: of:=[.B179]*[.C$2] -> 391000 | D179: of:=BETADIST([.C$1];[.C$4];[.C179]-[.C$4]+1) -> 0.997865657568434 | E179: of:=[.$B179]*[.E$2] -> 22282240 | F179: of:=BETADIST([.E$1];[.E$4];[.E179]-[.E$4]+1) -> 1
A180: 171 | B180: of:=[.A180]*0.01 -> 1.71 | C180: of:=[.B180]*[.C$2] -> 393300 | D180: of:=BETADIST([.C$1];[.C$4];[.C180]-[.C$4]+1) -> 0.998082468086977 | E180: of:=[.$B180]*[.E$2] -> 22413312 | F180: of:=BETADIST([.E$1];[.E$4];[.E180]-[.E$4]+1) -> 1
A181: 172 | B181: of:=[.A181]*0.01 -> 1.72 | C181: of:=[.B181]*[.C$2] -> 395600 | D181: of:=BETADIST([.C$1];[.C$4];[.C181]-[.C$4]+1) -> 0.998278382508921 | E181: of:=[.$B181]*[.E$2] -> 22544384 | F181: of:=BETADIST([.E$1];[.E$4];[.E181]-[.E$4]+1) -> 1
A182: 173 | B182: of:=[.A182]*0.01 -> 1.73 | C182: of:=[.B182]*[.C$2] -> 397900 | D182: of:=BETADIST([.C$1];[.C$4];[.C182]-[.C$4]+1) -> 0.998455282406285 | E182: of:=[.$B182]*[.E$2] -> 22675456 | F182: of:=BETADIST([.E$1];[.E$4];[.E182]-[.E$4]+1) -> 1
A183: 174 | B183: of:=[.A183]*0.01 -> 1.74 | C183: of:=[.B183]*[.C$2] -> 400200 | D183: of:=BETADIST([.C$1];[.C$4];[.C183]-[.C$4]+1) -> 0.99861489517291 | E183: of:=[.$B183]*[.E$2] -> 22806528 | F183: of:=BETADIST([.E$1];[.E$4];[.E183]-[.E$4]+1) -> 1
A184: 175 | B184: of:=[.A184]*0.01 -> 1.75 | C184: of:=[.B184]*[.C$2] -> 402500 | D184: of:=BETADIST([.C$1];[.C$4];[.C184]-[.C$4]+1) -> 0.998758804927087 | E184: of:=[.$B184]*[.E$2] -> 22937600 | F184: of:=BETADIST([.E$1];[.E$4];[.E184]-[.E$4]+1) -> 1
A185: 176 | B185: of:=[.A185]*0.01 -> 1.76 | C185: of:=[.B185]*[.C$2] -> 404800 | D185: of:=BETADIST([.C$1];[.C$4];[.C185]-[.C$4]+1) -> 0.998888462840134 | E185: of:=[.$B185]*[.E$2] -> 23068672 | F185: of:=BETADIST([.E$1];[.E$4];[.E185]-[.E$4]+1) -> 1
A186: 177 | B186: of:=[.A186]*0.01 -> 1.77 | C186: of:=[.B186]*[.C$2] -> 407100 | D186: of:=BETADIST([.C$1];[.C$4];[.C186]-[.C$4]+1) -> 0.999005196896673 | E186: of:=[.$B186]*[.E$2] -> 23199744 | F186: of:=BETADIST([.E$1];[.E$4];[.E186]-[.E$4]+1) -> 1
A187: 178 | B187: of:=[.A187]*0.01 -> 1.78 | C187: of:=[.B187]*[.C$2] -> 409400 | D187: of:=BETADIST([.C$1];[.C$4];[.C187]-[.C$4]+1) -> 0.999110221098432 | E187: of:=[.$B187]*[.E$2] -> 23330816 | F187: of:=BETADIST([.E$1];[.E$4];[.E187]-[.E$4]+1) -> 1
A188: 179 | B188: of:=[.A188]*0.01 -> 1.79 | C188: of:=[.B188]*[.C$2] -> 411700 | D188: of:=BETADIST([.C$1];[.C$4];[.C188]-[.C$4]+1) -> 0.999204644123111 | E188: of:=[.$B188]*[.E$2] -> 23461888 | F188: of:=BETADIST([.E$1];[.E$4];[.E188]-[.E$4]+1) -> 1
A189: 180 | B189: of:=[.A189]*0.01 -> 1.8 | C189: of:=[.B189]*[.C$2] -> 414000 | D189: of:=BETADIST([.C$1];[.C$4];[.C189]-[.C$4]+1) -> 0.999289477454717 | E189: of:=[.$B189]*[.E$2] -> 23592960 | F189: of:=BETADIST([.E$1];[.E$4];[.E189]-[.E$4]+1) -> 1
A190: 181 | B190: of:=[.A190]*0.01 -> 1.81 | C190: of:=[.B190]*[.C$2] -> 416300 | D190: of:=BETADIST([.C$1];[.C$4];[.C190]-[.C$4]+1) -> 0.999365643001829 | E190: of:=[.$B190]*[.E$2] -> 23724032 | F190: of:=BETADIST([.E$1];[.E$4];[.E190]-[.E$4]+1) -> 1
A191: 182 | B191: of:=[.A191]*0.01 -> 1.82 | C191: of:=[.B191]*[.C$2] -> 418600 | D191: of:=BETADIST([.C$1];[.C$4];[.C191]-[.C$4]+1) -> 0.999433980222885 | E191: of:=[.$B191]*[.E$2] -> 23855104 | F191: of:=BETADIST([.E$1];[.E$4];[.E191]-[.E$4]+1) -> 1
A192: 183 | B192: of:=[.A192]*0.01 -> 1.83 | C192: of:=[.B192]*[.C$2] -> 420900 | D192: of:=BETADIST([.C$1];[.C$4];[.C192]-[.C$4]+1) -> 0.999495252777875 | E192: of:=[.$B192]*[.E$2] -> 23986176 | F192: of:=BETADIST([.E$1];[.E$4];[.E192]-[.E$4]+1) -> 1
A193: 184 | B193: of:=[.A193]*0.01 -> 1.84 | C193: of:=[.B193]*[.C$2] -> 423200 | D193: of:=BETADIST([.C$1];[.C$4];[.C193]-[.C$4]+1) -> 0.999550154727201 | E193: of:=[.$B193]*[.E$2] -> 24117248 | F193: of:=BETADIST([.E$1];[.E$4];[.E193]-[.E$4]+1) -> 1
A194: 185 | B194: of:=[.A194]*0.01 -> 1.85 | C194: of:=[.B194]*[.C$2] -> 425500 | D194: of:=BETADIST([.C$1];[.C$4];[.C194]-[.C$4]+1) -> 0.999599316298523 | E194: of:=[.$B194]*[.E$2] -> 24248320 | F194: of:=BETADIST([.E$1];[.E$4];[.E194]-[.E$4]+1) -> 1
A195: 186 | B195: of:=[.A195]*0.01 -> 1.86 | C195: of:=[.B195]*[.C$2] -> 427800 | D195: of:=BETADIST([.C$1];[.C$4];[.C195]-[.C$4]+1) -> 0.999643309243035 | E195: of:=[.$B195]*[.E$2] -> 24379392 | F195: of:=BETADIST([.E$1];[.E$4];[.E195]-[.E$4]+1) -> 1
A196: 187 | B196: of:=[.A196]*0.01 -> 1.87 | C196: of:=[.B196]*[.C$2] -> 430100 | D196: of:=BETADIST([.C$1];[.C$4];[.C196]-[.C$4]+1) -> 0.999682651802437 | E196: of:=[.$B196]*[.E$2] -> 24510464 | F196: of:=BETADIST([.E$1];[.E$4];[.E196]-[.E$4]+1) -> 1
A197: 188 | B197: of:=[.A197]*0.01 -> 1.88 | C197: of:=[.B197]*[.C$2] -> 432400 | D197: of:=BETADIST([.C$1];[.C$4];[.C197]-[.C$4]+1) -> 0.999717813307815 | E197: of:=[.$B197]*[.E$2] -> 24641536 | F197: of:=BETADIST([.E$1];[.E$4];[.E197]-[.E$4]+1) -> 1
A198: 189 | B198: of:=[.A198]*0.01 -> 1.89 | C198: of:=[.B198]*[.C$2] -> 434700 | D198: of:=BETADIST([.C$1];[.C$4];[.C198]-[.C$4]+1) -> 0.999749218431416 | E198: of:=[.$B198]*[.E$2] -> 24772608 | F198: of:=BETADIST([.E$1];[.E$4];[.E198]-[.E$4]+1) -> 1
A199: 190 | B199: of:=[.A199]*0.01 -> 1.9 | C199: of:=[.B199]*[.C$2] -> 437000 | D199: of:=BETADIST([.C$1];[.C$4];[.C199]-[.C$4]+1) -> 0.999777251111797 | E199: of:=[.$B199]*[.E$2] -> 24903680 | F199: of:=BETADIST([.E$1];[.E$4];[.E199]-[.E$4]+1) -> 1
A200: 191 | B200: of:=[.A200]*0.01 -> 1.91 | C200: of:=[.B200]*[.C$2] -> 439300 | D200: of:=BETADIST([.C$1];[.C$4];[.C200]-[.C$4]+1) -> 0.999802258172361 | E200: of:=[.$B200]*[.E$2] -> 25034752 | F200: of:=BETADIST([.E$1];[.E$4];[.E200]-[.E$4]+1) -> 1
A201: 192 | B201: of:=[.A201]*0.01 -> 1.92 | C201: of:=[.B201]*[.C$2] -> 441600 | D201: of:=BETADIST([.C$1];[.C$4];[.C201]-[.C$4]+1) -> 0.999824552652782 | E201: of:=[.$B201]*[.E$2] -> 25165824 | F201: of:=BETADIST([.E$1];[.E$4];[.E201]-[.E$4]+1) -> 1
A202: 193 | B202: of:=[.A202]*0.01 -> 1.93 | C202: of:=[.B202]*[.C$2] -> 443900 | D202: of:=BETADIST([.C$1];[.C$4];[.C202]-[.C$4]+1) -> 0.999844416871867 | E202: of:=[.$B202]*[.E$2] -> 25296896 | F202: of:=BETADIST([.E$1];[.E$4];[.E202]-[.E$4]+1) -> 1
A203: 194 | B203: of:=[.A203]*0.01 -> 1.94 | C203: of:=[.B203]*[.C$2] -> 446200 | D203: of:=BETADIST([.C$1];[.C$4];[.C203]-[.C$4]+1) -> 0.999862105240038 | E203: of:=[.$B203]*[.E$2] -> 25427968 | F203: of:=BETADIST([.E$1];[.E$4];[.E203]-[.E$4]+1) -> 1
A204: 195 | B204: of:=[.A204]*0.01 -> 1.95 | C204: of:=[.B204]*[.C$2] -> 448500 | D204: of:=BETADIST([.C$1];[.C$4];[.C204]-[.C$4]+1) -> 0.999877846838568 | E204: of:=[.$B204]*[.E$2] -> 25559040 | F204: of:=BETADIST([.E$1];[.E$4];[.E204]-[.E$4]+1) -> 1
A205: 196 | B205: of:=[.A205]*0.01 -> 1.96 | C205: of:=[.B205]*[.C$2] -> 450800 | D205: of:=BETADIST([.C$1];[.C$4];[.C205]-[.C$4]+1) -> 0.999891847782055 | E205: of:=[.$B205]*[.E$2] -> 25690112 | F205: of:=BETADIST([.E$1];[.E$4];[.E205]-[.E$4]+1) -> 1
A206: 197 | B206: of:=[.A206]*0.01 -> 1.97 | C206: of:=[.B206]*[.C$2] -> 453100 | D206: of:=BETADIST([.C$1];[.C$4];[.C206]-[.C$4]+1) -> 0.999904293379747 | E206: of:=[.$B206]*[.E$2] -> 25821184 | F206: of:=BETADIST([.E$1];[.E$4];[.E206]-[.E$4]+1) -> 1
A207: 198 | B207: of:=[.A207]*0.01 -> 1.98 | C207: of:=[.B207]*[.C$2] -> 455400 | D207: of:=BETADIST([.C$1];[.C$4];[.C207]-[.C$4]+1) -> 0.999915350110576 | E207: of:=[.$B207]*[.E$2] -> 25952256 | F207: of:=BETADIST([.E$1];[.E$4];[.E207]-[.E$4]+1) -> 1
A208: 199 | B208: of:=[.A208]*0.01 -> 1.99 | C208: of:=[.B208]*[.C$2] -> 457700 | D208: of:=BETADIST([.C$1];[.C$4];[.C208]-[.C$4]+1) -> 0.999925167425871 | E208: of:=[.$B208]*[.E$2] -> 26083328 | F208: of:=BETADIST([.E$1];[.E$4];[.E208]-[.E$4]+1) -> 1
A209: 200 | B209: of:=[.A209]*0.01 -> 2 | C209: of:=[.B209]*[.C$2] -> 460000 | D209: of:=BETADIST([.C$1];[.C$4];[.C209]-[.C$4]+1) -> 0.99993387939296 | E209: of:=[.$B209]*[.E$2] -> 26214400 | F209: of:=BETADIST([.E$1];[.E$4];[.E209]-[.E$4]+1) -> 1

Sheet: Feuille2
A1: N | B1: safe allocation value in words
A2: k is chosen for l/N being around 10
A3: 0.0001 | C3: k | D3: 22 | F3: 14 | H3: 80
C4: l/N | D4: 10 | F4: 10 | H4: 10
D6: Sampling rate, t < | E6: Control | F6: Sampling rate, t < | G6: Contrôle | H6: Sampling rate, t < | I6: Control
D7: of:="1E-14" -> 1E-14 | F7: of:="1E-9" -> 1E-9 | H7: of:="1E-50" -> 1E-50
B8: N*8 (in KiB) | C8: N | D8: of:="k="&[.D$3]&", t < "&[.D$7]&", l/N="&[.D$4] -> k=22, t < 1E-14, l/N=10 | E8: of:="P(N) < "&[.D$7] -> P(N) < 1E-14 | F8: of:="k="&[.F$3]&", t < "&[.F$7]&", l/N="&[.F$4] -> k=14, t < 1E-9, l/N=10 | G8: of:="P(N) < "&[.F$7] -> P(N) < 1E-9 | H8: of:="k="&[.H$3]&", t < "&[.H$7]&", l/N="&[.H$4] -> k=80, t < 1E-50, l/N=10 | I8: of:="P(N) < "&[.H$7] -> P(N) < 1E-50 | J8: Default sampling rate
A9: 10 | B9: of:=EXP(LN(1000)/[.A$9])^[.A9]/1000 -> 1 | C9: of:=[.B9]/8*1024 -> 128 | D9: of:=[.D$3]/([.D$4]*[.$C9]) -> 0.0171875 | E9: of:=BETADIST([.D9];[.D$3];[.$C9]-[.D$31]+1) -> 0.0000000000000237201573552809 | F9: of:=[.F$3]/([.F$4]*[.$C9]) -> 0.0109375 | G9: of:=BETADIST([.F9];[.F$3];[.$C9]-[.F$3]+1) -> 0.00000000018990727938971 | H9: of:=[.H$3]/([.H$4]*[.$C9]) -> 0.0625 | I9: of:=BETADIST([.H9];[.H$3];[.$C9]-[.H$3]+1) -> 9.55053433158657E-063 | J9: of:=[.$A$3] -> 0.0001
A10: 11 | B10: of:=EXP(LN(1000)/[.A$9])^[.A10]/1000 -> 1.99526231496888 | C10: of:=[.B10]/8*1024 -> 255.393576316017 | D10: of:=[.D$3]/([.D$4]*[.$C10]) -> 0.00861415557796873 | E10: of:=BETADIST([.D10];[.D$3];[.$C10]-[.D$31]+1) -> 9.65844393216533E-015 | F10: of:=[.F$3]/([.F$4]*[.$C10]) -> 0.00548173536779828 | G10: of:=BETADIST([.F10];[.F$3];[.$C10]-[.F$3]+1) -> 0.000000000258017185862005 | H10: of:=[.H$3]/([.H$4]*[.$C10]) -> 0.0313242021017045 | I10: of:=BETADIST([.H10];[.H$3];[.$C10]-[.H$3]+1) -> 9.14741821369707E-056 | J10: of:=[.$A$3] -> 0.0001
A11: 12 | B11: of:=EXP(LN(1000)/[.A$9])^[.A11]/1000 -> 3.98107170553498 | C11: of:=[.B11]/8*1024 -> 509.577178308477 | D11: of:=[.D$3]/([.D$4]*[.$C11]) -> 0.00431730480415709 | E11: of:=BETADIST([.D11];[.D$3];[.$C11]-[.D$31]+1) -> 6.04209587755825E-015 | F11: of:=[.F$3]/([.F$4]*[.$C11]) -> 0.0027473757844636 | G11: of:=BETADIST([.F11];[.F$3];[.$C11]-[.F$3]+1) -> 0.000000000299353317911495 | H11: of:=[.H$3]/([.H$4]*[.$C11]) -> 0.0156992901969349 | I11: of:=BETADIST([.H11];[.H$3];[.$C11]-[.H$3]+1) -> 4.29915464612902E-053 | J11: of:=[.$A$3] -> 0.0001
A12: 13 | B12: of:=EXP(LN(1000)/[.A$9])^[.A12]/1000 -> 7.94328234724282 | C12: of:=[.B12]/8*1024 -> 1016.74014044708 | D12: of:=[.D$3]/([.D$4]*[.$C12]) -> 0.00216377805152123 | E12: of:=BETADIST([.D12];[.D$3];[.$C12]-[.D$31]+1) -> 4.75212798394632E-015 | F12: of:=[.F$3]/([.F$4]*[.$C12]) -> 0.00137694966914987 | G12: of:=BETADIST([.F12];[.F$3];[.$C12]-[.F$3]+1) -> 0.000000000322113012565797 | H12: of:=[.H$3]/([.H$4]*[.$C12]) -> 0.00786828382371354 | I12: of:=BETADIST([.H12];[.H$3];[.$C12]-[.H$3]+1) -> 6.82573247039833E-052 | J12: of:=[.$A$3] -> 0.0001
A13: 14 | B13: of:=EXP(LN(1000)/[.A$9])^[.A13]/1000 -> 15.8489319246112 | C13: of:=[.B13]/8*1024 -> 2028.66328635023 | D13: of:=[.D$3]/([.D$4]*[.$C13]) -> 0.00108445793582533 | E13: of:=BETADIST([.D13];[.D$3];[.$C13]-[.D$31]+1) -> 4.20767060364396E-015 | F13: of:=[.F$3]/([.F$4]*[.$C13]) -> 0.00069010959552521 | G13: of:=BETADIST([.F13];[.F$3];[.$C13]-[.F$3]+1) -> 0.000000000334064729033209 | H13: of:=[.H$3]/([.H$4]*[.$C13]) -> 0.0039434834030012 | I13: of:=BETADIST([.H13];[.H$3];[.$C13]-[.H$3]+1) -> 2.5493699164771E-051 | J13: of:=[.$A$3] -> 0.0001
A14: 15 | B14: of:=EXP(LN(1000)/[.A$9])^[.A14]/1000 -> 31.6227766016838 | C14: of:=[.B14]/8*1024 -> 4047.71540501553 | D14: of:=[.D$3]/([.D$4]*[.$C14]) -> 0.00054351647284144 | E14: of:=BETADIST([.D14];[.D$3];[.$C14]-[.D$31]+1) -> 3.9573928844034E-015 | F14: of:=[.F$3]/([.F$4]*[.$C14]) -> 0.000345874119080916 | G14: of:=BETADIST([.F14];[.F$3];[.$C14]-[.F$3]+1) -> 0.00000000034019579145798 | H14: of:=[.H$3]/([.H$4]*[.$C14]) -> 0.00197642353760524 | I14: of:=BETADIST([.H14];[.H$3];[.$C14]-[.H$3]+1) -> 4.85708968051785E-051 | J14: of:=[.$A$3] -> 0.0001
A15: 16 | B15: of:=EXP(LN(1000)/[.A$9])^[.A15]/1000 -> 63.0957344480194 | C15: of:=[.B15]/8*1024 -> 8076.25400934648 | D15: of:=[.D$3]/([.D$4]*[.$C15]) -> 0.000272403517454254 | E15: of:=BETADIST([.D15];[.D$3];[.$C15]-[.D$31]+1) -> 3.83728523310981E-015 | F15: of:=[.F$3]/([.F$4]*[.$C15]) -> 0.000173347692925434 | G15: of:=BETADIST([.F15];[.F$3];[.$C15]-[.F$3]+1) -> 0.000000000343304555989614 | H15: of:=[.H$3]/([.H$4]*[.$C15]) -> 0.000990558245288195 | I15: of:=BETADIST([.H15];[.H$3];[.$C15]-[.H$3]+1) -> 6.68365619901578E-051 | J15: of:=[.$A$3] -> 0.0001
A16: 17 | B16: of:=EXP(LN(1000)/[.A$9])^[.A16]/1000 -> 125.892541179417 | C16: of:=[.B16]/8*1024 -> 16114.2452709654 | D16: of:=[.D$3]/([.D$4]*[.$C16]) -> 0.000136525165343235 | E16: of:=BETADIST([.D16];[.D$3];[.$C16]-[.D$31]+1) -> 3.77838547212355E-015 | F16: of:=[.F$3]/([.F$4]*[.$C16]) -> 0.000086879650672968 | G16: of:=BETADIST([.F16];[.F$3];[.$C16]-[.F$3]+1) -> 0.000000000344871728137913 | H16: of:=[.H$3]/([.H$4]*[.$C16]) -> 0.000496455146702675 | I16: of:=BETADIST([.H16];[.H$3];[.$C16]-[.H$3]+1) -> 7.83585913028721E-051 | J16: of:=[.$A$3] -> 0.0001
A17: 18 | B17: of:=EXP(LN(1000)/[.A$9])^[.A17]/1000 -> 251.188643150958 | C17: of:=[.B17]/8*1024 -> 32152.1463233227 | D17: of:=[.D$3]/([.D$4]*[.$C17]) -> 0.0000684246699388822 | E17: of:=BETADIST([.D17];[.D$3];[.$C17]-[.D$31]+1) -> 3.74918623668157E-015 | F17: of:=[.F$3]/([.F$4]*[.$C17]) -> 0.0000435429717792887 | G17: of:=BETADIST([.F17];[.F$3];[.$C17]-[.F$3]+1) -> 0.000000000345659468958004 | H17: of:=[.H$3]/([.H$4]*[.$C17]) -> 0.000248816981595935 | I17: of:=BETADIST([.H17];[.H$3];[.$C17]-[.H$3]+1) -> 8.48403675064488E-051 | J17: of:=[.$A$3] -> 0.0001
A18: 19 | B18: of:=EXP(LN(1000)/[.A$9])^[.A18]/1000 -> 501.187233627273 | C18: of:=[.B18]/8*1024 -> 64151.9659042909 | D18: of:=[.D$3]/([.D$4]*[.$C18]) -> 0.0000342935710385276 | E18: of:=BETADIST([.D18];[.D$3];[.$C18]-[.D$31]+1) -> 3.73463183828374E-015 | F18: of:=[.F$3]/([.F$4]*[.$C18]) -> 0.0000218231815699721 | G18: of:=BETADIST([.F18];[.F$3];[.$C18]-[.F$3]+1) -> 0.000000000346054851945125 | H18: of:=[.H$3]/([.H$4]*[.$C18]) -> 0.000124703894685555 | I18: of:=BETADIST([.H18];[.H$3];[.$C18]-[.H$3]+1) -> 8.8282756817571E-051 | J18: of:=[.$A$3] -> 0.0001
A19: 20 | B19: of:=EXP(LN(1000)/[.A$9])^[.A19]/1000 -> 1000 | C19: of:=[.B19]/8*1024 -> 128000 | D19: of:=[.D$3]/([.D$4]*[.$C19]) -> 0.0000171875 | E19: of:=BETADIST([.D19];[.D$3];[.$C19]-[.D$31]+1) -> 3.72735734606044E-015 | F19: of:=[.F$3]/([.F$4]*[.$C19]) -> 0.0000109375 | G19: of:=BETADIST([.F19];[.F$3];[.$C19]-[.F$3]+1) -> 0.000000000346253158009378 | H19: of:=[.H$3]/([.H$4]*[.$C19]) -> 0.0000624999999999999 | I19: of:=BETADIST([.H19];[.H$3];[.$C19]-[.H$3]+1) -> 9.00589028915368E-051 | J19: of:=[.$A$3] -> 0.0001
A20: 21 | B20: of:=EXP(LN(1000)/[.A$9])^[.A20]/1000 -> 1995.26231496888 | C20: of:=[.B20]/8*1024 -> 255393.576316017 | D20: of:=[.D$3]/([.D$4]*[.$C20]) -> 0.00000861415557796873 | E20: of:=BETADIST([.D20];[.D$3];[.$C20]-[.D$31]+1) -> 3.72371647376456E-015 | F20: of:=[.F$3]/([.F$4]*[.$C20]) -> 0.00000548173536779828 | G20: of:=BETADIST([.F20];[.F$3];[.$C20]-[.F$3]+1) -> 0.000000000346352582956519 | H20: of:=[.H$3]/([.H$4]*[.$C20]) -> 0.0000313242021017045 | I20: of:=BETADIST([.H20];[.H$3];[.$C20]-[.H$3]+1) -> 9.09621455848309E-051 | J20: of:=[.$A$3] -> 0.0001
A21: 22 | B21: of:=EXP(LN(1000)/[.A$9])^[.A21]/1000 -> 3981.07170553498 | C21: of:=[.B21]/8*1024 -> 509577.178308477 | D21: of:=[.D$3]/([.D$4]*[.$C21]) -> 0.00000431730480415709 | E21: of:=BETADIST([.D21];[.D$3];[.$C21]-[.D$31]+1) -> 3.72189297232929E-015 | F21: of:=[.F$3]/([.F$4]*[.$C21]) -> 0.0000027473757844636 | G21: of:=BETADIST([.F21];[.F$3];[.$C21]-[.F$3]+1) -> 0.000000000346402422636083 | H21: of:=[.H$3]/([.H$4]*[.$C21]) -> 0.0000156992901969349 | I21: of:=BETADIST([.H21];[.H$3];[.$C21]-[.H$3]+1) -> 9.14181564776612E-051 | J21: of:=[.$A$3] -> 0.0001
A22: 23 | B22: of:=EXP(LN(1000)/[.A$9])^[.A22]/1000 -> 7943.28234724283 | C22: of:=[.B22]/8*1024 -> 1016740.14044708 | D22: of:=[.D$3]/([.D$4]*[.$C22]) -> 0.00000216377805152123 | E22: of:=BETADIST([.D22];[.D$3];[.$C22]-[.D$31]+1) -> 3.72097937234499E-015 | F22: of:=[.F$3]/([.F$4]*[.$C22]) -> 0.00000137694966914987 | G22: of:=BETADIST([.F22];[.F$3];[.$C22]-[.F$3]+1) -> 0.000000000346427403949735 | H22: of:=[.H$3]/([.H$4]*[.$C22]) -> 0.00000786828382371353 | I22: of:=BETADIST([.H22];[.H$3];[.$C22]-[.H$3]+1) -> 9.16475411800285E-051 | J22: of:=[.$A$3] -> 0.0001
A23: 24 | B23: of:=EXP(LN(1000)/[.A$9])^[.A23]/1000 -> 15848.9319246112 | C23: of:=[.B23]/8*1024 -> 2028663.28635023 | D23: of:=[.D$3]/([.D$4]*[.$C23]) -> 0.00000108445793582533 | E23: of:=BETADIST([.D23];[.D$3];[.$C23]-[.D$31]+1) -> 3.72052156696537E-015 | F23: of:=[.F$3]/([.F$4]*[.$C23]) -> 0.00000069010959552521 | G23: of:=BETADIST([.F23];[.F$3];[.$C23]-[.F$3]+1) -> 0.000000000346439924843617 | H23: of:=[.H$3]/([.H$4]*[.$C23]) -> 0.0000039434834030012 | I23: of:=BETADIST([.H23];[.H$3];[.$C23]-[.H$3]+1) -> 9.17627169113135E-051 | J23: of:=[.$A$3] -> 0.0001
A24: 25 | B24: of:=EXP(LN(1000)/[.A$9])^[.A24]/1000 -> 31622.7766016838 | C24: of:=[.B24]/8*1024 -> 4047715.40501553 | D24: of:=[.D$3]/([.D$4]*[.$C24]) -> 0.00000054351647284144 | E24: of:=BETADIST([.D24];[.D$3];[.$C24]-[.D$31]+1) -> 3.72029214066268E-015 | F24: of:=[.F$3]/([.F$4]*[.$C24]) -> 0.000000345874119080916 | G24: of:=BETADIST([.F24];[.F$3];[.$C24]-[.F$3]+1) -> 0.000000000346446200301053 | H24: of:=[.H$3]/([.H$4]*[.$C24]) -> 0.00000197642353760523 | I24: of:=BETADIST([.H24];[.H$3];[.$C24]-[.H$3]+1) -> 9.18204946038083E-051 | J24: of:=[.$A$3] -> 0.0001
A25: 26 | B25: of:=EXP(LN(1000)/[.A$9])^[.A25]/1000 -> 63095.7344480194 | C25: of:=[.B25]/8*1024 -> 8076254.00934649 | D25: of:=[.D$3]/([.D$4]*[.$C25]) -> 0.000000272403517454253 | E25: of:=BETADIST([.D25];[.D$3];[.$C25]-[.D$31]+1) -> 3.72017716012941E-015 | F25: of:=[.F$3]/([.F$4]*[.$C25]) -> 0.000000173347692925434 | G25: of:=BETADIST([.F25];[.F$3];[.$C25]-[.F$3]+1) -> 0.000000000346449345516712 | H25: of:=[.H$3]/([.H$4]*[.$C25]) -> 0.000000990558245288194 | I25: of:=BETADIST([.H25];[.H$3];[.$C25]-[.H$3]+1) -> 9.18494653896794E-051 | J25: of:=[.$A$3] -> 0.0001
A26: 27 | B26: of:=EXP(LN(1000)/[.A$9])^[.A26]/1000 -> 125892.541179417 | C26: of:=[.B26]/8*1024 -> 16114245.2709654 | D26: of:=[.D$3]/([.D$4]*[.$C26]) -> 0.000000136525165343235 | E26: of:=BETADIST([.D26];[.D$3];[.$C26]-[.D$31]+1) -> 3.72011953461E-015 | F26: of:=[.F$3]/([.F$4]*[.$C26]) -> 0.000000086879650672968 | G26: of:=BETADIST([.F26];[.F$3];[.$C26]-[.F$3]+1) -> 0.00000000034645092186781 | H26: of:=[.H$3]/([.H$4]*[.$C26]) -> 0.000000496455146702675 | I26: of:=BETADIST([.H26];[.H$3];[.$C26]-[.H$3]+1) -> 9.18639885307388E-051 | J26: of:=[.$A$3] -> 0.0001
A27: 28 | B27: of:=EXP(LN(1000)/[.A$9])^[.A27]/1000 -> 251188.643150958 | C27: of:=[.B27]/8*1024 -> 32152146.3233227 | D27: of:=[.D$3]/([.D$4]*[.$C27]) -> 0.0000000684246699388822 | E27: of:=BETADIST([.D27];[.D$3];[.$C27]-[.D$31]+1) -> 3.72009065375102E-015 | F27: of:=[.F$3]/([.F$4]*[.$C27]) -> 0.0000000435429717792887 | G27: of:=BETADIST([.F27];[.F$3];[.$C27]-[.F$3]+1) -> 0.000000000346451711917176 | H27: of:=[.H$3]/([.H$4]*[.$C27]) -> 0.000000248816981595935 | I27: of:=BETADIST([.H27];[.H$3];[.$C27]-[.H$3]+1) -> 9.1871268185974E-051 | J27: of:=[.$A$3] -> 0.0001
A28: 29 | B28: of:=EXP(LN(1000)/[.A$9])^[.A28]/1000 -> 501187.233627273 | C28: of:=[.B28]/8*1024 -> 64151965.904291 | D28: of:=[.D$3]/([.D$4]*[.$C28]) -> 0.0000000342935710385275 | E28: of:=BETADIST([.D28];[.D$3];[.$C28]-[.D$31]+1) -> 3.72007617911219E-015 | F28: of:=[.F$3]/([.F$4]*[.$C28]) -> 0.0000000218231815699721 | G28: of:=BETADIST([.F28];[.F$3];[.$C28]-[.F$3]+1) -> 0.000000000346452107880387 | H28: of:=[.H$3]/([.H$4]*[.$C28]) -> 0.000000124703894685555 | I28: of:=BETADIST([.H28];[.H$3];[.$C28]-[.H$3]+1) -> 9.1874916867933E-051 | J28: of:=[.$A$3] -> 0.0001
A29: 30 | B29: of:=EXP(LN(1000)/[.A$9])^[.A29]/1000 -> 1000000 | C29: of:=[.B29]/8*1024 -> 128000000 | D29: of:=[.D$3]/([.D$4]*[.$C29]) -> 0.0000000171875 | E29: of:=BETADIST([.D29];[.D$3];[.$C29]-[.D$31]+1) -> 3.72006892462807E-015 | F29: of:=[.F$3]/([.F$4]*[.$C29]) -> 0.0000000109375 | G29: of:=BETADIST([.F29];[.F$3];[.$C29]-[.F$3]+1) -> 0.000000000346452306332238 | H29: of:=[.H$3]/([.H$4]*[.$C29]) -> 0.0000000624999999999999 | I29: of:=BETADIST([.H29];[.H$3];[.$C29]-[.H$3]+1) -> 9.18767455938373E-051 | J29: of:=[.$A$3] -> 0.0001
A30: 31 | B30: of:=EXP(LN(1000)/[.A$9])^[.A30]/1000 -> 1995262.31496888 | C30: of:=[.B30]/8*1024 -> 255393576.316017 | D30: of:=[.D$3]/([.D$4]*[.$C30]) -> 0.00000000861415557796873 | E30: of:=BETADIST([.D30];[.D$3];[.$C30]-[.D$31]+1) -> 3.72006528877829E-015 | F30: of:=[.F$3]/([.F$4]*[.$C30]) -> 0.00000000548173536779828 | G30: of:=BETADIST([.F30];[.F$3];[.$C30]-[.F$3]+1) -> 0.000000000346452405793833 | H30: of:=[.H$3]/([.H$4]*[.$C30]) -> 0.0000000313242021017045 | I30: of:=BETADIST([.H30];[.H$3];[.$C30]-[.H$3]+1) -> 9.18776621413048E-051 | J30: of:=[.$A$3] -> 0.0001
A31: 32 | B31: of:=EXP(LN(1000)/[.A$9])^[.A31]/1000 -> 3981071.70553498 | C31: of:=[.B31]/8*1024 -> 509577178.308478 | D31: of:=[.D$3]/([.D$4]*[.$C31]) -> 0.00000000431730480415708 | E31: of:=BETADIST([.D31];[.D$3];[.$C31]-[.D$31]+1) -> 3.72006346653765E-015 | F31: of:=[.F$3]/([.F$4]*[.$C31]) -> 0.00000000274737578446359 | G31: of:=BETADIST([.F31];[.F$3];[.$C31]-[.F$3]+1) -> 0.000000000346452455642689 | H31: of:=[.H$3]/([.H$4]*[.$C31]) -> 0.0000000156992901969348 | I31: of:=BETADIST([.H31];[.H$3];[.$C31]-[.H$3]+1) -> 9.1878121506527E-051 | J31: of:=[.$A$3] -> 0.0001
A32: 33 | B32: of:=EXP(LN(1000)/[.A$9])^[.A32]/1000 -> 7943282.34724283 | C32: of:=[.B32]/8*1024 -> 1016740140.44708 | D32: of:=[.D$3]/([.D$4]*[.$C32]) -> 0.00000000216377805152123 | E32: of:=BETADIST([.D32];[.D$3];[.$C32]-[.D$31]+1) -> 3.72006255325459E-015 | F32: of:=[.F$3]/([.F$4]*[.$C32]) -> 0.00000000137694966914987 | G32: of:=BETADIST([.F32];[.F$3];[.$C32]-[.F$3]+1) -> 0.000000000346452480626327 | H32: of:=[.H$3]/([.H$4]*[.$C32]) -> 0.00000000786828382371353 | I32: of:=BETADIST([.H32];[.H$3];[.$C32]-[.H$3]+1) -> 9.18783517353885E-051 | J32: of:=[.$A$3] -> 0.0001
A33: 34 | B33: of:=EXP(LN(1000)/[.A$9])^[.A33]/1000 -> 15848931.9246112 | C33: of:=[.B33]/8*1024 -> 2028663286.35023 | D33: of:=[.D$3]/([.D$4]*[.$C33]) -> 0.00000000108445793582533 | E33: of:=BETADIST([.D33];[.D$3];[.$C33]-[.D$31]+1) -> 3.72006209552877E-015 | F33: of:=[.F$3]/([.F$4]*[.$C33]) -> 0.00000000069010959552521 | G33: of:=BETADIST([.F33];[.F$3];[.$C33]-[.F$3]+1) -> 0.00000000034645249314782 | H33: of:=[.H$3]/([.H$4]*[.$C33]) -> 0.0000000039434834030012 | I33: of:=BETADIST([.H33];[.H$3];[.$C33]-[.H$3]+1) -> 9.18784671233572E-051 | J33: of:=[.$A$3] -> 0.0001
A34: 35 | B34: of:=EXP(LN(1000)/[.A$9])^[.A34]/1000 -> 31622776.6016839 | C34: of:=[.B34]/8*1024 -> 4047715405.01554 | D34: of:=[.D$3]/([.D$4]*[.$C34]) -> 0.000000000543516472841438 | E34: of:=BETADIST([.D34];[.D$3];[.$C34]-[.D$31]+1) -> 3.72006186612247E-015 | F34: of:=[.F$3]/([.F$4]*[.$C34]) -> 0.000000000345874119080915 | G34: of:=BETADIST([.F34];[.F$3];[.$C34]-[.F$3]+1) -> 0.000000000346452499423413 | H34: of:=[.H$3]/([.H$4]*[.$C34]) -> 0.00000000197642353760523 | I34: of:=BETADIST([.H34];[.H$3];[.$C34]-[.H$3]+1) -> 9.18785249543492E-051 | J34: of:=[.$A$3] -> 0.0001
A35: 36 | B35: of:=EXP(LN(1000)/[.A$9])^[.A35]/1000 -> 63095734.4480195 | C35: of:=[.B35]/8*1024 -> 8076254009.34649 | D35: of:=[.D$3]/([.D$4]*[.$C35]) -> 0.000000000272403517454253 | E35: of:=BETADIST([.D35];[.D$3];[.$C35]-[.D$31]+1) -> 3.72006175114698E-015 | F35: of:=[.F$3]/([.F$4]*[.$C35]) -> 0.000000000173347692925434 | G35: of:=BETADIST([.F35];[.F$3];[.$C35]-[.F$3]+1) -> 0.000000000346452502568652 | H35: of:=[.H$3]/([.H$4]*[.$C35]) -> 0.000000000990558245288194 | I35: of:=BETADIST([.H35];[.H$3];[.$C35]-[.H$3]+1) -> 9.18785539385758E-051 | J35: of:=[.$A$3] -> 0.0001
A36: 37 | B36: of:=EXP(LN(1000)/[.A$9])^[.A36]/1000 -> 125892541.179417 | C36: of:=[.B36]/8*1024 -> 16114245270.9654 | D36: of:=[.D$3]/([.D$4]*[.$C36]) -> 0.000000000136525165343235 | E36: of:=BETADIST([.D36];[.D$3];[.$C36]-[.D$31]+1) -> 3.72006169352269E-015 | F36: of:=[.F$3]/([.F$4]*[.$C36]) -> 0.000000000086879650672968 | G36: of:=BETADIST([.F36];[.F$3];[.$C36]-[.F$3]+1) -> 0.000000000346452504145007 | H36: of:=[.H$3]/([.H$4]*[.$C36]) -> 0.000000000496455146702675 | I36: of:=BETADIST([.H36];[.H$3];[.$C36]-[.H$3]+1) -> 9.18785684650562E-051 | J36: of:=[.$A$3] -> 0.0001

Sheet: Feuille3
A1: p | B1: sampling rate | C1: of:="1E-4" -> 1E-4
A2: N | B2: lower bound on the maximal n reaching the target
C4: target : | D4: of:="4E-15" -> 4E-15 | F4: (l-N)/N | G4: target : | H4: of:="1E-9" -> 1E-9 | J4: (l-N)/N | K4: target : | L4: of:="1E-50" -> 1E-50 | N4: (l-N)/N
A5: k | B5: of:="l (in KiB)" -> l (in KiB) | C5: N | D5: of:="t < "&[.D4] -> t < 4E-15 | E5: N (in KiB) | F5: of:="t < "&[.D4]&", p="&[.$C$1]&"" -> t < 4E-15, p=1E-4 | G5: n | H5: of:="t < "&[.H4] -> t < 1E-9 | I5: n (in KiB) | J5: of:="t < "&[.H4]&", p="&[.$C$1]&"" -> t < 1E-9, p=1E-4 | K5: n | L5: of:="t < "&[.L4] -> t < 1E-50 | M5: n (in KiB) | N5: of:="t < "&[.L4]&", p="&[.$C$1]&"" -> t < 1E-50, p=1E-4 | O5: l/N=10
A6: 1 | B6: of:=[.A6]/[.$C$1]*8/1024 -> 78.125 | C6: 0 | D6: of:=BETADIST([.$C$1];[.$A6];[.C6]-[.$A6]+1) ->  | E6: of:=[.C6]*8/1024 -> 0 | F6: of:=[.$B6]/[.E6]-1 ->  | G6: 0 | H6: of:=BETADIST([.$C$1];[.$A6];[.G6]-[.$A6]+1) ->  | I6: of:=[.G6]*8/1024 -> 0 | J6: of:=[.$B6]/[.I6]-1 ->  | K6: 0 | L6: of:=BETADIST([.$C$1];[.$A6];[.K6]-[.$A6]+1) ->  | M6: of:=[.K6]*8/1024 -> 0 | N6: of:=[.$B6]/[.M6]-1 ->  | O6: 9
A7: 2 | B7: of:=[.A7]/[.$C$1]*8/1024 -> 156.25 | C7: 0 | D7: of:=BETADIST([.$C$1];[.$A7];[.C7]-[.$A7]+1) ->  | E7: of:=[.C7]*8/1024 -> 0 | F7: of:=[.$B7]/[.E7]-1 ->  | G7: 1.16 | H7: of:=BETADIST([.$C$1];[.$A7];[.G7]-[.$A7]+1) -> 0.000000000928051971586067 | I7: of:=[.G7]*8/1024 -> 0.0090625 | J7: of:=[.$B7]/[.I7]-1 -> 17240.3793103448 | K7: 0 | L7: of:=BETADIST([.$C$1];[.$A7];[.K7]-[.$A7]+1) ->  | M7: of:=[.K7]*8/1024 -> 0 | N7: of:=[.$B7]/[.M7]-1 ->  | O7: 9
A8: 5 | B8: of:=[.A8]/[.$C$1]*8/1024 -> 390.625 | C8: 36 | D8: of:=BETADIST([.$C$1];[.$A8];[.C8]-[.$A8]+1) -> 3.76019355093547E-015 | E8: of:=[.C8]*8/1024 -> 0.28125 | F8: of:=[.$B8]/[.E8]-1 -> 1387.88888888889 | G8: 415 | H8: of:=BETADIST([.$C$1];[.$A8];[.G8]-[.$A8]+1) -> 0.000000000967663836121602 | I8: of:=[.G8]*8/1024 -> 3.2421875 | J8: of:=[.$B8]/[.I8]-1 -> 119.481927710843 | K8: 0 | L8: of:=BETADIST([.$C$1];[.$A8];[.K8]-[.$A8]+1) ->  | M8: of:=[.K8]*8/1024 -> 0 | N8: of:=[.$B8]/[.M8]-1 ->  | O8: 9
A9: of:=[.A6]*10 -> 10 | B9: of:=[.A9]/[.$C$1]*8/1024 -> 781.25 | C9: 1670 | D9: of:=BETADIST([.$C$1];[.$A9];[.C9]-[.$A9]+1) -> 3.89203193926106E-015 | E9: of:=[.C9]*8/1024 -> 13.046875 | F9: of:=[.$B9]/[.E9]-1 -> 58.8802395209581 | G9: 6020 | H9: of:=BETADIST([.$C$1];[.$A9];[.G9]-[.$A9]+1) -> 0.000000000991321225461172 | I9: of:=[.G9]*8/1024 -> 47.03125 | J9: of:=[.$B9]/[.I9]-1 -> 15.6112956810631 | K9: 0 | L9: of:=BETADIST([.$C$1];[.$A9];[.K9]-[.$A9]+1) ->  | M9: of:=[.K9]*8/1024 -> 0 | N9: of:=[.$B9]/[.M9]-1 ->  | O9: 9
A10: of:=[.A7]*10 -> 20 | B10: of:=[.A10]/[.$C$1]*8/1024 -> 1562.5 | C10: 17200 | D10: of:=BETADIST([.$C$1];[.$A10];[.C10]-[.$A10]+1) -> 4.07761754864348E-015 | E10: of:=[.C10]*8/1024 -> 134.375 | F10: of:=[.$B10]/[.E10]-1 -> 10.6279069767442 | G10: 34600 | H10: of:=BETADIST([.$C$1];[.$A10];[.G10]-[.$A10]+1) -> 0.000000000930155307020655 | I10: of:=[.G10]*8/1024 -> 270.3125 | J10: of:=[.$B10]/[.I10]-1 -> 4.78034682080925 | K10: 272 | L10: of:=BETADIST([.$C$1];[.$A10];[.K10]-[.$A10]+1) -> 9.63699661644203E-051 | M10: of:=[.K10]*8/1024 -> 2.125 | N10: of:=[.$B10]/[.M10]-1 -> 734.294117647059 | O10: 9
A11: 30 | B11: of:=[.A11]/[.$C$1]*8/1024 -> 2343.75 | D11: of:=BETADIST([.$C$1];[.$A11];[.C11]-[.$A11]+1) ->  | H11: of:=BETADIST([.$C$1];[.$A11];[.G11]-[.$A11]+1) ->  | K11: 2630 | L11: of:=BETADIST([.$C$1];[.$A11];[.K11]-[.$A11]+1) -> 9.85474334934846E-051 | M11: of:=[.K11]*8/1024 -> 20.546875 | N11: of:=[.$B11]/[.M11]-1 -> 113.068441064639 | O11: 9
A12: of:=[.A8]*10 -> 50 | B12: of:=[.A12]/[.$C$1]*8/1024 -> 3906.25 | C12: 129000 | D12: of:=BETADIST([.$C$1];[.$A12];[.C12]-[.$A12]+1) -> 3.69362339457326E-015 | E12: of:=[.C12]*8/1024 -> 1007.8125 | F12: of:=[.$B12]/[.E12]-1 -> 2.87596899224806 | G12: 184500 | H12: of:=BETADIST([.$C$1];[.$A12];[.G12]-[.$A12]+1) -> 0.000000000989312945034151 | I12: of:=[.G12]*8/1024 -> 1441.40625 | J12: of:=[.$B12]/[.I12]-1 -> 1.710027100271 | K12: 20290 | L12: of:=BETADIST([.$C$1];[.$A12];[.K12]-[.$A12]+1) -> 9.8470060613259E-051 | M12: of:=[.K12]*8/1024 -> 158.515625 | N12: of:=[.$B12]/[.M12]-1 -> 23.6426811237063 | O12: 9
A13: of:=[.A9]*10 -> 100 | B13: of:=[.A13]/[.$C$1]*8/1024 -> 7812.5 | C13: 408000 | D13: of:=BETADIST([.$C$1];[.$A13];[.C13]-[.$A13]+1) -> 3.96078452395453E-015 | E13: of:=[.C13]*8/1024 -> 3187.5 | F13: of:=[.$B13]/[.E13]-1 -> 1.45098039215686 | G13: 511000 | H13: of:=BETADIST([.$C$1];[.$A13];[.G13]-[.$A13]+1) -> 0.000000000956402252115602 | I13: of:=[.G13]*8/1024 -> 3992.1875 | J13: of:=[.$B13]/[.I13]-1 -> 0.956947162426614 | K13: 137600 | L13: of:=BETADIST([.$C$1];[.$A13];[.K13]-[.$A13]+1) -> 9.28587098945816E-051 | M13: of:=[.K13]*8/1024 -> 1075 | N13: of:=[.$B13]/[.M13]-1 -> 6.26744186046512 | O13: 9
A14: of:=[.A10]*10 -> 200 | B14: of:=[.A14]/[.$C$1]*8/1024 -> 15625 | C14: 1080000 | D14: of:=BETADIST([.$C$1];[.$A14];[.C14]-[.$A14]+1) -> 1.63785302308378E-015 | E14: of:=[.C14]*8/1024 -> 8437.5 | F14: of:=[.$B14]/[.E14]-1 -> 0.851851851851852 | G14: 1264000 | H14: of:=BETADIST([.$C$1];[.$A14];[.G14]-[.$A14]+1) -> 0.000000000958140517201133 | I14: of:=[.G14]*8/1024 -> 9875 | J14: of:=[.$B14]/[.I14]-1 -> 0.582278481012658 | K14: 555000 | L14: of:=BETADIST([.$C$1];[.$A14];[.K14]-[.$A14]+1) -> 9.77803385163055E-051 | M14: of:=[.K14]*8/1024 -> 4335.9375 | N14: of:=[.$B14]/[.M14]-1 -> 2.6036036036036 | O14: 9
A15: of:=[.A12]*10 -> 500 | B15: of:=[.A15]/[.$C$1]*8/1024 -> 39062.5 | C15: 3450000 | D15: of:=BETADIST([.$C$1];[.$A15];[.C15]-[.$A15]+1) -> 3.10932479057671E-015 | E15: of:=[.C15]*8/1024 -> 26953.125 | F15: of:=[.$B15]/[.E15]-1 -> 0.449275362318841 | G15: 3773000 | H15: of:=BETADIST([.$C$1];[.$A15];[.G15]-[.$A15]+1) -> 0.000000000992498674233008 | I15: of:=[.G15]*8/1024 -> 29476.5625 | J15: of:=[.$B15]/[.I15]-1 -> 0.32520540683806 | K15: 2357000 | L15: of:=BETADIST([.$C$1];[.$A15];[.K15]-[.$A15]+1) -> 9.98078698232122E-051 | M15: of:=[.K15]*8/1024 -> 18414.0625 | N15: of:=[.$B15]/[.M15]-1 -> 1.12134068731438 | O15: 9
A16: of:=[.A13]*10 -> 1000 | B16: of:=[.A16]/[.$C$1]*8/1024 -> 78125 | C16: 7700000 | D16: of:=BETADIST([.$C$1];[.$A16];[.C16]-[.$A16]+1) -> 1.28828930197189E-015 | E16: of:=[.C16]*8/1024 -> 60156.25 | F16: of:=[.$B16]/[.E16]-1 -> 0.298701298701299 | G16: 8218000 | H16: of:=BETADIST([.$C$1];[.$A16];[.G16]-[.$A16]+1) -> 0.000000000990797969960166 | I16: of:=[.G16]*8/1024 -> 64203.125 | J16: of:=[.$B16]/[.I16]-1 -> 0.216841080554879 | K16: 5987000 | L16: of:=BETADIST([.$C$1];[.$A16];[.K16]-[.$A16]+1) -> 9.58504043582877E-051 | M16: of:=[.K16]*8/1024 -> 46773.4375 | N16: of:=[.$B16]/[.M16]-1 -> 0.670285618840822 | O16: 9
A17: of:=[.A14]*10 -> 2000 | B17: of:=[.A17]/[.$C$1]*8/1024 -> 156250 | C17: 16720000 | D17: of:=BETADIST([.$C$1];[.$A17];[.C17]-[.$A17]+1) -> 3.87950764161659E-015 | E17: of:=[.C17]*8/1024 -> 130625 | F17: of:=[.$B17]/[.E17]-1 -> 0.196172248803828 | G17: 17430000 | H17: of:=BETADIST([.$C$1];[.$A17];[.G17]-[.$A17]+1) -> 0.000000000951363162784665 | I17: of:=[.G17]*8/1024 -> 136171.875 | J17: of:=[.$B17]/[.I17]-1 -> 0.147446930579461 | K17: 14040000 | L17: of:=BETADIST([.$C$1];[.$A17];[.K17]-[.$A17]+1) -> 9.60931142947321E-051 | M17: of:=[.K17]*8/1024 -> 109687.5 | N17: of:=[.$B17]/[.M17]-1 -> 0.424501424501425 | O17: 9
A18: of:=[.A15]*10 -> 5000 | B18: of:=[.A18]/[.$C$1]*8/1024 -> 390625 | C18: 44700000 | D18: of:=BETADIST([.$C$1];[.$A18];[.C18]-[.$A18]+1) -> 3.81728104031765E-015 | E18: of:=[.C18]*8/1024 -> 349218.75 | F18: of:=[.$B18]/[.E18]-1 -> 0.118568232662192 | G18: 45865000 | H18: of:=BETADIST([.$C$1];[.$A18];[.G18]-[.$A18]+1) -> 0.000000000911773254163571 | I18: of:=[.G18]*8/1024 -> 358320.3125 | J18: of:=[.$B18]/[.I18]-1 -> 0.0901558922925978 | K18: 40165000 | L18: of:=BETADIST([.$C$1];[.$A18];[.K18]-[.$A18]+1) -> 9.29055802449768E-051 | M18: of:=[.K18]*8/1024 -> 313789.0625 | N18: of:=[.$B18]/[.M18]-1 -> 0.244864932154861 | O18: 9
A19: of:=[.A16]*10 -> 10000 | B19: of:=[.A19]/[.$C$1]*8/1024 -> 781250 | C19: 92400000 | D19: of:=BETADIST([.$C$1];[.$A19];[.C19]-[.$A19]+1) -> 3.13006340537563E-015 | E19: of:=[.C19]*8/1024 -> 721875 | F19: of:=[.$B19]/[.E19]-1 -> 0.0822510822510822 | G19: 94118000 | H19: of:=BETADIST([.$C$1];[.$A19];[.G19]-[.$A19]+1) -> 0.000000000996302875631824 | I19: of:=[.G19]*8/1024 -> 735296.875 | J19: of:=[.$B19]/[.I19]-1 -> 0.0624960156399415 | K19: 85796000 | L19: of:=BETADIST([.$C$1];[.$A19];[.K19]-[.$A19]+1) -> 9.63456749713668E-051 | M19: of:=[.K19]*8/1024 -> 670281.25 | N19: of:=[.$B19]/[.M19]-1 -> 0.165555503753089 | O19: 9
A20: of:=[.A17]*10 -> 20000 | B20: of:=[.A20]/[.$C$1]*8/1024 -> 1562500 | C20: 189200000 | D20: of:=BETADIST([.$C$1];[.$A20];[.C20]-[.$A20]+1) -> 3.7207936027547E-015 | E20: of:=[.C20]*8/1024 -> 1478125 | F20: of:=[.$B20]/[.E20]-1 -> 0.0570824524312896 | G20: 191634000 | H20: of:=BETADIST([.$C$1];[.$A20];[.G20]-[.$A20]+1) -> 0.000000000997884042937003 | I20: of:=[.G20]*8/1024 -> 1497140.625 | J20: of:=[.$B20]/[.I20]-1 -> 0.0436561361762526 | K20: 179610000 | L20: of:=BETADIST([.$C$1];[.$A20];[.K20]-[.$A20]+1) -> 9.37340105807164E-051 | M20: of:=[.K20]*8/1024 -> 1403203.125 | N20: of:=[.$B20]/[.M20]-1 -> 0.113523745893881 | O20: 9
A21: of:=[.A18]*10 -> 50000 | B21: of:=[.A21]/[.$C$1]*8/1024 -> 3906250 | C21: 482800000 | D21: of:=BETADIST([.$C$1];[.$A21];[.C21]-[.$A21]+1) -> 3.5980117528505E-015 | E21: of:=[.C21]*8/1024 -> 3771875 | F21: of:=[.$B21]/[.E21]-1 -> 0.0356255178127589 | G21: 486700000 | H21: of:=BETADIST([.$C$1];[.$A21];[.G21]-[.$A21]+1) -> 0.00000000098463585199929 | I21: of:=[.G21]*8/1024 -> 3802343.75 | J21: of:=[.$B21]/[.I21]-1 -> 0.0273268954181221 | K21: 467340000 | L21: of:=BETADIST([.$C$1];[.$A21];[.K21]-[.$A21]+1) -> 9.61151517625196E-051 | M21: of:=[.K21]*8/1024 -> 3651093.75 | N21: of:=[.$B21]/[.M21]-1 -> 0.0698848803868704 | O21: 9
A22: of:=[.A19]*10 -> 100000 | B22: of:=[.A22]/[.$C$1]*8/1024 -> 7812500 | C22: 975000000 | D22: of:=BETADIST([.$C$1];[.$A22];[.C22]-[.$A22]+1) -> 7.8127684166595E-016 | E22: of:=[.C22]*8/1024 -> 7617187.5 | F22: of:=[.$B22]/[.E22]-1 -> 0.0256410256410255 | G22: 981150000 | H22: of:=BETADIST([.$C$1];[.$A22];[.G22]-[.$A22]+1) -> 0.000000000998745314399375 | I22: of:=[.G22]*8/1024 -> 7665234.375 | J22: of:=[.$B22]/[.I22]-1 -> 0.0192121490088162 | K22: 953500000 | L22: of:=BETADIST([.$C$1];[.$A22];[.K22]-[.$A22]+1) -> 9.24052251728348E-051 | M22: of:=[.K22]*8/1024 -> 7449218.75 | N22: of:=[.$B22]/[.M22]-1 -> 0.048767697954903 | O22: 9
A23: of:=[.A20]*10 -> 200000 | B23: of:=[.A23]/[.$C$1]*8/1024 -> 15625000 | C23: 1965000000 | D23: of:=BETADIST([.$C$1];[.$A23];[.C23]-[.$A23]+1) -> 1.74491088341356E-015 | E23: of:=[.C23]*8/1024 -> 15351562.5 | F23: of:=[.$B23]/[.E23]-1 -> 0.0178117048346056 | G23: 1973290000 | H23: of:=BETADIST([.$C$1];[.$A23];[.G23]-[.$A23]+1) -> 0.000000000993357900833115 | I23: of:=[.G23]*8/1024 -> 15416328.125 | J23: of:=[.$B23]/[.I23]-1 -> 0.0135357702111703 | K23: 1933950000 | L23: of:=BETADIST([.$C$1];[.$A23];[.K23]-[.$A23]+1) -> 9.74972622921521E-051 | M23: of:=[.K23]*8/1024 -> 15108984.375 | N23: of:=[.$B23]/[.M23]-1 -> 0.0341528995061919 | O23: 9
A24: of:=[.A21]*10 -> 500000 | B24: of:=[.A24]/[.$C$1]*8/1024 -> 39062500 | C24: 4945000000 | D24: of:=BETADIST([.$C$1];[.$A24];[.C24]-[.$A24]+1) -> 2.93293788024565E-015 | E24: of:=[.C24]*8/1024 -> 38632812.5 | F24: of:=[.$B24]/[.E24]-1 -> 0.0111223458038423 | G24: 4957600000 | H24: of:=BETADIST([.$C$1];[.$A24];[.G24]-[.$A24]+1) -> 0.000000000909880422218128 | I24: of:=[.G24]*8/1024 -> 38731250 | J24: of:=[.$B24]/[.I24]-1 -> 0.00855252541552365 | K24: 4895100000 | L24: of:=BETADIST([.$C$1];[.$A24];[.K24]-[.$A24]+1) -> 8.99249550679343E-051 | M24: of:=[.K24]*8/1024 -> 38242968.75 | N24: of:=[.$B24]/[.M24]-1 -> 0.0214295928581643 | O24: 9
A25: of:=[.A22]*10 -> 1000000 | B25: of:=[.A25]/[.$C$1]*8/1024 -> 78125000 | C25: 9922500000 | D25: of:=BETADIST([.$C$1];[.$A25];[.C25]-[.$A25]+1) -> 3.91911163586248E-015 | E25: of:=[.C25]*8/1024 -> 77519531.25 | F25: of:=[.$B25]/[.E25]-1 -> 0.00781053162005541 | G25: 9940000000 | H25: of:=BETADIST([.$C$1];[.$A25];[.G25]-[.$A25]+1) -> 0.000000000916185905115797 | I25: of:=[.G25]*8/1024 -> 77656250 | J25: of:=[.$B25]/[.I25]-1 -> 0.00603621730382287 | K25: 9851300000 | L25: of:=BETADIST([.$C$1];[.$A25];[.K25]-[.$A25]+1) -> 8.42373356295156E-051 | M25: of:=[.K25]*8/1024 -> 76963281.25 | N25: of:=[.$B25]/[.M25]-1 -> 0.0150944545389948 | O25: 9