Sheet: Feuille1
A1: p | B1: sampling rate | C1: of:=0.0001 -> 0.0001 | E1: of:=0.0001 -> 0.0001
A2: l | B2: limit in words | C2: of:=[.C4]/[.C1] -> 200000 | E2: of:=[.E3]/8*1024 -> 10000384
B3: limit in kiB | C3: of:=[.C2]*8/1024 -> 1562.5 | E3: 78128
A4: k | B4: memprof calls | C4: 20 | E4: of:=FLOOR([.E2]*[.E1]) -> 1000
A5: n | B5: allocation in words
A6: P(n) | B6: I_p(k,n-k+1)
D7: Per samples | F7: Per allocation limit
A8: step | B8: n/l | C8: n | D8: of:="P (l="&TEXT([.C2]/1000;"#,#0")&"kw, k="&TEXT([.C4];"0")&", p="&TEXT([.C1];"0E+0")&")" -> P (l=200kw, k=20, p=1E-4) | E8: n | F8: of:="P (l="&TEXT([.E2]/1000;"#,#0")&"kw, k="&TEXT([.E4];"0")&", p="&TEXT([.E1];"0E+0")&")" -> P (l=10,000kw, k=1000, p=1E-4)
A9: 0 | B9: of:=[.A9]*0.01 -> 0 | C9: 0 | D9: 0 | E9: 0 | F9: 0
A10: 1 | B10: of:=[.A10]*0.01 -> 0.01 | C10: of:=[.B10]*[.C$2] -> 2000 | D10: of:=BETADIST([.C$1];[.C$4];[.C10]-[.C$4]+1) -> 3.24489597859322E-033 | E10: of:=[.$B10]*[.E$2] -> 100003.84 | F10: of:=BETADIST([.E$1];[.E$4];[.E10]-[.E$4]+1) -> 0
A11: 2 | B11: of:=[.A11]*0.01 -> 0.02 | C11: of:=[.B11]*[.C$2] -> 4000 | D11: of:=BETADIST([.C$1];[.C$4];[.C11]-[.C$4]+1) -> 2.95024538279449E-027 | E11: of:=[.$B11]*[.E$2] -> 200007.68 | F11: of:=BETADIST([.E$1];[.E$4];[.E11]-[.E$4]+1) -> 0
A12: 3 | B12: of:=[.A12]*0.01 -> 0.03 | C12: of:=[.B12]*[.C$2] -> 6000 | D12: of:=BETADIST([.C$1];[.C$4];[.C12]-[.C$4]+1) -> 8.24029220714759E-024 | E12: of:=[.$B12]*[.E$2] -> 300011.52 | F12: of:=BETADIST([.E$1];[.E$4];[.E12]-[.E$4]+1) -> 0
A13: 4 | B13: of:=[.A13]*0.01 -> 0.04 | C13: of:=[.B13]*[.C$2] -> 8000 | D13: of:=BETADIST([.C$1];[.C$4];[.C13]-[.C$4]+1) -> 2.16552838978404E-021 | E13: of:=[.$B13]*[.E$2] -> 400015.36 | F13: of:=BETADIST([.E$1];[.E$4];[.E13]-[.E$4]+1) -> 0
A14: 5 | B14: of:=[.A14]*0.01 -> 0.05 | C14: of:=[.B14]*[.C$2] -> 10000 | D14: of:=BETADIST([.C$1];[.C$4];[.C14]-[.C$4]+1) -> 1.56052262270639E-019 | E14: of:=[.$B14]*[.E$2] -> 500019.2 | F14: of:=BETADIST([.E$1];[.E$4];[.E14]-[.E$4]+1) -> 0
A15: 6 | B15: of:=[.A15]*0.01 -> 0.06 | C15: of:=[.B15]*[.C$2] -> 12000 | D15: of:=BETADIST([.C$1];[.C$4];[.C15]-[.C$4]+1) -> 4.96307330899649E-018 | E15: of:=[.$B15]*[.E$2] -> 600023.04 | F15: of:=BETADIST([.E$1];[.E$4];[.E15]-[.E$4]+1) -> 0
A16: 7 | B16: of:=[.A16]*0.01 -> 0.07 | C16: of:=[.B16]*[.C$2] -> 14000 | D16: of:=BETADIST([.C$1];[.C$4];[.C16]-[.C$4]+1) -> 8.9781740328011E-017 | E16: of:=[.$B16]*[.E$2] -> 700026.88 | F16: of:=BETADIST([.E$1];[.E$4];[.E16]-[.E$4]+1) -> 0
A17: 8 | B17: of:=[.A17]*0.01 -> 0.08 | C17: of:=[.B17]*[.C$2] -> 16000 | D17: of:=BETADIST([.C$1];[.C$4];[.C17]-[.C$4]+1) -> 1.07478756977448E-015 | E17: of:=[.$B17]*[.E$2] -> 800030.72 | F17: of:=BETADIST([.E$1];[.E$4];[.E17]-[.E$4]+1) -> 0
A18: 9 | B18: of:=[.A18]*0.01 -> 0.09 | C18: of:=[.B18]*[.C$2] -> 18000 | D18: of:=BETADIST([.C$1];[.C$4];[.C18]-[.C$4]+1) -> 9.38740529096423E-015 | E18: of:=[.$B18]*[.E$2] -> 900034.56 | F18: of:=BETADIST([.E$1];[.E$4];[.E18]-[.E$4]+1) -> 0
A19: 10 | B19: of:=[.A19]*0.01 -> 0.1 | C19: of:=[.B19]*[.C$2] -> 20000 | D19: of:=BETADIST([.C$1];[.C$4];[.C19]-[.C$4]+1) -> 0.00000000000006394323 | E19: of:=[.$B19]*[.E$2] -> 1000038.4 | F19: of:=BETADIST([.E$1];[.E$4];[.E19]-[.E$4]+1) -> 0
A20: 11 | B20: of:=[.A20]*0.01 -> 0.11 | C20: of:=[.B20]*[.C$2] -> 22000 | D20: of:=BETADIST([.C$1];[.C$4];[.C20]-[.C$4]+1) -> 0.00000000000035620998 | E20: of:=[.$B20]*[.E$2] -> 1100042.24 | F20: of:=BETADIST([.E$1];[.E$4];[.E20]-[.E$4]+1) -> 0
A21: 12 | B21: of:=[.A21]*0.01 -> 0.12 | C21: of:=[.B21]*[.C$2] -> 24000 | D21: of:=BETADIST([.C$1];[.C$4];[.C21]-[.C$4]+1) -> 0.00000000000168079743 | E21: of:=[.$B21]*[.E$2] -> 1200046.08 | F21: of:=BETADIST([.E$1];[.E$4];[.E21]-[.E$4]+1) -> 0
A22: 13 | B22: of:=[.A22]*0.01 -> 0.13 | C22: of:=[.B22]*[.C$2] -> 26000 | D22: of:=BETADIST([.C$1];[.C$4];[.C22]-[.C$4]+1) -> 0.00000000000689907694 | E22: of:=[.$B22]*[.E$2] -> 1300049.92 | F22: of:=BETADIST([.E$1];[.E$4];[.E22]-[.E$4]+1) -> 0
A23: 14 | B23: of:=[.A23]*0.01 -> 0.14 | C23: of:=[.B23]*[.C$2] -> 28000 | D23: of:=BETADIST([.C$1];[.C$4];[.C23]-[.C$4]+1) -> 0.00000000002514922498 | E23: of:=[.$B23]*[.E$2] -> 1400053.76 | F23: of:=BETADIST([.E$1];[.E$4];[.E23]-[.E$4]+1) -> 0
A24: 15 | B24: of:=[.A24]*0.01 -> 0.15 | C24: of:=[.B24]*[.C$2] -> 30000 | D24: of:=BETADIST([.C$1];[.C$4];[.C24]-[.C$4]+1) -> 0.00000000008276444535 | E24: of:=[.$B24]*[.E$2] -> 1500057.6 | F24: of:=BETADIST([.E$1];[.E$4];[.E24]-[.E$4]+1) -> 0
A25: 16 | B25: of:=[.A25]*0.01 -> 0.16 | C25: of:=[.B25]*[.C$2] -> 32000 | D25: of:=BETADIST([.C$1];[.C$4];[.C25]-[.C$4]+1) -> 0.00000000024916913685 | E25: of:=[.$B25]*[.E$2] -> 1600061.44 | F25: of:=BETADIST([.E$1];[.E$4];[.E25]-[.E$4]+1) -> 0
A26: 17 | B26: of:=[.A26]*0.01 -> 0.17 | C26: of:=[.B26]*[.C$2] -> 34000 | D26: of:=BETADIST([.C$1];[.C$4];[.C26]-[.C$4]+1) -> 0.00000000069370583814 | E26: of:=[.$B26]*[.E$2] -> 1700065.28 | F26: of:=BETADIST([.E$1];[.E$4];[.E26]-[.E$4]+1) -> 0
A27: 18 | B27: of:=[.A27]*0.01 -> 0.18 | C27: of:=[.B27]*[.C$2] -> 36000 | D27: of:=BETADIST([.C$1];[.C$4];[.C27]-[.C$4]+1) -> 0.00000000180210418375 | E27: of:=[.$B27]*[.E$2] -> 1800069.12 | F27: of:=BETADIST([.E$1];[.E$4];[.E27]-[.E$4]+1) -> 0
A28: 19 | B28: of:=[.A28]*0.01 -> 0.19 | C28: of:=[.B28]*[.C$2] -> 38000 | D28: of:=BETADIST([.C$1];[.C$4];[.C28]-[.C$4]+1) -> 0.00000000440117581571 | E28: of:=[.$B28]*[.E$2] -> 1900072.96 | F28: of:=BETADIST([.E$1];[.E$4];[.E28]-[.E$4]+1) -> 0
A29: 20 | B29: of:=[.A29]*0.01 -> 0.2 | C29: of:=[.B29]*[.C$2] -> 40000 | D29: of:=BETADIST([.C$1];[.C$4];[.C29]-[.C$4]+1) -> 0.00000001016952177777 | E29: of:=[.$B29]*[.E$2] -> 2000076.8 | F29: of:=BETADIST([.E$1];[.E$4];[.E29]-[.E$4]+1) -> 0
A30: 21 | B30: of:=[.A30]*0.01 -> 0.21 | C30: of:=[.B30]*[.C$2] -> 42000 | D30: of:=BETADIST([.C$1];[.C$4];[.C30]-[.C$4]+1) -> 0.0000000223527023263 | E30: of:=[.$B30]*[.E$2] -> 2100080.64 | F30: of:=BETADIST([.E$1];[.E$4];[.E30]-[.E$4]+1) -> 0
A31: 22 | B31: of:=[.A31]*0.01 -> 0.22 | C31: of:=[.B31]*[.C$2] -> 44000 | D31: of:=BETADIST([.C$1];[.C$4];[.C31]-[.C$4]+1) -> 0.00000004695514440061 | E31: of:=[.$B31]*[.E$2] -> 2200084.48 | F31: of:=BETADIST([.E$1];[.E$4];[.E31]-[.E$4]+1) -> 0.00000000000002E-307
A32: 23 | B32: of:=[.A32]*0.01 -> 0.23 | C32: of:=[.B32]*[.C$2] -> 46000 | D32: of:=BETADIST([.C$1];[.C$4];[.C32]-[.C$4]+1) -> 0.00000009464892436399 | E32: of:=[.$B32]*[.E$2] -> 2300088.32 | F32: of:=BETADIST([.E$1];[.E$4];[.E32]-[.E$4]+1) -> 2.02168684718262E-306
A33: 24 | B33: of:=[.A33]*0.01 -> 0.24 | C33: of:=[.B33]*[.C$2] -> 48000 | D33: of:=BETADIST([.C$1];[.C$4];[.C33]-[.C$4]+1) -> 0.00000018372111349313 | E33: of:=[.$B33]*[.E$2] -> 2400092.16 | F33: of:=BETADIST([.E$1];[.E$4];[.E33]-[.E$4]+1) -> 2.85356098390827E-292
A34: 25 | B34: of:=[.A34]*0.01 -> 0.25 | C34: of:=[.B34]*[.C$2] -> 50000 | D34: of:=BETADIST([.C$1];[.C$4];[.C34]-[.C$4]+1) -> 0.0000003444746914661 | E34: of:=[.$B34]*[.E$2] -> 2500096 | F34: of:=BETADIST([.E$1];[.E$4];[.E34]-[.E$4]+1) -> 7.08242218199213E-279
A35: 26 | B35: of:=[.A35]*0.01 -> 0.26 | C35: of:=[.B35]*[.C$2] -> 52000 | D35: of:=BETADIST([.C$1];[.C$4];[.C35]-[.C$4]+1) -> 0.00000062559939376818 | E35: of:=[.$B35]*[.E$2] -> 2600099.84 | F35: of:=BETADIST([.E$1];[.E$4];[.E35]-[.E$4]+1) -> 3.54280456878489E-266
A36: 27 | B36: of:=[.A36]*0.01 -> 0.27 | C36: of:=[.B36]*[.C$2] -> 54000 | D36: of:=BETADIST([.C$1];[.C$4];[.C36]-[.C$4]+1) -> 0.00000110313265478554 | E36: of:=[.$B36]*[.E$2] -> 2700103.68 | F36: of:=BETADIST([.E$1];[.E$4];[.E36]-[.E$4]+1) -> 4.03107469007446E-254
A37: 28 | B37: of:=[.A37]*0.01 -> 0.28 | C37: of:=[.B37]*[.C$2] -> 56000 | D37: of:=BETADIST([.C$1];[.C$4];[.C37]-[.C$4]+1) -> 0.00000189272966243525 | E37: of:=[.$B37]*[.E$2] -> 2800107.52 | F37: of:=BETADIST([.E$1];[.E$4];[.E37]-[.E$4]+1) -> 1.16199835426352E-242
A38: 29 | B38: of:=[.A38]*0.01 -> 0.29 | C38: of:=[.B38]*[.C$2] -> 58000 | D38: of:=BETADIST([.C$1];[.C$4];[.C38]-[.C$4]+1) -> 0.00000316604662257846 | E38: of:=[.$B38]*[.E$2] -> 2900111.36 | F38: of:=BETADIST([.E$1];[.E$4];[.E38]-[.E$4]+1) -> 9.34490004427429E-232
A39: 30 | B39: of:=[.A39]*0.01 -> 0.3 | C39: of:=[.B39]*[.C$2] -> 60000 | D39: of:=BETADIST([.C$1];[.C$4];[.C39]-[.C$4]+1) -> 0.00000517210286758512 | E39: of:=[.$B39]*[.E$2] -> 3000115.2 | F39: of:=BETADIST([.E$1];[.E$4];[.E39]-[.E$4]+1) -> 2.28634259714599E-221
A40: 31 | B40: of:=[.A40]*0.01 -> 0.31 | C40: of:=[.B40]*[.C$2] -> 62000 | D40: of:=BETADIST([.C$1];[.C$4];[.C40]-[.C$4]+1) -> 0.00000826451538124182 | E40: of:=[.$B40]*[.E$2] -> 3100119.04 | F40: of:=BETADIST([.E$1];[.E$4];[.E40]-[.E$4]+1) -> 1.83999718883827E-211
A41: 32 | B41: of:=[.A41]*0.01 -> 0.32 | C41: of:=[.B41]*[.C$2] -> 64000 | D41: of:=BETADIST([.C$1];[.C$4];[.C41]-[.C$4]+1) -> 0.0000129354840969297 | E41: of:=[.$B41]*[.E$2] -> 3200122.88 | F41: of:=BETADIST([.E$1];[.E$4];[.E41]-[.E$4]+1) -> 5.22736608901653E-202
A42: 33 | B42: of:=[.A42]*0.01 -> 0.33 | C42: of:=[.B42]*[.C$2] -> 66000 | D42: of:=BETADIST([.C$1];[.C$4];[.C42]-[.C$4]+1) -> 0.0000198573397173003 | E42: of:=[.$B42]*[.E$2] -> 3300126.72 | F42: of:=BETADIST([.E$1];[.E$4];[.E42]-[.E$4]+1) -> 5.58967020466955E-193
A43: 34 | B43: of:=[.A43]*0.01 -> 0.34 | C43: of:=[.B43]*[.C$2] -> 68000 | D43: of:=BETADIST([.C$1];[.C$4];[.C43]-[.C$4]+1) -> 0.0000299323416645912 | E43: of:=[.$B43]*[.E$2] -> 3400130.56 | F43: of:=BETADIST([.E$1];[.E$4];[.E43]-[.E$4]+1) -> 2.38495375814091E-184
A44: 35 | B44: of:=[.A44]*0.01 -> 0.35 | C44: of:=[.B44]*[.C$2] -> 70000 | D44: of:=BETADIST([.C$1];[.C$4];[.C44]-[.C$4]+1) -> 0.0000443512287581762 | E44: of:=[.$B44]*[.E$2] -> 3500134.4 | F44: of:=BETADIST([.E$1];[.E$4];[.E44]-[.E$4]+1) -> 4.28264462730598E-176
A45: 36 | B45: of:=[.A45]*0.01 -> 0.36 | C45: of:=[.B45]*[.C$2] -> 72000 | D45: of:=BETADIST([.C$1];[.C$4];[.C45]-[.C$4]+1) -> 0.0000646607793112221 | E45: of:=[.$B45]*[.E$2] -> 3600138.24 | F45: of:=BETADIST([.E$1];[.E$4];[.E45]-[.E$4]+1) -> 3.3983930563566E-168
A46: 37 | B46: of:=[.A46]*0.01 -> 0.37 | C46: of:=[.B46]*[.C$2] -> 74000 | D46: of:=BETADIST([.C$1];[.C$4];[.C46]-[.C$4]+1) -> 0.0000928403341681162 | E46: of:=[.$B46]*[.E$2] -> 3700142.08 | F46: of:=BETADIST([.E$1];[.E$4];[.E46]-[.E$4]+1) -> 1.24627482129816E-160
A47: 38 | B47: of:=[.A47]*0.01 -> 0.38 | C47: of:=[.B47]*[.C$2] -> 76000 | D47: of:=BETADIST([.C$1];[.C$4];[.C47]-[.C$4]+1) -> 0.000131386883122391 | E47: of:=[.$B47]*[.E$2] -> 3800145.92 | F47: of:=BETADIST([.E$1];[.E$4];[.E47]-[.E$4]+1) -> 2.20102870141571E-153
A48: 39 | B48: of:=[.A48]*0.01 -> 0.39 | C48: of:=[.B48]*[.C$2] -> 78000 | D48: of:=BETADIST([.C$1];[.C$4];[.C48]-[.C$4]+1) -> 0.000183407923072402 | E48: of:=[.$B48]*[.E$2] -> 3900149.76 | F48: of:=BETADIST([.E$1];[.E$4];[.E48]-[.E$4]+1) -> 1.94449995236977E-146
A49: 40 | B49: of:=[.A49]*0.01 -> 0.4 | C49: of:=[.B49]*[.C$2] -> 80000 | D49: of:=BETADIST([.C$1];[.C$4];[.C49]-[.C$4]+1) -> 0.000252720879244427 | E49: of:=[.$B49]*[.E$2] -> 4000153.6 | F49: of:=BETADIST([.E$1];[.E$4];[.E49]-[.E$4]+1) -> 8.90033021969584E-140
A50: 41 | B50: of:=[.A50]*0.01 -> 0.41 | C50: of:=[.B50]*[.C$2] -> 82000 | D50: of:=BETADIST([.C$1];[.C$4];[.C50]-[.C$4]+1) -> 0.000343957455412991 | E50: of:=[.$B50]*[.E$2] -> 4100157.44 | F50: of:=BETADIST([.E$1];[.E$4];[.E50]-[.E$4]+1) -> 2.18040228683707E-133
A51: 42 | B51: of:=[.A51]*0.01 -> 0.42 | C51: of:=[.B51]*[.C$2] -> 84000 | D51: of:=BETADIST([.C$1];[.C$4];[.C51]-[.C$4]+1) -> 0.000462670863561478 | E51: of:=[.$B51]*[.E$2] -> 4200161.28 | F51: of:=BETADIST([.E$1];[.E$4];[.E51]-[.E$4]+1) -> 2.94642584524606E-127
A52: 43 | B52: of:=[.A52]*0.01 -> 0.43 | C52: of:=[.B52]*[.C$2] -> 86000 | D52: of:=BETADIST([.C$1];[.C$4];[.C52]-[.C$4]+1) -> 0.000615443496932549 | E52: of:=[.$B52]*[.E$2] -> 4300165.12 | F52: of:=BETADIST([.E$1];[.E$4];[.E52]-[.E$4]+1) -> 2.25867948328801E-121
A53: 44 | B53: of:=[.A53]*0.01 -> 0.44 | C53: of:=[.B53]*[.C$2] -> 88000 | D53: of:=BETADIST([.C$1];[.C$4];[.C53]-[.C$4]+1) -> 0.000809992271803065 | E53: of:=[.$B53]*[.E$2] -> 4400168.96 | F53: of:=BETADIST([.E$1];[.E$4];[.E53]-[.E$4]+1) -> 1.00819967791616E-115
A54: 45 | B54: of:=[.A54]*0.01 -> 0.45 | C54: of:=[.B54]*[.C$2] -> 90000 | D54: of:=BETADIST([.C$1];[.C$4];[.C54]-[.C$4]+1) -> 0.00105526859029839 | E54: of:=[.$B54]*[.E$2] -> 4500172.8 | F54: of:=BETADIST([.E$1];[.E$4];[.E54]-[.E$4]+1) -> 2.68497547724313E-110
A55: 46 | B55: of:=[.A55]*0.01 -> 0.46 | C55: of:=[.B55]*[.C$2] -> 92000 | D55: of:=BETADIST([.C$1];[.C$4];[.C55]-[.C$4]+1) -> 0.0013615496847577 | E55: of:=[.$B55]*[.E$2] -> 4600176.64 | F55: of:=BETADIST([.E$1];[.E$4];[.E55]-[.E$4]+1) -> 4.36423764826012E-105
A56: 47 | B56: of:=[.A56]*0.01 -> 0.47 | C56: of:=[.B56]*[.C$2] -> 94000 | D56: of:=BETADIST([.C$1];[.C$4];[.C56]-[.C$4]+1) -> 0.00174051800629688 | E56: of:=[.$B56]*[.E$2] -> 4700180.48 | F56: of:=BETADIST([.E$1];[.E$4];[.E56]-[.E$4]+1) -> 4.42269222269333E-100
A57: 48 | B57: of:=[.A57]*0.01 -> 0.48 | C57: of:=[.B57]*[.C$2] -> 96000 | D57: of:=BETADIST([.C$1];[.C$4];[.C57]-[.C$4]+1) -> 0.00220532532545804 | E57: of:=[.$B57]*[.E$2] -> 4800184.32 | F57: of:=BETADIST([.E$1];[.E$4];[.E57]-[.E$4]+1) -> 2.85054829935796E-095
A58: 49 | B58: of:=[.A58]*0.01 -> 0.49 | C58: of:=[.B58]*[.C$2] -> 98000 | D58: of:=BETADIST([.C$1];[.C$4];[.C58]-[.C$4]+1) -> 0.00277063832634605 | E58: of:=[.$B58]*[.E$2] -> 4900188.16 | F58: of:=BETADIST([.E$1];[.E$4];[.E58]-[.E$4]+1) -> 1.19056147422471E-090
A59: 50 | B59: of:=[.A59]*0.01 -> 0.5 | C59: of:=[.B59]*[.C$2] -> 100000 | D59: of:=BETADIST([.C$1];[.C$4];[.C59]-[.C$4]+1) -> 0.0034526626983108 | E59: of:=[.$B59]*[.E$2] -> 5000192 | F59: of:=BETADIST([.E$1];[.E$4];[.E59]-[.E$4]+1) -> 3.27932076111382E-086
A60: 51 | B60: of:=[.A60]*0.01 -> 0.51 | C60: of:=[.B60]*[.C$2] -> 102000 | D60: of:=BETADIST([.C$1];[.C$4];[.C60]-[.C$4]+1) -> 0.00426914305762199 | E60: of:=[.$B60]*[.E$2] -> 5100195.84 | F60: of:=BETADIST([.E$1];[.E$4];[.E60]-[.E$4]+1) -> 6.05618421230298E-082
A61: 52 | B61: of:=[.A61]*0.01 -> 0.52 | C61: of:=[.B61]*[.C$2] -> 104000 | D61: of:=BETADIST([.C$1];[.C$4];[.C61]-[.C$4]+1) -> 0.00523933645812449 | E61: of:=[.$B61]*[.E$2] -> 5200199.68 | F61: of:=BETADIST([.E$1];[.E$4];[.E61]-[.E$4]+1) -> 7.61648435518814E-078
A62: 53 | B62: of:=[.A62]*0.01 -> 0.53 | C62: of:=[.B62]*[.C$2] -> 106000 | D62: of:=BETADIST([.C$1];[.C$4];[.C62]-[.C$4]+1) -> 0.00638395776315218 | E62: of:=[.$B62]*[.E$2] -> 5300203.52 | F62: of:=BETADIST([.E$1];[.E$4];[.E62]-[.E$4]+1) -> 6.61945339888806E-074
A63: 54 | B63: of:=[.A63]*0.01 -> 0.54 | C63: of:=[.B63]*[.C$2] -> 108000 | D63: of:=BETADIST([.C$1];[.C$4];[.C63]-[.C$4]+1) -> 0.0077250957363937 | E63: of:=[.$B63]*[.E$2] -> 5400207.36 | F63: of:=BETADIST([.E$1];[.E$4];[.E63]-[.E$4]+1) -> 4.03103983072745E-070
A64: 55 | B64: of:=[.A64]*0.01 -> 0.55 | C64: of:=[.B64]*[.C$2] -> 110000 | D64: of:=BETADIST([.C$1];[.C$4];[.C64]-[.C$4]+1) -> 0.00928609934956608 | E64: of:=[.$B64]*[.E$2] -> 5500211.2 | F64: of:=BETADIST([.E$1];[.E$4];[.E64]-[.E$4]+1) -> 1.74270733315587E-066
A65: 56 | B65: of:=[.A65]*0.01 -> 0.56 | C65: of:=[.B65]*[.C$2] -> 112000 | D65: of:=BETADIST([.C$1];[.C$4];[.C65]-[.C$4]+1) -> 0.0110914344804823 | E65: of:=[.$B65]*[.E$2] -> 5600215.04 | F65: of:=BETADIST([.E$1];[.E$4];[.E65]-[.E$4]+1) -> 5.41530449009259E-063
A66: 57 | B66: of:=[.A66]*0.01 -> 0.57 | C66: of:=[.B66]*[.C$2] -> 114000 | D66: of:=BETADIST([.C$1];[.C$4];[.C66]-[.C$4]+1) -> 0.0131665118659766 | E66: of:=[.$B66]*[.E$2] -> 5700218.88 | F66: of:=BETADIST([.E$1];[.E$4];[.E66]-[.E$4]+1) -> 1.22378859699075E-059
A67: 58 | B67: of:=[.A67]*0.01 -> 0.58 | C67: of:=[.B67]*[.C$2] -> 116000 | D67: of:=BETADIST([.C$1];[.C$4];[.C67]-[.C$4]+1) -> 0.0155374878594962 | E67: of:=[.$B67]*[.E$2] -> 5800222.72 | F67: of:=BETADIST([.E$1];[.E$4];[.E67]-[.E$4]+1) -> 2.03378183789972E-056
A68: 59 | B68: of:=[.A68]*0.01 -> 0.59 | C68: of:=[.B68]*[.C$2] -> 118000 | D68: of:=BETADIST([.C$1];[.C$4];[.C68]-[.C$4]+1) -> 0.0182310402027181 | E68: of:=[.$B68]*[.E$2] -> 5900226.56 | F68: of:=BETADIST([.E$1];[.E$4];[.E68]-[.E$4]+1) -> 2.51188418972215E-053
A69: 60 | B69: of:=[.A69]*0.01 -> 0.6 | C69: of:=[.B69]*[.C$2] -> 120000 | D69: of:=BETADIST([.C$1];[.C$4];[.C69]-[.C$4]+1) -> 0.0212741216351736 | E69: of:=[.$B69]*[.E$2] -> 6000230.4 | F69: of:=BETADIST([.E$1];[.E$4];[.E69]-[.E$4]+1) -> 2.32886962888503E-050
A70: 61 | B70: of:=[.A70]*0.01 -> 0.61 | C70: of:=[.B70]*[.C$2] -> 122000 | D70: of:=BETADIST([.C$1];[.C$4];[.C70]-[.C$4]+1) -> 0.0246936947182437 | E70: of:=[.$B70]*[.E$2] -> 6100234.24 | F70: of:=BETADIST([.E$1];[.E$4];[.E70]-[.E$4]+1) -> 1.63636280298764E-047
A71: 62 | B71: of:=[.A71]*0.01 -> 0.62 | C71: of:=[.B71]*[.C$2] -> 124000 | D71: of:=BETADIST([.C$1];[.C$4];[.C71]-[.C$4]+1) -> 0.0285164517251444 | E71: of:=[.$B71]*[.E$2] -> 6200238.08 | F71: of:=BETADIST([.E$1];[.E$4];[.E71]-[.E$4]+1) -> 8.79307977559249E-045
A72: 63 | B72: of:=[.A72]*0.01 -> 0.63 | C72: of:=[.B72]*[.C$2] -> 126000 | D72: of:=BETADIST([.C$1];[.C$4];[.C72]-[.C$4]+1) -> 0.0327685238342333 | E72: of:=[.$B72]*[.E$2] -> 6300241.92 | F72: of:=BETADIST([.E$1];[.E$4];[.E72]-[.E$4]+1) -> 3.64485396064091E-042
A73: 64 | B73: of:=[.A73]*0.01 -> 0.64 | C73: of:=[.B73]*[.C$2] -> 128000 | D73: of:=BETADIST([.C$1];[.C$4];[.C73]-[.C$4]+1) -> 0.0374751841501745 | E73: of:=[.$B73]*[.E$2] -> 6400245.76 | F73: of:=BETADIST([.E$1];[.E$4];[.E73]-[.E$4]+1) -> 1.17509293570574E-039
A74: 65 | B74: of:=[.A74]*0.01 -> 0.65 | C74: of:=[.B74]*[.C$2] -> 130000 | D74: of:=BETADIST([.C$1];[.C$4];[.C74]-[.C$4]+1) -> 0.0426605492600941 | E74: of:=[.$B74]*[.E$2] -> 6500249.6 | F74: of:=BETADIST([.E$1];[.E$4];[.E74]-[.E$4]+1) -> 2.96980641809932E-037
A75: 66 | B75: of:=[.A75]*0.01 -> 0.66 | C75: of:=[.B75]*[.C$2] -> 132000 | D75: of:=BETADIST([.C$1];[.C$4];[.C75]-[.C$4]+1) -> 0.0483472841070651 | E75: of:=[.$B75]*[.E$2] -> 6600253.44 | F75: of:=BETADIST([.E$1];[.E$4];[.E75]-[.E$4]+1) -> 5.92795164276655E-035
A76: 67 | B76: of:=[.A76]*0.01 -> 0.67 | C76: of:=[.B76]*[.C$2] -> 134000 | D76: of:=BETADIST([.C$1];[.C$4];[.C76]-[.C$4]+1) -> 0.0545563149317479 | E76: of:=[.$B76]*[.E$2] -> 6700257.28 | F76: of:=BETADIST([.E$1];[.E$4];[.E76]-[.E$4]+1) -> 9.41269222220055E-033
A77: 68 | B77: of:=[.A77]*0.01 -> 0.68 | C77: of:=[.B77]*[.C$2] -> 136000 | D77: of:=BETADIST([.C$1];[.C$4];[.C77]-[.C$4]+1) -> 0.0613065548978074 | E77: of:=[.$B77]*[.E$2] -> 6800261.12 | F77: of:=BETADIST([.E$1];[.E$4];[.E77]-[.E$4]+1) -> 1.19710452070391E-030
A78: 69 | B78: of:=[.A78]*0.01 -> 0.69 | C78: of:=[.B78]*[.C$2] -> 138000 | D78: of:=BETADIST([.C$1];[.C$4];[.C78]-[.C$4]+1) -> 0.0686146467844896 | E78: of:=[.$B78]*[.E$2] -> 6900264.96 | F78: of:=BETADIST([.E$1];[.E$4];[.E78]-[.E$4]+1) -> 1.22746191531591E-028
A79: 70 | B79: of:=[.A79]*0.01 -> 0.7 | C79: of:=[.B79]*[.C$2] -> 140000 | D79: of:=BETADIST([.C$1];[.C$4];[.C79]-[.C$4]+1) -> 0.076494726808496 | E79: of:=[.$B79]*[.E$2] -> 7000268.8 | F79: of:=BETADIST([.E$1];[.E$4];[.E79]-[.E$4]+1) -> 1.0211053699865E-026
A80: 71 | B80: of:=[.A80]*0.01 -> 0.71 | C80: of:=[.B80]*[.C$2] -> 142000 | D80: of:=BETADIST([.C$1];[.C$4];[.C80]-[.C$4]+1) -> 0.084958213237863 | E80: of:=[.$B80]*[.E$2] -> 7100272.64 | F80: of:=BETADIST([.E$1];[.E$4];[.E80]-[.E$4]+1) -> 6.93323291173774E-025
A81: 72 | B81: of:=[.A81]*0.01 -> 0.72 | C81: of:=[.B81]*[.C$2] -> 144000 | D81: of:=BETADIST([.C$1];[.C$4];[.C81]-[.C$4]+1) -> 0.094013622994849 | E81: of:=[.$B81]*[.E$2] -> 7200276.48 | F81: of:=BETADIST([.E$1];[.E$4];[.E81]-[.E$4]+1) -> 3.86468275338562E-023
A82: 73 | B82: of:=[.A82]*0.01 -> 0.73 | C82: of:=[.B82]*[.C$2] -> 146000 | D82: of:=BETADIST([.C$1];[.C$4];[.C82]-[.C$4]+1) -> 0.103666418926246 | E82: of:=[.$B82]*[.E$2] -> 7300280.32 | F82: of:=BETADIST([.E$1];[.E$4];[.E82]-[.E$4]+1) -> 1.77834176296617E-021
A83: 74 | B83: of:=[.A83]*0.01 -> 0.74 | C83: of:=[.B83]*[.C$2] -> 148000 | D83: of:=BETADIST([.C$1];[.C$4];[.C83]-[.C$4]+1) -> 0.113918889861398 | E83: of:=[.$B83]*[.E$2] -> 7400284.16 | F83: of:=BETADIST([.E$1];[.E$4];[.E83]-[.E$4]+1) -> 6.79136012868037E-020
A84: 75 | B84: of:=[.A84]*0.01 -> 0.75 | C84: of:=[.B84]*[.C$2] -> 150000 | D84: of:=BETADIST([.C$1];[.C$4];[.C84]-[.C$4]+1) -> 0.12477006499532 | E84: of:=[.$B84]*[.E$2] -> 7500288 | F84: of:=BETADIST([.E$1];[.E$4];[.E84]-[.E$4]+1) -> 2.16355185523474E-018
A85: 76 | B85: of:=[.A85]*0.01 -> 0.76 | C85: of:=[.B85]*[.C$2] -> 152000 | D85: of:=BETADIST([.C$1];[.C$4];[.C85]-[.C$4]+1) -> 0.136215663539926 | E85: of:=[.$B85]*[.E$2] -> 7600291.84 | F85: of:=BETADIST([.E$1];[.E$4];[.E85]-[.E$4]+1) -> 5.77820806352821E-017
A86: 77 | B86: of:=[.A86]*0.01 -> 0.77 | C86: of:=[.B86]*[.C$2] -> 154000 | D86: of:=BETADIST([.C$1];[.C$4];[.C86]-[.C$4]+1) -> 0.148248079994245 | E86: of:=[.$B86]*[.E$2] -> 7700295.68 | F86: of:=BETADIST([.E$1];[.E$4];[.E86]-[.E$4]+1) -> 1.29988013888142E-015
A87: 78 | B87: of:=[.A87]*0.01 -> 0.78 | C87: of:=[.B87]*[.C$2] -> 156000 | D87: of:=BETADIST([.C$1];[.C$4];[.C87]-[.C$4]+1) -> 0.160856404806908 | E87: of:=[.$B87]*[.E$2] -> 7800299.52 | F87: of:=BETADIST([.E$1];[.E$4];[.E87]-[.E$4]+1) -> 0.00000000000002474539
A88: 79 | B88: of:=[.A88]*0.01 -> 0.79 | C88: of:=[.B88]*[.C$2] -> 158000 | D88: of:=BETADIST([.C$1];[.C$4];[.C88]-[.C$4]+1) -> 0.174026479652905 | E88: of:=[.$B88]*[.E$2] -> 7900303.36 | F88: of:=BETADIST([.E$1];[.E$4];[.E88]-[.E$4]+1) -> 0.00000000000040040121
A89: 80 | B89: of:=[.A89]*0.01 -> 0.8 | C89: of:=[.B89]*[.C$2] -> 160000 | D89: of:=BETADIST([.C$1];[.C$4];[.C89]-[.C$4]+1) -> 0.187740986031268 | E89: of:=[.$B89]*[.E$2] -> 8000307.2 | F89: of:=BETADIST([.E$1];[.E$4];[.E89]-[.E$4]+1) -> 0.00000000000553061032
A90: 81 | B90: of:=[.A90]*0.01 -> 0.81 | C90: of:=[.B90]*[.C$2] -> 162000 | D90: of:=BETADIST([.C$1];[.C$4];[.C90]-[.C$4]+1) -> 0.20197956541957 | E90: of:=[.$B90]*[.E$2] -> 8100311.04 | F90: of:=BETADIST([.E$1];[.E$4];[.E90]-[.E$4]+1) -> 0.00000000006548414278
A91: 82 | B91: of:=[.A91]*0.01 -> 0.82 | C91: of:=[.B91]*[.C$2] -> 164000 | D91: of:=BETADIST([.C$1];[.C$4];[.C91]-[.C$4]+1) -> 0.216718968802639 | E91: of:=[.$B91]*[.E$2] -> 8200314.88 | F91: of:=BETADIST([.E$1];[.E$4];[.E91]-[.E$4]+1) -> 0.00000000066732978484
A92: 83 | B92: of:=[.A92]*0.01 -> 0.83 | C92: of:=[.B92]*[.C$2] -> 166000 | D92: of:=BETADIST([.C$1];[.C$4];[.C92]-[.C$4]+1) -> 0.231933233030892 | E92: of:=[.$B92]*[.E$2] -> 8300318.72 | F92: of:=BETADIST([.E$1];[.E$4];[.E92]-[.E$4]+1) -> 0.00000000587616698836
A93: 84 | B93: of:=[.A93]*0.01 -> 0.84 | C93: of:=[.B93]*[.C$2] -> 168000 | D93: of:=BETADIST([.C$1];[.C$4];[.C93]-[.C$4]+1) -> 0.247593881163019 | E93: of:=[.$B93]*[.E$2] -> 8400322.56 | F93: of:=BETADIST([.E$1];[.E$4];[.E93]-[.E$4]+1) -> 0.00000004488098355645
A94: 85 | B94: of:=[.A94]*0.01 -> 0.85 | C94: of:=[.B94]*[.C$2] -> 170000 | D94: of:=BETADIST([.C$1];[.C$4];[.C94]-[.C$4]+1) -> 0.263670143709669 | E94: of:=[.$B94]*[.E$2] -> 8500326.4 | F94: of:=BETADIST([.E$1];[.E$4];[.E94]-[.E$4]+1) -> 0.00000029845138003381
A95: 86 | B95: of:=[.A95]*0.01 -> 0.86 | C95: of:=[.B95]*[.C$2] -> 172000 | D95: of:=BETADIST([.C$1];[.C$4];[.C95]-[.C$4]+1) -> 0.280129197520645 | E95: of:=[.$B95]*[.E$2] -> 8600330.24 | F95: of:=BETADIST([.E$1];[.E$4];[.E95]-[.E$4]+1) -> 0.00000173430450502983
A96: 87 | B96: of:=[.A96]*0.01 -> 0.87 | C96: of:=[.B96]*[.C$2] -> 174000 | D96: of:=BETADIST([.C$1];[.C$4];[.C96]-[.C$4]+1) -> 0.296936418946849 | E96: of:=[.$B96]*[.E$2] -> 8700334.08 | F96: of:=BETADIST([.E$1];[.E$4];[.E96]-[.E$4]+1) -> 0.00000883875823296825
A97: 88 | B97: of:=[.A97]*0.01 -> 0.88 | C97: of:=[.B97]*[.C$2] -> 176000 | D97: of:=BETADIST([.C$1];[.C$4];[.C97]-[.C$4]+1) -> 0.314055647857552 | E97: of:=[.$B97]*[.E$2] -> 8800337.92 | F97: of:=BETADIST([.E$1];[.E$4];[.E97]-[.E$4]+1) -> 0.0000396486885962388
A98: 89 | B98: of:=[.A98]*0.01 -> 0.89 | C98: of:=[.B98]*[.C$2] -> 178000 | D98: of:=BETADIST([.C$1];[.C$4];[.C98]-[.C$4]+1) -> 0.331449459100773 | E98: of:=[.$B98]*[.E$2] -> 8900341.76 | F98: of:=BETADIST([.E$1];[.E$4];[.E98]-[.E$4]+1) -> 0.000157104519988612
A99: 90 | B99: of:=[.A99]*0.01 -> 0.9 | C99: of:=[.B99]*[.C$2] -> 180000 | D99: of:=BETADIST([.C$1];[.C$4];[.C99]-[.C$4]+1) -> 0.34907943805577 | E99: of:=[.$B99]*[.E$2] -> 9000345.6 | F99: of:=BETADIST([.E$1];[.E$4];[.E99]-[.E$4]+1) -> 0.000551855501347158
A100: 91 | B100: of:=[.A100]*0.01 -> 0.91 | C100: of:=[.B100]*[.C$2] -> 182000 | D100: of:=BETADIST([.C$1];[.C$4];[.C100]-[.C$4]+1) -> 0.366906457036028 | E100: of:=[.$B100]*[.E$2] -> 9100349.44 | F100: of:=BETADIST([.E$1];[.E$4];[.E100]-[.E$4]+1) -> 0.00172468798462882
A101: 92 | B101: of:=[.A101]*0.01 -> 0.92 | C101: of:=[.B101]*[.C$2] -> 184000 | D101: of:=BETADIST([.C$1];[.C$4];[.C101]-[.C$4]+1) -> 0.384890949454831 | E101: of:=[.$B101]*[.E$2] -> 9200353.28 | F101: of:=BETADIST([.E$1];[.E$4];[.E101]-[.E$4]+1) -> 0.00481336551183848
A102: 93 | B102: of:=[.A102]*0.01 -> 0.93 | C102: of:=[.B102]*[.C$2] -> 186000 | D102: of:=BETADIST([.C$1];[.C$4];[.C102]-[.C$4]+1) -> 0.402993178856227 | E102: of:=[.$B102]*[.E$2] -> 9300357.12 | F102: of:=BETADIST([.E$1];[.E$4];[.E102]-[.E$4]+1) -> 0.012041974712537
A103: 94 | B103: of:=[.A103]*0.01 -> 0.94 | C103: of:=[.B103]*[.C$2] -> 188000 | D103: of:=BETADIST([.C$1];[.C$4];[.C103]-[.C$4]+1) -> 0.42117350013697 | E103: of:=[.$B103]*[.E$2] -> 9400360.96 | F103: of:=BETADIST([.E$1];[.E$4];[.E103]-[.E$4]+1) -> 0.0271138774189881
A104: 95 | B104: of:=[.A104]*0.01 -> 0.95 | C104: of:=[.B104]*[.C$2] -> 190000 | D104: of:=BETADIST([.C$1];[.C$4];[.C104]-[.C$4]+1) -> 0.439392610532572 | E104: of:=[.$B104]*[.E$2] -> 9500364.8 | F104: of:=BETADIST([.E$1];[.E$4];[.E104]-[.E$4]+1) -> 0.0551787781884869
A105: 96 | B105: of:=[.A105]*0.01 -> 0.96 | C105: of:=[.B105]*[.C$2] -> 192000 | D105: of:=BETADIST([.C$1];[.C$4];[.C105]-[.C$4]+1) -> 0.457611788208976 | E105: of:=[.$B105]*[.E$2] -> 9600368.64 | F105: of:=BETADIST([.E$1];[.E$4];[.E105]-[.E$4]+1) -> 0.101958630616811
A106: 97 | B106: of:=[.A106]*0.01 -> 0.97 | C106: of:=[.B106]*[.C$2] -> 194000 | D106: of:=BETADIST([.C$1];[.C$4];[.C106]-[.C$4]+1) -> 0.475793116581145 | E106: of:=[.$B106]*[.E$2] -> 9700372.48 | F106: of:=BETADIST([.E$1];[.E$4];[.E106]-[.E$4]+1) -> 0.171917085422529
A107: 98 | B107: of:=[.A107]*0.01 -> 0.98 | C107: of:=[.B107]*[.C$2] -> 196000 | D107: of:=BETADIST([.C$1];[.C$4];[.C107]-[.C$4]+1) -> 0.493899692768594 | E107: of:=[.$B107]*[.E$2] -> 9800376.32 | F107: of:=BETADIST([.E$1];[.E$4];[.E107]-[.E$4]+1) -> 0.2659897320137
A108: 99 | B108: of:=[.A108]*0.01 -> 0.99 | C108: of:=[.B108]*[.C$2] -> 198000 | D108: of:=BETADIST([.C$1];[.C$4];[.C108]-[.C$4]+1) -> 0.511895818889421 | E108: of:=[.$B108]*[.E$2] -> 9900380.16 | F108: of:=BETADIST([.E$1];[.E$4];[.E108]-[.E$4]+1) -> 0.379976648173354
A109: 100 | B109: of:=[.A109]*0.01 -> 1 | C109: of:=[.B109]*[.C$2] -> 200000 | D109: of:=BETADIST([.C$1];[.C$4];[.C109]-[.C$4]+1) -> 0.529747175182498 | E109: of:=[.$B109]*[.E$2] -> 10000384 | F109: of:=BETADIST([.E$1];[.E$4];[.E109]-[.E$4]+1) -> 0.504690290839006
A110: 101 | B110: of:=[.A110]*0.01 -> 1.01 | C110: of:=[.B110]*[.C$2] -> 202000 | D110: of:=BETADIST([.C$1];[.C$4];[.C110]-[.C$4]+1) -> 0.547420974229108 | E110: of:=[.$B110]*[.E$2] -> 10100387.84 | F110: of:=BETADIST([.E$1];[.E$4];[.E110]-[.E$4]+1) -> 0.628146333514825
A111: 102 | B111: of:=[.A111]*0.01 -> 1.02 | C111: of:=[.B111]*[.C$2] -> 204000 | D111: of:=BETADIST([.C$1];[.C$4];[.C111]-[.C$4]+1) -> 0.564886095804213 | E111: of:=[.$B111]*[.E$2] -> 10200391.68 | F111: of:=BETADIST([.E$1];[.E$4];[.E111]-[.E$4]+1) -> 0.738935333133258
A112: 103 | B112: of:=[.A112]*0.01 -> 1.03 | C112: of:=[.B112]*[.C$2] -> 206000 | D112: of:=BETADIST([.C$1];[.C$4];[.C112]-[.C$4]+1) -> 0.582113202200558 | E112: of:=[.$B112]*[.E$2] -> 10300395.52 | F112: of:=BETADIST([.E$1];[.E$4];[.E112]-[.E$4]+1) -> 0.829235529757499
A113: 104 | B113: of:=[.A113]*0.01 -> 1.04 | C113: of:=[.B113]*[.C$2] -> 208000 | D113: of:=BETADIST([.C$1];[.C$4];[.C113]-[.C$4]+1) -> 0.599074833970151 | E113: of:=[.$B113]*[.E$2] -> 10400399.36 | F113: of:=BETADIST([.E$1];[.E$4];[.E113]-[.E$4]+1) -> 0.896206524430501
A114: 105 | B114: of:=[.A114]*0.01 -> 1.05 | C114: of:=[.B114]*[.C$2] -> 210000 | D114: of:=BETADIST([.C$1];[.C$4];[.C114]-[.C$4]+1) -> 0.615745486492582 | E114: of:=[.$B114]*[.E$2] -> 10500403.2 | F114: of:=BETADIST([.E$1];[.E$4];[.E114]-[.E$4]+1) -> 0.941482344367799
A115: 106 | B115: of:=[.A115]*0.01 -> 1.06 | C115: of:=[.B115]*[.C$2] -> 212000 | D115: of:=BETADIST([.C$1];[.C$4];[.C115]-[.C$4]+1) -> 0.632101667636367 | E115: of:=[.$B115]*[.E$2] -> 10600407.04 | F115: of:=BETADIST([.E$1];[.E$4];[.E115]-[.E$4]+1) -> 0.969432299432281
A116: 107 | B116: of:=[.A116]*0.01 -> 1.07 | C116: of:=[.B116]*[.C$2] -> 214000 | D116: of:=BETADIST([.C$1];[.C$4];[.C116]-[.C$4]+1) -> 0.648121937322344 | E116: of:=[.$B116]*[.E$2] -> 10700410.88 | F116: of:=BETADIST([.E$1];[.E$4];[.E116]-[.E$4]+1) -> 0.985214364016076
A117: 108 | B117: of:=[.A117]*0.01 -> 1.08 | C117: of:=[.B117]*[.C$2] -> 216000 | D117: of:=BETADIST([.C$1];[.C$4];[.C117]-[.C$4]+1) -> 0.663786929723103 | E117: of:=[.$B117]*[.E$2] -> 10800414.72 | F117: of:=BETADIST([.E$1];[.E$4];[.E117]-[.E$4]+1) -> 0.993378813846335
A118: 109 | B118: of:=[.A118]*0.01 -> 1.09 | C118: of:=[.B118]*[.C$2] -> 218000 | D118: of:=BETADIST([.C$1];[.C$4];[.C118]-[.C$4]+1) -> 0.67907935894694 | E118: of:=[.$B118]*[.E$2] -> 10900418.56 | F118: of:=BETADIST([.E$1];[.E$4];[.E118]-[.E$4]+1) -> 0.9972546328167
A119: 110 | B119: of:=[.A119]*0.01 -> 1.1 | C119: of:=[.B119]*[.C$2] -> 220000 | D119: of:=BETADIST([.C$1];[.C$4];[.C119]-[.C$4]+1) -> 0.693984009413461 | E119: of:=[.$B119]*[.E$2] -> 11000422.4 | F119: of:=BETADIST([.E$1];[.E$4];[.E119]-[.E$4]+1) -> 0.998945649163589
A120: 111 | B120: of:=[.A120]*0.01 -> 1.11 | C120: of:=[.B120]*[.C$2] -> 222000 | D120: of:=BETADIST([.C$1];[.C$4];[.C120]-[.C$4]+1) -> 0.70848771181701 | E120: of:=[.$B120]*[.E$2] -> 11100426.24 | F120: of:=BETADIST([.E$1];[.E$4];[.E120]-[.E$4]+1) -> 0.999624752951091
A121: 112 | B121: of:=[.A121]*0.01 -> 1.12 | C121: of:=[.B121]*[.C$2] -> 224000 | D121: of:=BETADIST([.C$1];[.C$4];[.C121]-[.C$4]+1) -> 0.72257930613064 | E121: of:=[.$B121]*[.E$2] -> 11200430.08 | F121: of:=BETADIST([.E$1];[.E$4];[.E121]-[.E$4]+1) -> 0.999876154174633
A122: 113 | B122: of:=[.A122]*0.01 -> 1.13 | C122: of:=[.B122]*[.C$2] -> 226000 | D122: of:=BETADIST([.C$1];[.C$4];[.C122]-[.C$4]+1) -> 0.736249592633406 | E122: of:=[.$B122]*[.E$2] -> 11300433.92 | F122: of:=BETADIST([.E$1];[.E$4];[.E122]-[.E$4]+1) -> 0.999962068105964
A123: 114 | B123: of:=[.A123]*0.01 -> 1.14 | C123: of:=[.B123]*[.C$2] -> 228000 | D123: of:=BETADIST([.C$1];[.C$4];[.C123]-[.C$4]+1) -> 0.749491272427468 | E123: of:=[.$B123]*[.E$2] -> 11400437.76 | F123: of:=BETADIST([.E$1];[.E$4];[.E123]-[.E$4]+1) -> 0.999989209407108
A124: 115 | B124: of:=[.A124]*0.01 -> 1.15 | C124: of:=[.B124]*[.C$2] -> 230000 | D124: of:=BETADIST([.C$1];[.C$4];[.C124]-[.C$4]+1) -> 0.76229887857673 | E124: of:=[.$B124]*[.E$2] -> 11500441.6 | F124: of:=BETADIST([.E$1];[.E$4];[.E124]-[.E$4]+1) -> 0.999997146452646
A125: 116 | B125: of:=[.A125]*0.01 -> 1.16 | C125: of:=[.B125]*[.C$2] -> 232000 | D125: of:=BETADIST([.C$1];[.C$4];[.C125]-[.C$4]+1) -> 0.774668699219322 | E125: of:=[.$B125]*[.E$2] -> 11600445.44 | F125: of:=BETADIST([.E$1];[.E$4];[.E125]-[.E$4]+1) -> 0.999999297863733
A126: 117 | B126: of:=[.A126]*0.01 -> 1.17 | C126: of:=[.B126]*[.C$2] -> 234000 | D126: of:=BETADIST([.C$1];[.C$4];[.C126]-[.C$4]+1) -> 0.78659869385738 | E126: of:=[.$B126]*[.E$2] -> 11700449.28 | F126: of:=BETADIST([.E$1];[.E$4];[.E126]-[.E$4]+1) -> 0.999999839097482
A127: 118 | B127: of:=[.A127]*0.01 -> 1.18 | C127: of:=[.B127]*[.C$2] -> 236000 | D127: of:=BETADIST([.C$1];[.C$4];[.C127]-[.C$4]+1) -> 0.798088404046808 | E127: of:=[.$B127]*[.E$2] -> 11800453.12 | F127: of:=BETADIST([.E$1];[.E$4];[.E127]-[.E$4]+1) -> 0.999999965626405
A128: 119 | B128: of:=[.A128]*0.01 -> 1.19 | C128: of:=[.B128]*[.C$2] -> 238000 | D128: of:=BETADIST([.C$1];[.C$4];[.C128]-[.C$4]+1) -> 0.8091388596764 | E128: of:=[.$B128]*[.E$2] -> 11900456.96 | F128: of:=BETADIST([.E$1];[.E$4];[.E128]-[.E$4]+1) -> 0.999999993147844
A129: 120 | B129: of:=[.A129]*0.01 -> 1.2 | C129: of:=[.B129]*[.C$2] -> 240000 | D129: of:=BETADIST([.C$1];[.C$4];[.C129]-[.C$4]+1) -> 0.819752481862204 | E129: of:=[.$B129]*[.E$2] -> 12000460.8 | F129: of:=BETADIST([.E$1];[.E$4];[.E129]-[.E$4]+1) -> 0.999999998724177
A130: 121 | B130: of:=[.A130]*0.01 -> 1.21 | C130: of:=[.B130]*[.C$2] -> 242000 | D130: of:=BETADIST([.C$1];[.C$4];[.C130]-[.C$4]+1) -> 0.829932983664054 | E130: of:=[.$B130]*[.E$2] -> 12100464.64 | F130: of:=BETADIST([.E$1];[.E$4];[.E130]-[.E$4]+1) -> 0.999999999777907
A131: 122 | B131: of:=[.A131]*0.01 -> 1.22 | C131: of:=[.B131]*[.C$2] -> 244000 | D131: of:=BETADIST([.C$1];[.C$4];[.C131]-[.C$4]+1) -> 0.839685269434645 | E131: of:=[.$B131]*[.E$2] -> 12200468.48 | F131: of:=BETADIST([.E$1];[.E$4];[.E131]-[.E$4]+1) -> 0.999999999963819
A132: 123 | B132: of:=[.A132]*0.01 -> 1.23 | C132: of:=[.B132]*[.C$2] -> 246000 | D132: of:=BETADIST([.C$1];[.C$4];[.C132]-[.C$4]+1) -> 0.849015333829905 | E132: of:=[.$B132]*[.E$2] -> 12300472.32 | F132: of:=BETADIST([.E$1];[.E$4];[.E132]-[.E$4]+1) -> 0.999999999994479
A133: 124 | B133: of:=[.A133]*0.01 -> 1.24 | C133: of:=[.B133]*[.C$2] -> 248000 | D133: of:=BETADIST([.C$1];[.C$4];[.C133]-[.C$4]+1) -> 0.857930161257185 | E133: of:=[.$B133]*[.E$2] -> 12400476.16 | F133: of:=BETADIST([.E$1];[.E$4];[.E133]-[.E$4]+1) -> 0.99999999999921
A134: 125 | B134: of:=[.A134]*0.01 -> 1.25 | C134: of:=[.B134]*[.C$2] -> 250000 | D134: of:=BETADIST([.C$1];[.C$4];[.C134]-[.C$4]+1) -> 0.866437626539791 | E134: of:=[.$B134]*[.E$2] -> 12500480 | F134: of:=BETADIST([.E$1];[.E$4];[.E134]-[.E$4]+1) -> 0.999999999999894
A135: 126 | B135: of:=[.A135]*0.01 -> 1.26 | C135: of:=[.B135]*[.C$2] -> 252000 | D135: of:=BETADIST([.C$1];[.C$4];[.C135]-[.C$4]+1) -> 0.874546397487029 | E135: of:=[.$B135]*[.E$2] -> 12600483.84 | F135: of:=BETADIST([.E$1];[.E$4];[.E135]-[.E$4]+1) -> 0.999999999999987
A136: 127 | B136: of:=[.A136]*0.01 -> 1.27 | C136: of:=[.B136]*[.C$2] -> 254000 | D136: of:=BETADIST([.C$1];[.C$4];[.C136]-[.C$4]+1) -> 0.882265839891285 | E136: of:=[.$B136]*[.E$2] -> 12700487.68 | F136: of:=BETADIST([.E$1];[.E$4];[.E136]-[.E$4]+1) -> 0.999999999999998
A137: 128 | B137: of:=[.A137]*0.01 -> 1.28 | C137: of:=[.B137]*[.C$2] -> 256000 | D137: of:=BETADIST([.C$1];[.C$4];[.C137]-[.C$4]+1) -> 0.889605925620719 | E137: of:=[.$B137]*[.E$2] -> 12800491.52 | F137: of:=BETADIST([.E$1];[.E$4];[.E137]-[.E$4]+1) -> 1
A138: 129 | B138: of:=[.A138]*0.01 -> 1.29 | C138: of:=[.B138]*[.C$2] -> 258000 | D138: of:=BETADIST([.C$1];[.C$4];[.C138]-[.C$4]+1) -> 0.896577144077011 | E138: of:=[.$B138]*[.E$2] -> 12900495.36 | F138: of:=BETADIST([.E$1];[.E$4];[.E138]-[.E$4]+1) -> 1
A139: 130 | B139: of:=[.A139]*0.01 -> 1.3 | C139: of:=[.B139]*[.C$2] -> 260000 | D139: of:=BETADIST([.C$1];[.C$4];[.C139]-[.C$4]+1) -> 0.903190417534164 | E139: of:=[.$B139]*[.E$2] -> 13000499.2 | F139: of:=BETADIST([.E$1];[.E$4];[.E139]-[.E$4]+1) -> 1
A140: 131 | B140: of:=[.A140]*0.01 -> 1.31 | C140: of:=[.B140]*[.C$2] -> 262000 | D140: of:=BETADIST([.C$1];[.C$4];[.C140]-[.C$4]+1) -> 0.909457020599249 | E140: of:=[.$B140]*[.E$2] -> 13100503.04 | F140: of:=BETADIST([.E$1];[.E$4];[.E140]-[.E$4]+1) -> 1
A141: 132 | B141: of:=[.A141]*0.01 -> 1.32 | C141: of:=[.B141]*[.C$2] -> 264000 | D141: of:=BETADIST([.C$1];[.C$4];[.C141]-[.C$4]+1) -> 0.915388504028313 | E141: of:=[.$B141]*[.E$2] -> 13200506.88 | F141: of:=BETADIST([.E$1];[.E$4];[.E141]-[.E$4]+1) -> 1
A142: 133 | B142: of:=[.A142]*0.01 -> 1.33 | C142: of:=[.B142]*[.C$2] -> 266000 | D142: of:=BETADIST([.C$1];[.C$4];[.C142]-[.C$4]+1) -> 0.920996623109734 | E142: of:=[.$B142]*[.E$2] -> 13300510.72 | F142: of:=BETADIST([.E$1];[.E$4];[.E142]-[.E$4]+1) -> 1
A143: 134 | B143: of:=[.A143]*0.01 -> 1.34 | C143: of:=[.B143]*[.C$2] -> 268000 | D143: of:=BETADIST([.C$1];[.C$4];[.C143]-[.C$4]+1) -> 0.926293270692683 | E143: of:=[.$B143]*[.E$2] -> 13400514.56 | F143: of:=BETADIST([.E$1];[.E$4];[.E143]-[.E$4]+1) -> 1
A144: 135 | B144: of:=[.A144]*0.01 -> 1.35 | C144: of:=[.B144]*[.C$2] -> 270000 | D144: of:=BETADIST([.C$1];[.C$4];[.C144]-[.C$4]+1) -> 0.931290414992528 | E144: of:=[.$B144]*[.E$2] -> 13500518.4 | F144: of:=BETADIST([.E$1];[.E$4];[.E144]-[.E$4]+1) -> 1
A145: 136 | B145: of:=[.A145]*0.01 -> 1.36 | C145: of:=[.B145]*[.C$2] -> 272000 | D145: of:=BETADIST([.C$1];[.C$4];[.C145]-[.C$4]+1) -> 0.936000042109798 | E145: of:=[.$B145]*[.E$2] -> 13600522.24 | F145: of:=BETADIST([.E$1];[.E$4];[.E145]-[.E$4]+1) -> 1
A146: 137 | B146: of:=[.A146]*0.01 -> 1.37 | C146: of:=[.B146]*[.C$2] -> 274000 | D146: of:=BETADIST([.C$1];[.C$4];[.C146]-[.C$4]+1) -> 0.940434103335307 | E146: of:=[.$B146]*[.E$2] -> 13700526.08 | F146: of:=BETADIST([.E$1];[.E$4];[.E146]-[.E$4]+1) -> 1
A147: 138 | B147: of:=[.A147]*0.01 -> 1.38 | C147: of:=[.B147]*[.C$2] -> 276000 | D147: of:=BETADIST([.C$1];[.C$4];[.C147]-[.C$4]+1) -> 0.944604467086328 | E147: of:=[.$B147]*[.E$2] -> 13800529.92 | F147: of:=BETADIST([.E$1];[.E$4];[.E147]-[.E$4]+1) -> 1
A148: 139 | B148: of:=[.A148]*0.01 -> 1.39 | C148: of:=[.B148]*[.C$2] -> 278000 | D148: of:=BETADIST([.C$1];[.C$4];[.C148]-[.C$4]+1) -> 0.948522875474099 | E148: of:=[.$B148]*[.E$2] -> 13900533.76 | F148: of:=BETADIST([.E$1];[.E$4];[.E148]-[.E$4]+1) -> 1
A149: 140 | B149: of:=[.A149]*0.01 -> 1.4 | C149: of:=[.B149]*[.C$2] -> 280000 | D149: of:=BETADIST([.C$1];[.C$4];[.C149]-[.C$4]+1) -> 0.952200905291961 | E149: of:=[.$B149]*[.E$2] -> 14000537.6 | F149: of:=BETADIST([.E$1];[.E$4];[.E149]-[.E$4]+1) -> 1
A150: 141 | B150: of:=[.A150]*0.01 -> 1.41 | C150: of:=[.B150]*[.C$2] -> 282000 | D150: of:=BETADIST([.C$1];[.C$4];[.C150]-[.C$4]+1) -> 0.955649933355191 | E150: of:=[.$B150]*[.E$2] -> 14100541.44 | F150: of:=BETADIST([.E$1];[.E$4];[.E150]-[.E$4]+1) -> 1
A151: 142 | B151: of:=[.A151]*0.01 -> 1.42 | C151: of:=[.B151]*[.C$2] -> 284000 | D151: of:=BETADIST([.C$1];[.C$4];[.C151]-[.C$4]+1) -> 0.958881105967732 | E151: of:=[.$B151]*[.E$2] -> 14200545.28 | F151: of:=BETADIST([.E$1];[.E$4];[.E151]-[.E$4]+1) -> 1
A152: 143 | B152: of:=[.A152]*0.01 -> 1.43 | C152: of:=[.B152]*[.C$2] -> 286000 | D152: of:=BETADIST([.C$1];[.C$4];[.C152]-[.C$4]+1) -> 0.961905312354613 | E152: of:=[.$B152]*[.E$2] -> 14300549.12 | F152: of:=BETADIST([.E$1];[.E$4];[.E152]-[.E$4]+1) -> 1
A153: 144 | B153: of:=[.A153]*0.01 -> 1.44 | C153: of:=[.B153]*[.C$2] -> 288000 | D153: of:=BETADIST([.C$1];[.C$4];[.C153]-[.C$4]+1) -> 0.964733161866647 | E153: of:=[.$B153]*[.E$2] -> 14400552.96 | F153: of:=BETADIST([.E$1];[.E$4];[.E153]-[.E$4]+1) -> 1
A154: 145 | B154: of:=[.A154]*0.01 -> 1.45 | C154: of:=[.B154]*[.C$2] -> 290000 | D154: of:=BETADIST([.C$1];[.C$4];[.C154]-[.C$4]+1) -> 0.967374964728688 | E154: of:=[.$B154]*[.E$2] -> 14500556.8 | F154: of:=BETADIST([.E$1];[.E$4];[.E154]-[.E$4]+1) -> 1
A155: 146 | B155: of:=[.A155]*0.01 -> 1.46 | C155: of:=[.B155]*[.C$2] -> 292000 | D155: of:=BETADIST([.C$1];[.C$4];[.C155]-[.C$4]+1) -> 0.969840716141389 | E155: of:=[.$B155]*[.E$2] -> 14600560.64 | F155: of:=BETADIST([.E$1];[.E$4];[.E155]-[.E$4]+1) -> 1
A156: 147 | B156: of:=[.A156]*0.01 -> 1.47 | C156: of:=[.B156]*[.C$2] -> 294000 | D156: of:=BETADIST([.C$1];[.C$4];[.C156]-[.C$4]+1) -> 0.972140083493795 | E156: of:=[.$B156]*[.E$2] -> 14700564.48 | F156: of:=BETADIST([.E$1];[.E$4];[.E156]-[.E$4]+1) -> 1
A157: 148 | B157: of:=[.A157]*0.01 -> 1.48 | C157: of:=[.B157]*[.C$2] -> 296000 | D157: of:=BETADIST([.C$1];[.C$4];[.C157]-[.C$4]+1) -> 0.97428239647755 | E157: of:=[.$B157]*[.E$2] -> 14800568.32 | F157: of:=BETADIST([.E$1];[.E$4];[.E157]-[.E$4]+1) -> 1
A158: 149 | B158: of:=[.A158]*0.01 -> 1.49 | C158: of:=[.B158]*[.C$2] -> 298000 | D158: of:=BETADIST([.C$1];[.C$4];[.C158]-[.C$4]+1) -> 0.976276639879271 | E158: of:=[.$B158]*[.E$2] -> 14900572.16 | F158: of:=BETADIST([.E$1];[.E$4];[.E158]-[.E$4]+1) -> 1
A159: 150 | B159: of:=[.A159]*0.01 -> 1.5 | C159: of:=[.B159]*[.C$2] -> 300000 | D159: of:=BETADIST([.C$1];[.C$4];[.C159]-[.C$4]+1) -> 0.978131448833381 | E159: of:=[.$B159]*[.E$2] -> 15000576 | F159: of:=BETADIST([.E$1];[.E$4];[.E159]-[.E$4]+1) -> 1
A160: 151 | B160: of:=[.A160]*0.01 -> 1.51 | C160: of:=[.B160]*[.C$2] -> 302000 | D160: of:=BETADIST([.C$1];[.C$4];[.C160]-[.C$4]+1) -> 0.979855106317949 | E160: of:=[.$B160]*[.E$2] -> 15100579.84 | F160: of:=BETADIST([.E$1];[.E$4];[.E160]-[.E$4]+1) -> 1
A161: 152 | B161: of:=[.A161]*0.01 -> 1.52 | C161: of:=[.B161]*[.C$2] -> 304000 | D161: of:=BETADIST([.C$1];[.C$4];[.C161]-[.C$4]+1) -> 0.981455542683402 | E161: of:=[.$B161]*[.E$2] -> 15200583.68 | F161: of:=BETADIST([.E$1];[.E$4];[.E161]-[.E$4]+1) -> 1
A162: 153 | B162: of:=[.A162]*0.01 -> 1.53 | C162: of:=[.B162]*[.C$2] -> 306000 | D162: of:=BETADIST([.C$1];[.C$4];[.C162]-[.C$4]+1) -> 0.982940337018762 | E162: of:=[.$B162]*[.E$2] -> 15300587.52 | F162: of:=BETADIST([.E$1];[.E$4];[.E162]-[.E$4]+1) -> 1
A163: 154 | B163: of:=[.A163]*0.01 -> 1.54 | C163: of:=[.B163]*[.C$2] -> 308000 | D163: of:=BETADIST([.C$1];[.C$4];[.C163]-[.C$4]+1) -> 0.984316720153687 | E163: of:=[.$B163]*[.E$2] -> 15400591.36 | F163: of:=BETADIST([.E$1];[.E$4];[.E163]-[.E$4]+1) -> 1
A164: 155 | B164: of:=[.A164]*0.01 -> 1.55 | C164: of:=[.B164]*[.C$2] -> 310000 | D164: of:=BETADIST([.C$1];[.C$4];[.C164]-[.C$4]+1) -> 0.985591579113943 | E164: of:=[.$B164]*[.E$2] -> 15500595.2 | F164: of:=BETADIST([.E$1];[.E$4];[.E164]-[.E$4]+1) -> 1
A165: 156 | B165: of:=[.A165]*0.01 -> 1.56 | C165: of:=[.B165]*[.C$2] -> 312000 | D165: of:=BETADIST([.C$1];[.C$4];[.C165]-[.C$4]+1) -> 0.986771462852487 | E165: of:=[.$B165]*[.E$2] -> 15600599.04 | F165: of:=BETADIST([.E$1];[.E$4];[.E165]-[.E$4]+1) -> 1
A166: 157 | B166: of:=[.A166]*0.01 -> 1.57 | C166: of:=[.B166]*[.C$2] -> 314000 | D166: of:=BETADIST([.C$1];[.C$4];[.C166]-[.C$4]+1) -> 0.987862589091169 | E166: of:=[.$B166]*[.E$2] -> 15700602.88 | F166: of:=BETADIST([.E$1];[.E$4];[.E166]-[.E$4]+1) -> 1
A167: 158 | B167: of:=[.A167]*0.01 -> 1.58 | C167: of:=[.B167]*[.C$2] -> 316000 | D167: of:=BETADIST([.C$1];[.C$4];[.C167]-[.C$4]+1) -> 0.98887085211329 | E167: of:=[.$B167]*[.E$2] -> 15800606.72 | F167: of:=BETADIST([.E$1];[.E$4];[.E167]-[.E$4]+1) -> 1
A168: 159 | B168: of:=[.A168]*0.01 -> 1.59 | C168: of:=[.B168]*[.C$2] -> 318000 | D168: of:=BETADIST([.C$1];[.C$4];[.C168]-[.C$4]+1) -> 0.989801831363528 | E168: of:=[.$B168]*[.E$2] -> 15900610.56 | F168: of:=BETADIST([.E$1];[.E$4];[.E168]-[.E$4]+1) -> 1
A169: 160 | B169: of:=[.A169]*0.01 -> 1.6 | C169: of:=[.B169]*[.C$2] -> 320000 | D169: of:=BETADIST([.C$1];[.C$4];[.C169]-[.C$4]+1) -> 0.990660800716548 | E169: of:=[.$B169]*[.E$2] -> 16000614.4 | F169: of:=BETADIST([.E$1];[.E$4];[.E169]-[.E$4]+1) -> 1
A170: 161 | B170: of:=[.A170]*0.01 -> 1.61 | C170: of:=[.B170]*[.C$2] -> 322000 | D170: of:=BETADIST([.C$1];[.C$4];[.C170]-[.C$4]+1) -> 0.991452738290016 | E170: of:=[.$B170]*[.E$2] -> 16100618.24 | F170: of:=BETADIST([.E$1];[.E$4];[.E170]-[.E$4]+1) -> 1
A171: 162 | B171: of:=[.A171]*0.01 -> 1.62 | C171: of:=[.B171]*[.C$2] -> 324000 | D171: of:=BETADIST([.C$1];[.C$4];[.C171]-[.C$4]+1) -> 0.992182336684347 | E171: of:=[.$B171]*[.E$2] -> 16200622.08 | F171: of:=BETADIST([.E$1];[.E$4];[.E171]-[.E$4]+1) -> 1
A172: 163 | B172: of:=[.A172]*0.01 -> 1.63 | C172: of:=[.B172]*[.C$2] -> 326000 | D172: of:=BETADIST([.C$1];[.C$4];[.C172]-[.C$4]+1) -> 0.992854013544589 | E172: of:=[.$B172]*[.E$2] -> 16300625.92 | F172: of:=BETADIST([.E$1];[.E$4];[.E172]-[.E$4]+1) -> 1
A173: 164 | B173: of:=[.A173]*0.01 -> 1.64 | C173: of:=[.B173]*[.C$2] -> 328000 | D173: of:=BETADIST([.C$1];[.C$4];[.C173]-[.C$4]+1) -> 0.993471922347952 | E173: of:=[.$B173]*[.E$2] -> 16400629.76 | F173: of:=BETADIST([.E$1];[.E$4];[.E173]-[.E$4]+1) -> 1
A174: 165 | B174: of:=[.A174]*0.01 -> 1.65 | C174: of:=[.B174]*[.C$2] -> 330000 | D174: of:=BETADIST([.C$1];[.C$4];[.C174]-[.C$4]+1) -> 0.994039963328115 | E174: of:=[.$B174]*[.E$2] -> 16500633.6 | F174: of:=BETADIST([.E$1];[.E$4];[.E174]-[.E$4]+1) -> 1
A175: 166 | B175: of:=[.A175]*0.01 -> 1.66 | C175: of:=[.B175]*[.C$2] -> 332000 | D175: of:=BETADIST([.C$1];[.C$4];[.C175]-[.C$4]+1) -> 0.994561794459976 | E175: of:=[.$B175]*[.E$2] -> 16600637.44 | F175: of:=BETADIST([.E$1];[.E$4];[.E175]-[.E$4]+1) -> 1
A176: 167 | B176: of:=[.A176]*0.01 -> 1.67 | C176: of:=[.B176]*[.C$2] -> 334000 | D176: of:=BETADIST([.C$1];[.C$4];[.C176]-[.C$4]+1) -> 0.995040842434115 | E176: of:=[.$B176]*[.E$2] -> 16700641.28 | F176: of:=BETADIST([.E$1];[.E$4];[.E176]-[.E$4]+1) -> 1
A177: 168 | B177: of:=[.A177]*0.01 -> 1.68 | C177: of:=[.B177]*[.C$2] -> 336000 | D177: of:=BETADIST([.C$1];[.C$4];[.C177]-[.C$4]+1) -> 0.995480313558039 | E177: of:=[.$B177]*[.E$2] -> 16800645.12 | F177: of:=BETADIST([.E$1];[.E$4];[.E177]-[.E$4]+1) -> 1
A178: 169 | B178: of:=[.A178]*0.01 -> 1.69 | C178: of:=[.B178]*[.C$2] -> 338000 | D178: of:=BETADIST([.C$1];[.C$4];[.C178]-[.C$4]+1) -> 0.995883204532777 | E178: of:=[.$B178]*[.E$2] -> 16900648.96 | F178: of:=BETADIST([.E$1];[.E$4];[.E178]-[.E$4]+1) -> 1
A179: 170 | B179: of:=[.A179]*0.01 -> 1.7 | C179: of:=[.B179]*[.C$2] -> 340000 | D179: of:=BETADIST([.C$1];[.C$4];[.C179]-[.C$4]+1) -> 0.996252313054345 | E179: of:=[.$B179]*[.E$2] -> 17000652.8 | F179: of:=BETADIST([.E$1];[.E$4];[.E179]-[.E$4]+1) -> 1
A180: 171 | B180: of:=[.A180]*0.01 -> 1.71 | C180: of:=[.B180]*[.C$2] -> 342000 | D180: of:=BETADIST([.C$1];[.C$4];[.C180]-[.C$4]+1) -> 0.99659024820129 | E180: of:=[.$B180]*[.E$2] -> 17100656.64 | F180: of:=BETADIST([.E$1];[.E$4];[.E180]-[.E$4]+1) -> 1
A181: 172 | B181: of:=[.A181]*0.01 -> 1.72 | C181: of:=[.B181]*[.C$2] -> 344000 | D181: of:=BETADIST([.C$1];[.C$4];[.C181]-[.C$4]+1) -> 0.996899440573577 | E181: of:=[.$B181]*[.E$2] -> 17200660.48 | F181: of:=BETADIST([.E$1];[.E$4];[.E181]-[.E$4]+1) -> 1
A182: 173 | B182: of:=[.A182]*0.01 -> 1.73 | C182: of:=[.B182]*[.C$2] -> 346000 | D182: of:=BETADIST([.C$1];[.C$4];[.C182]-[.C$4]+1) -> 0.997182152154116 | E182: of:=[.$B182]*[.E$2] -> 17300664.32 | F182: of:=BETADIST([.E$1];[.E$4];[.E182]-[.E$4]+1) -> 1
A183: 174 | B183: of:=[.A183]*0.01 -> 1.74 | C183: of:=[.B183]*[.C$2] -> 348000 | D183: of:=BETADIST([.C$1];[.C$4];[.C183]-[.C$4]+1) -> 0.997440485868277 | E183: of:=[.$B183]*[.E$2] -> 17400668.16 | F183: of:=BETADIST([.E$1];[.E$4];[.E183]-[.E$4]+1) -> 1
A184: 175 | B184: of:=[.A184]*0.01 -> 1.75 | C184: of:=[.B184]*[.C$2] -> 350000 | D184: of:=BETADIST([.C$1];[.C$4];[.C184]-[.C$4]+1) -> 0.997676394823352 | E184: of:=[.$B184]*[.E$2] -> 17500672 | F184: of:=BETADIST([.E$1];[.E$4];[.E184]-[.E$4]+1) -> 1
A185: 176 | B185: of:=[.A185]*0.01 -> 1.76 | C185: of:=[.B185]*[.C$2] -> 352000 | D185: of:=BETADIST([.C$1];[.C$4];[.C185]-[.C$4]+1) -> 0.997891691214053 | E185: of:=[.$B185]*[.E$2] -> 17600675.84 | F185: of:=BETADIST([.E$1];[.E$4];[.E185]-[.E$4]+1) -> 1
A186: 177 | B186: of:=[.A186]*0.01 -> 1.77 | C186: of:=[.B186]*[.C$2] -> 354000 | D186: of:=BETADIST([.C$1];[.C$4];[.C186]-[.C$4]+1) -> 0.998088054881109 | E186: of:=[.$B186]*[.E$2] -> 17700679.68 | F186: of:=BETADIST([.E$1];[.E$4];[.E186]-[.E$4]+1) -> 1
A187: 178 | B187: of:=[.A187]*0.01 -> 1.78 | C187: of:=[.B187]*[.C$2] -> 356000 | D187: of:=BETADIST([.C$1];[.C$4];[.C187]-[.C$4]+1) -> 0.998267041518268 | E187: of:=[.$B187]*[.E$2] -> 17800683.52 | F187: of:=BETADIST([.E$1];[.E$4];[.E187]-[.E$4]+1) -> 1
A188: 179 | B188: of:=[.A188]*0.01 -> 1.79 | C188: of:=[.B188]*[.C$2] -> 358000 | D188: of:=BETADIST([.C$1];[.C$4];[.C188]-[.C$4]+1) -> 0.998430090522279 | E188: of:=[.$B188]*[.E$2] -> 17900687.36 | F188: of:=BETADIST([.E$1];[.E$4];[.E188]-[.E$4]+1) -> 1
A189: 180 | B189: of:=[.A189]*0.01 -> 1.8 | C189: of:=[.B189]*[.C$2] -> 360000 | D189: of:=BETADIST([.C$1];[.C$4];[.C189]-[.C$4]+1) -> 0.998578532483905 | E189: of:=[.$B189]*[.E$2] -> 18000691.2 | F189: of:=BETADIST([.E$1];[.E$4];[.E189]-[.E$4]+1) -> 1
A190: 181 | B190: of:=[.A190]*0.01 -> 1.81 | C190: of:=[.B190]*[.C$2] -> 362000 | D190: of:=BETADIST([.C$1];[.C$4];[.C190]-[.C$4]+1) -> 0.998713596323145 | E190: of:=[.$B190]*[.E$2] -> 18100695.04 | F190: of:=BETADIST([.E$1];[.E$4];[.E190]-[.E$4]+1) -> 1
A191: 182 | B191: of:=[.A191]*0.01 -> 1.82 | C191: of:=[.B191]*[.C$2] -> 364000 | D191: of:=BETADIST([.C$1];[.C$4];[.C191]-[.C$4]+1) -> 0.998836416069798 | E191: of:=[.$B191]*[.E$2] -> 18200698.88 | F191: of:=BETADIST([.E$1];[.E$4];[.E191]-[.E$4]+1) -> 1
A192: 183 | B192: of:=[.A192]*0.01 -> 1.83 | C192: of:=[.B192]*[.C$2] -> 366000 | D192: of:=BETADIST([.C$1];[.C$4];[.C192]-[.C$4]+1) -> 0.998948037295892 | E192: of:=[.$B192]*[.E$2] -> 18300702.72 | F192: of:=BETADIST([.E$1];[.E$4];[.E192]-[.E$4]+1) -> 1
A193: 184 | B193: of:=[.A193]*0.01 -> 1.84 | C193: of:=[.B193]*[.C$2] -> 368000 | D193: of:=BETADIST([.C$1];[.C$4];[.C193]-[.C$4]+1) -> 0.999049423205669 | E193: of:=[.$B193]*[.E$2] -> 18400706.56 | F193: of:=BETADIST([.E$1];[.E$4];[.E193]-[.E$4]+1) -> 1
A194: 185 | B194: of:=[.A194]*0.01 -> 1.85 | C194: of:=[.B194]*[.C$2] -> 370000 | D194: of:=BETADIST([.C$1];[.C$4];[.C194]-[.C$4]+1) -> 0.99914146039173 | E194: of:=[.$B194]*[.E$2] -> 18500710.4 | F194: of:=BETADIST([.E$1];[.E$4];[.E194]-[.E$4]+1) -> 1
A195: 186 | B195: of:=[.A195]*0.01 -> 1.86 | C195: of:=[.B195]*[.C$2] -> 372000 | D195: of:=BETADIST([.C$1];[.C$4];[.C195]-[.C$4]+1) -> 0.999224964266232 | E195: of:=[.$B195]*[.E$2] -> 18600714.24 | F195: of:=BETADIST([.E$1];[.E$4];[.E195]-[.E$4]+1) -> 1
A196: 187 | B196: of:=[.A196]*0.01 -> 1.87 | C196: of:=[.B196]*[.C$2] -> 374000 | D196: of:=BETADIST([.C$1];[.C$4];[.C196]-[.C$4]+1) -> 0.999300684177007 | E196: of:=[.$B196]*[.E$2] -> 18700718.08 | F196: of:=BETADIST([.E$1];[.E$4];[.E196]-[.E$4]+1) -> 1
A197: 188 | B197: of:=[.A197]*0.01 -> 1.88 | C197: of:=[.B197]*[.C$2] -> 376000 | D197: of:=BETADIST([.C$1];[.C$4];[.C197]-[.C$4]+1) -> 0.9993693082194 | E197: of:=[.$B197]*[.E$2] -> 18800721.92 | F197: of:=BETADIST([.E$1];[.E$4];[.E197]-[.E$4]+1) -> 1
A198: 189 | B198: of:=[.A198]*0.01 -> 1.89 | C198: of:=[.B198]*[.C$2] -> 378000 | D198: of:=BETADIST([.C$1];[.C$4];[.C198]-[.C$4]+1) -> 0.999431467755125 | E198: of:=[.$B198]*[.E$2] -> 18900725.76 | F198: of:=BETADIST([.E$1];[.E$4];[.E198]-[.E$4]+1) -> 1
A199: 190 | B199: of:=[.A199]*0.01 -> 1.9 | C199: of:=[.B199]*[.C$2] -> 380000 | D199: of:=BETADIST([.C$1];[.C$4];[.C199]-[.C$4]+1) -> 0.999487741649593 | E199: of:=[.$B199]*[.E$2] -> 19000729.6 | F199: of:=BETADIST([.E$1];[.E$4];[.E199]-[.E$4]+1) -> 1
A200: 191 | B200: of:=[.A200]*0.01 -> 1.91 | C200: of:=[.B200]*[.C$2] -> 382000 | D200: of:=BETADIST([.C$1];[.C$4];[.C200]-[.C$4]+1) -> 0.999538660239864 | E200: of:=[.$B200]*[.E$2] -> 19100733.44 | F200: of:=BETADIST([.E$1];[.E$4];[.E200]-[.E$4]+1) -> 1
A201: 192 | B201: of:=[.A201]*0.01 -> 1.92 | C201: of:=[.B201]*[.C$2] -> 384000 | D201: of:=BETADIST([.C$1];[.C$4];[.C201]-[.C$4]+1) -> 0.999584709045152 | E201: of:=[.$B201]*[.E$2] -> 19200737.28 | F201: of:=BETADIST([.E$1];[.E$4];[.E201]-[.E$4]+1) -> 1
A202: 193 | B202: of:=[.A202]*0.01 -> 1.93 | C202: of:=[.B202]*[.C$2] -> 386000 | D202: of:=BETADIST([.C$1];[.C$4];[.C202]-[.C$4]+1) -> 0.999626332231942 | E202: of:=[.$B202]*[.E$2] -> 19300741.12 | F202: of:=BETADIST([.E$1];[.E$4];[.E202]-[.E$4]+1) -> 1
A203: 194 | B203: of:=[.A203]*0.01 -> 1.94 | C203: of:=[.B203]*[.C$2] -> 388000 | D203: of:=BETADIST([.C$1];[.C$4];[.C203]-[.C$4]+1) -> 0.999663935845906 | E203: of:=[.$B203]*[.E$2] -> 19400744.96 | F203: of:=BETADIST([.E$1];[.E$4];[.E203]-[.E$4]+1) -> 1
A204: 195 | B204: of:=[.A204]*0.01 -> 1.95 | C204: of:=[.B204]*[.C$2] -> 390000 | D204: of:=BETADIST([.C$1];[.C$4];[.C204]-[.C$4]+1) -> 0.999697890822551 | E204: of:=[.$B204]*[.E$2] -> 19500748.8 | F204: of:=BETADIST([.E$1];[.E$4];[.E204]-[.E$4]+1) -> 1
A205: 196 | B205: of:=[.A205]*0.01 -> 1.96 | C205: of:=[.B205]*[.C$2] -> 392000 | D205: of:=BETADIST([.C$1];[.C$4];[.C205]-[.C$4]+1) -> 0.999728535788283 | E205: of:=[.$B205]*[.E$2] -> 19600752.64 | F205: of:=BETADIST([.E$1];[.E$4];[.E205]-[.E$4]+1) -> 1
A206: 197 | B206: of:=[.A206]*0.01 -> 1.97 | C206: of:=[.B206]*[.C$2] -> 394000 | D206: of:=BETADIST([.C$1];[.C$4];[.C206]-[.C$4]+1) -> 0.99975617966346 | E206: of:=[.$B206]*[.E$2] -> 19700756.48 | F206: of:=BETADIST([.E$1];[.E$4];[.E206]-[.E$4]+1) -> 1
A207: 198 | B207: of:=[.A207]*0.01 -> 1.98 | C207: of:=[.B207]*[.C$2] -> 396000 | D207: of:=BETADIST([.C$1];[.C$4];[.C207]-[.C$4]+1) -> 0.99978110407871 | E207: of:=[.$B207]*[.E$2] -> 19800760.32 | F207: of:=BETADIST([.E$1];[.E$4];[.E207]-[.E$4]+1) -> 1
A208: 199 | B208: of:=[.A208]*0.01 -> 1.99 | C208: of:=[.B208]*[.C$2] -> 398000 | D208: of:=BETADIST([.C$1];[.C$4];[.C208]-[.C$4]+1) -> 0.999803565615314 | E208: of:=[.$B208]*[.E$2] -> 19900764.16 | F208: of:=BETADIST([.E$1];[.E$4];[.E208]-[.E$4]+1) -> 1
A209: 200 | B209: of:=[.A209]*0.01 -> 2 | C209: of:=[.B209]*[.C$2] -> 400000 | D209: of:=BETADIST([.C$1];[.C$4];[.C209]-[.C$4]+1) -> 0.999823797880331 | E209: of:=[.$B209]*[.E$2] -> 20000768 | F209: of:=BETADIST([.E$1];[.E$4];[.E209]-[.E$4]+1) -> 1
A211: Custom | G211: ≤ 1E-14 | H211: ≥ 1-1E-14
A212: 100 | B212: of:=[.A212]*0.01 -> 1 | C212: of:=[.B212]*[.C$2] -> 200000 | D212: of:=BETADIST([.C$1];[.C$4];[.C212]-[.C$4]+1) -> 0.529747175182498 | E212: of:=[.$B212]*[.E$2] -> 10000384 | F212: of:=BETADIST([.E$1];[.E$4];[.E212]-[.E$4]+1) -> 0.504690290839006 | G212: of:=SIGN([.$D212]-0.00000000000001) -> 1 | H212: of:=SIGN([.$D212]-1+0.00000000000001) -> -1
B216: approx (MiB) | C216: approx (MiB)
A217: limit | B217: ≤ 1E-14 | C217: ≥ 1-1E-14
A218: 1 MiB | B218: of:=4810*8/1024/1024 -> 0.0366973876953125 | C218: of:=624000*8/1024/1024 -> 4.7607421875
A219: 60 MiB | B219: of:=5736000*8/1024/1024 -> 43.76220703125 | C219: of:=10087000*8/1024/1024 -> 76.9577026367188
A220: 1070 MiB | B220: of:=128232000*8/1024/1024 -> 978.33251953125 | C220: of:=146179000*8/1024/1024 -> 1115.25726318359

Sheet: Feuille2
A1: N | B1: safe allocation value in words
A2: k is chosen for l/N being around 10
A3: 0.0001 | D3: k | E3: 22 | G3: 14 | I3: 80
D4: l/N | E4: 10 | G4: 10 | I4: 10
E6: Sampling rate, t < | F6: Control | G6: Sampling rate, t < | H6: Contrôle | I6: Sampling rate, t < | J6: Control
E7: of:="1E-14" -> 1E-14 | G7: of:="1E-9" -> 1E-9 | I7: of:="1E-50" -> 1E-50
B8: N*8 (in kiB) | C8: N (kw) | D8: N | E8: of:="k="&[.E$3]&", t<"&[.E$7] -> k=22, t<1E-14 | F8: of:="P(N) < "&[.E$7] -> P(N) < 1E-14 | G8: of:="k="&[.G$3]&", t<"&[.G$7] -> k=14, t<1E-9 | H8: of:="P(N) < "&[.G$7] -> P(N) < 1E-9 | I8: of:="k="&[.I$3]&", t<"&[.I$7] -> k=80, t<1E-50 | J8: of:="P(N) < "&[.I$7] -> P(N) < 1E-50 | K8: Default sampling rate
A9: 10 | B9: of:=EXP(LN(1000)/[.A$9])^[.A9]/1000 -> 1 | C9: of:=[.B9]/8 -> 0.125 | D9: of:=[.B9]/8*1024 -> 128 | E9: of:=[.E$3]/([.E$4]*[.$D9]) -> 0.0171875 | F9: of:=BETADIST([.E9];[.E$3];[.$D9]-[.E$31]+1) -> 0.00000000000002372016 | G9: of:=[.G$3]/([.G$4]*[.$D9]) -> 0.0109375 | H9: of:=BETADIST([.G9];[.G$3];[.$D9]-[.G$3]+1) -> 0.00000000018990727939 | I9: of:=[.I$3]/([.I$4]*[.$D9]) -> 0.0625 | J9: of:=BETADIST([.I9];[.I$3];[.$D9]-[.I$3]+1) -> 9.55053433158657E-063 | K9: of:=[.$A$3] -> 0.0001
A10: 11 | B10: of:=EXP(LN(1000)/[.A$9])^[.A10]/1000 -> 1.99526231496888 | C10: of:=[.B10]/8 -> 0.24940778937111 | D10: of:=[.B10]/8*1024 -> 255.393576316017 | E10: of:=[.E$3]/([.E$4]*[.$D10]) -> 0.00861415557796873 | F10: of:=BETADIST([.E10];[.E$3];[.$D10]-[.E$31]+1) -> 9.65844393216533E-015 | G10: of:=[.G$3]/([.G$4]*[.$D10]) -> 0.00548173536779828 | H10: of:=BETADIST([.G10];[.G$3];[.$D10]-[.G$3]+1) -> 0.00000000025801718586 | I10: of:=[.I$3]/([.I$4]*[.$D10]) -> 0.0313242021017045 | J10: of:=BETADIST([.I10];[.I$3];[.$D10]-[.I$3]+1) -> 9.14741821369707E-056 | K10: of:=[.$A$3] -> 0.0001
A11: 12 | B11: of:=EXP(LN(1000)/[.A$9])^[.A11]/1000 -> 3.98107170553498 | C11: of:=[.B11]/8 -> 0.497633963191873 | D11: of:=[.B11]/8*1024 -> 509.577178308477 | E11: of:=[.E$3]/([.E$4]*[.$D11]) -> 0.00431730480415709 | F11: of:=BETADIST([.E11];[.E$3];[.$D11]-[.E$31]+1) -> 6.04209587755825E-015 | G11: of:=[.G$3]/([.G$4]*[.$D11]) -> 0.0027473757844636 | H11: of:=BETADIST([.G11];[.G$3];[.$D11]-[.G$3]+1) -> 0.00000000029935331791 | I11: of:=[.I$3]/([.I$4]*[.$D11]) -> 0.0156992901969349 | J11: of:=BETADIST([.I11];[.I$3];[.$D11]-[.I$3]+1) -> 4.29915464612902E-053 | K11: of:=[.$A$3] -> 0.0001
A12: 13 | B12: of:=EXP(LN(1000)/[.A$9])^[.A12]/1000 -> 7.94328234724282 | C12: of:=[.B12]/8 -> 0.992910293405352 | D12: of:=[.B12]/8*1024 -> 1016.74014044708 | E12: of:=[.E$3]/([.E$4]*[.$D12]) -> 0.00216377805152123 | F12: of:=BETADIST([.E12];[.E$3];[.$D12]-[.E$31]+1) -> 4.75212798394632E-015 | G12: of:=[.G$3]/([.G$4]*[.$D12]) -> 0.00137694966914987 | H12: of:=BETADIST([.G12];[.G$3];[.$D12]-[.G$3]+1) -> 0.00000000032211301257 | I12: of:=[.I$3]/([.I$4]*[.$D12]) -> 0.00786828382371354 | J12: of:=BETADIST([.I12];[.I$3];[.$D12]-[.I$3]+1) -> 6.82573247039833E-052 | K12: of:=[.$A$3] -> 0.0001
A13: 14 | B13: of:=EXP(LN(1000)/[.A$9])^[.A13]/1000 -> 15.8489319246112 | C13: of:=[.B13]/8 -> 1.9811164905764 | D13: of:=[.B13]/8*1024 -> 2028.66328635023 | E13: of:=[.E$3]/([.E$4]*[.$D13]) -> 0.00108445793582533 | F13: of:=BETADIST([.E13];[.E$3];[.$D13]-[.E$31]+1) -> 4.20767060364396E-015 | G13: of:=[.G$3]/([.G$4]*[.$D13]) -> 0.00069010959552521 | H13: of:=BETADIST([.G13];[.G$3];[.$D13]-[.G$3]+1) -> 0.00000000033406472903 | I13: of:=[.I$3]/([.I$4]*[.$D13]) -> 0.0039434834030012 | J13: of:=BETADIST([.I13];[.I$3];[.$D13]-[.I$3]+1) -> 2.5493699164771E-051 | K13: of:=[.$A$3] -> 0.0001
A14: 15 | B14: of:=EXP(LN(1000)/[.A$9])^[.A14]/1000 -> 31.6227766016838 | C14: of:=[.B14]/8 -> 3.95284707521047 | D14: of:=[.B14]/8*1024 -> 4047.71540501553 | E14: of:=[.E$3]/([.E$4]*[.$D14]) -> 0.00054351647284144 | F14: of:=BETADIST([.E14];[.E$3];[.$D14]-[.E$31]+1) -> 3.9573928844034E-015 | G14: of:=[.G$3]/([.G$4]*[.$D14]) -> 0.000345874119080916 | H14: of:=BETADIST([.G14];[.G$3];[.$D14]-[.G$3]+1) -> 0.00000000034019579146 | I14: of:=[.I$3]/([.I$4]*[.$D14]) -> 0.00197642353760524 | J14: of:=BETADIST([.I14];[.I$3];[.$D14]-[.I$3]+1) -> 4.85708968051785E-051 | K14: of:=[.$A$3] -> 0.0001
A15: 16 | B15: of:=EXP(LN(1000)/[.A$9])^[.A15]/1000 -> 63.0957344480194 | C15: of:=[.B15]/8 -> 7.88696680600243 | D15: of:=[.B15]/8*1024 -> 8076.25400934648 | E15: of:=[.E$3]/([.E$4]*[.$D15]) -> 0.000272403517454254 | F15: of:=BETADIST([.E15];[.E$3];[.$D15]-[.E$31]+1) -> 3.83728523310981E-015 | G15: of:=[.G$3]/([.G$4]*[.$D15]) -> 0.000173347692925434 | H15: of:=BETADIST([.G15];[.G$3];[.$D15]-[.G$3]+1) -> 0.00000000034330455599 | I15: of:=[.I$3]/([.I$4]*[.$D15]) -> 0.000990558245288195 | J15: of:=BETADIST([.I15];[.I$3];[.$D15]-[.I$3]+1) -> 6.68365619901578E-051 | K15: of:=[.$A$3] -> 0.0001
A16: 17 | B16: of:=EXP(LN(1000)/[.A$9])^[.A16]/1000 -> 125.892541179417 | C16: of:=[.B16]/8 -> 15.7365676474271 | D16: of:=[.B16]/8*1024 -> 16114.2452709654 | E16: of:=[.E$3]/([.E$4]*[.$D16]) -> 0.000136525165343235 | F16: of:=BETADIST([.E16];[.E$3];[.$D16]-[.E$31]+1) -> 3.77838547212355E-015 | G16: of:=[.G$3]/([.G$4]*[.$D16]) -> 0.000086879650672968 | H16: of:=BETADIST([.G16];[.G$3];[.$D16]-[.G$3]+1) -> 0.00000000034487172814 | I16: of:=[.I$3]/([.I$4]*[.$D16]) -> 0.000496455146702675 | J16: of:=BETADIST([.I16];[.I$3];[.$D16]-[.I$3]+1) -> 7.83585913028721E-051 | K16: of:=[.$A$3] -> 0.0001
A17: 18 | B17: of:=EXP(LN(1000)/[.A$9])^[.A17]/1000 -> 251.188643150958 | C17: of:=[.B17]/8 -> 31.3985803938697 | D17: of:=[.B17]/8*1024 -> 32152.1463233227 | E17: of:=[.E$3]/([.E$4]*[.$D17]) -> 0.0000684246699388822 | F17: of:=BETADIST([.E17];[.E$3];[.$D17]-[.E$31]+1) -> 3.74918623668157E-015 | G17: of:=[.G$3]/([.G$4]*[.$D17]) -> 0.0000435429717792887 | H17: of:=BETADIST([.G17];[.G$3];[.$D17]-[.G$3]+1) -> 0.00000000034565946896 | I17: of:=[.I$3]/([.I$4]*[.$D17]) -> 0.000248816981595935 | J17: of:=BETADIST([.I17];[.I$3];[.$D17]-[.I$3]+1) -> 8.48403675064488E-051 | K17: of:=[.$A$3] -> 0.0001
A18: 19 | B18: of:=EXP(LN(1000)/[.A$9])^[.A18]/1000 -> 501.187233627273 | C18: of:=[.B18]/8 -> 62.6484042034091 | D18: of:=[.B18]/8*1024 -> 64151.9659042909 | E18: of:=[.E$3]/([.E$4]*[.$D18]) -> 0.0000342935710385276 | F18: of:=BETADIST([.E18];[.E$3];[.$D18]-[.E$31]+1) -> 3.73463183828374E-015 | G18: of:=[.G$3]/([.G$4]*[.$D18]) -> 0.0000218231815699721 | H18: of:=BETADIST([.G18];[.G$3];[.$D18]-[.G$3]+1) -> 0.00000000034605485195 | I18: of:=[.I$3]/([.I$4]*[.$D18]) -> 0.000124703894685555 | J18: of:=BETADIST([.I18];[.I$3];[.$D18]-[.I$3]+1) -> 8.8282756817571E-051 | K18: of:=[.$A$3] -> 0.0001
A19: 20 | B19: of:=EXP(LN(1000)/[.A$9])^[.A19]/1000 -> 1000 | C19: of:=[.B19]/8 -> 125 | D19: of:=[.B19]/8*1024 -> 128000 | E19: of:=[.E$3]/([.E$4]*[.$D19]) -> 0.0000171875 | F19: of:=BETADIST([.E19];[.E$3];[.$D19]-[.E$31]+1) -> 3.72735734606044E-015 | G19: of:=[.G$3]/([.G$4]*[.$D19]) -> 0.0000109375 | H19: of:=BETADIST([.G19];[.G$3];[.$D19]-[.G$3]+1) -> 0.00000000034625315801 | I19: of:=[.I$3]/([.I$4]*[.$D19]) -> 0.0000624999999999999 | J19: of:=BETADIST([.I19];[.I$3];[.$D19]-[.I$3]+1) -> 9.00589028915368E-051 | K19: of:=[.$A$3] -> 0.0001
A20: 21 | B20: of:=EXP(LN(1000)/[.A$9])^[.A20]/1000 -> 1995.26231496888 | C20: of:=[.B20]/8 -> 249.40778937111 | D20: of:=[.B20]/8*1024 -> 255393.576316017 | E20: of:=[.E$3]/([.E$4]*[.$D20]) -> 0.00000861415557796873 | F20: of:=BETADIST([.E20];[.E$3];[.$D20]-[.E$31]+1) -> 3.72371647376456E-015 | G20: of:=[.G$3]/([.G$4]*[.$D20]) -> 0.00000548173536779828 | H20: of:=BETADIST([.G20];[.G$3];[.$D20]-[.G$3]+1) -> 0.00000000034635258296 | I20: of:=[.I$3]/([.I$4]*[.$D20]) -> 0.0000313242021017045 | J20: of:=BETADIST([.I20];[.I$3];[.$D20]-[.I$3]+1) -> 9.09621455848309E-051 | K20: of:=[.$A$3] -> 0.0001
A21: 22 | B21: of:=EXP(LN(1000)/[.A$9])^[.A21]/1000 -> 3981.07170553498 | C21: of:=[.B21]/8 -> 497.633963191873 | D21: of:=[.B21]/8*1024 -> 509577.178308477 | E21: of:=[.E$3]/([.E$4]*[.$D21]) -> 0.00000431730480415709 | F21: of:=BETADIST([.E21];[.E$3];[.$D21]-[.E$31]+1) -> 3.72189297232929E-015 | G21: of:=[.G$3]/([.G$4]*[.$D21]) -> 0.0000027473757844636 | H21: of:=BETADIST([.G21];[.G$3];[.$D21]-[.G$3]+1) -> 0.00000000034640242264 | I21: of:=[.I$3]/([.I$4]*[.$D21]) -> 0.0000156992901969349 | J21: of:=BETADIST([.I21];[.I$3];[.$D21]-[.I$3]+1) -> 9.14181564776612E-051 | K21: of:=[.$A$3] -> 0.0001
A22: 23 | B22: of:=EXP(LN(1000)/[.A$9])^[.A22]/1000 -> 7943.28234724283 | C22: of:=[.B22]/8 -> 992.910293405354 | D22: of:=[.B22]/8*1024 -> 1016740.14044708 | E22: of:=[.E$3]/([.E$4]*[.$D22]) -> 0.00000216377805152123 | F22: of:=BETADIST([.E22];[.E$3];[.$D22]-[.E$31]+1) -> 3.72097937234499E-015 | G22: of:=[.G$3]/([.G$4]*[.$D22]) -> 0.00000137694966914987 | H22: of:=BETADIST([.G22];[.G$3];[.$D22]-[.G$3]+1) -> 0.00000000034642740395 | I22: of:=[.I$3]/([.I$4]*[.$D22]) -> 0.00000786828382371353 | J22: of:=BETADIST([.I22];[.I$3];[.$D22]-[.I$3]+1) -> 9.16475411800285E-051 | K22: of:=[.$A$3] -> 0.0001
A23: 24 | B23: of:=EXP(LN(1000)/[.A$9])^[.A23]/1000 -> 15848.9319246112 | C23: of:=[.B23]/8 -> 1981.1164905764 | D23: of:=[.B23]/8*1024 -> 2028663.28635023 | E23: of:=[.E$3]/([.E$4]*[.$D23]) -> 0.00000108445793582533 | F23: of:=BETADIST([.E23];[.E$3];[.$D23]-[.E$31]+1) -> 3.72052156696537E-015 | G23: of:=[.G$3]/([.G$4]*[.$D23]) -> 0.00000069010959552521 | H23: of:=BETADIST([.G23];[.G$3];[.$D23]-[.G$3]+1) -> 0.00000000034643992484 | I23: of:=[.I$3]/([.I$4]*[.$D23]) -> 0.0000039434834030012 | J23: of:=BETADIST([.I23];[.I$3];[.$D23]-[.I$3]+1) -> 9.17627169113135E-051 | K23: of:=[.$A$3] -> 0.0001
A24: 25 | B24: of:=EXP(LN(1000)/[.A$9])^[.A24]/1000 -> 31622.7766016838 | C24: of:=[.B24]/8 -> 3952.84707521047 | D24: of:=[.B24]/8*1024 -> 4047715.40501553 | E24: of:=[.E$3]/([.E$4]*[.$D24]) -> 0.00000054351647284144 | F24: of:=BETADIST([.E24];[.E$3];[.$D24]-[.E$31]+1) -> 3.72029214066268E-015 | G24: of:=[.G$3]/([.G$4]*[.$D24]) -> 0.00000034587411908092 | H24: of:=BETADIST([.G24];[.G$3];[.$D24]-[.G$3]+1) -> 0.0000000003464462003 | I24: of:=[.I$3]/([.I$4]*[.$D24]) -> 0.00000197642353760523 | J24: of:=BETADIST([.I24];[.I$3];[.$D24]-[.I$3]+1) -> 9.18204946038083E-051 | K24: of:=[.$A$3] -> 0.0001
A25: 26 | B25: of:=EXP(LN(1000)/[.A$9])^[.A25]/1000 -> 63095.7344480194 | C25: of:=[.B25]/8 -> 7886.96680600243 | D25: of:=[.B25]/8*1024 -> 8076254.00934649 | E25: of:=[.E$3]/([.E$4]*[.$D25]) -> 0.00000027240351745425 | F25: of:=BETADIST([.E25];[.E$3];[.$D25]-[.E$31]+1) -> 3.72017716012941E-015 | G25: of:=[.G$3]/([.G$4]*[.$D25]) -> 0.00000017334769292543 | H25: of:=BETADIST([.G25];[.G$3];[.$D25]-[.G$3]+1) -> 0.00000000034644934552 | I25: of:=[.I$3]/([.I$4]*[.$D25]) -> 0.00000099055824528819 | J25: of:=BETADIST([.I25];[.I$3];[.$D25]-[.I$3]+1) -> 9.18494653896794E-051 | K25: of:=[.$A$3] -> 0.0001
A26: 27 | B26: of:=EXP(LN(1000)/[.A$9])^[.A26]/1000 -> 125892.541179417 | C26: of:=[.B26]/8 -> 15736.5676474271 | D26: of:=[.B26]/8*1024 -> 16114245.2709654 | E26: of:=[.E$3]/([.E$4]*[.$D26]) -> 0.00000013652516534324 | F26: of:=BETADIST([.E26];[.E$3];[.$D26]-[.E$31]+1) -> 3.72011953461E-015 | G26: of:=[.G$3]/([.G$4]*[.$D26]) -> 0.00000008687965067297 | H26: of:=BETADIST([.G26];[.G$3];[.$D26]-[.G$3]+1) -> 0.00000000034645092187 | I26: of:=[.I$3]/([.I$4]*[.$D26]) -> 0.00000049645514670268 | J26: of:=BETADIST([.I26];[.I$3];[.$D26]-[.I$3]+1) -> 9.18639885307388E-051 | K26: of:=[.$A$3] -> 0.0001
A27: 28 | B27: of:=EXP(LN(1000)/[.A$9])^[.A27]/1000 -> 251188.643150958 | C27: of:=[.B27]/8 -> 31398.5803938697 | D27: of:=[.B27]/8*1024 -> 32152146.3233227 | E27: of:=[.E$3]/([.E$4]*[.$D27]) -> 0.00000006842466993888 | F27: of:=BETADIST([.E27];[.E$3];[.$D27]-[.E$31]+1) -> 3.72009065375102E-015 | G27: of:=[.G$3]/([.G$4]*[.$D27]) -> 0.00000004354297177929 | H27: of:=BETADIST([.G27];[.G$3];[.$D27]-[.G$3]+1) -> 0.00000000034645171192 | I27: of:=[.I$3]/([.I$4]*[.$D27]) -> 0.00000024881698159594 | J27: of:=BETADIST([.I27];[.I$3];[.$D27]-[.I$3]+1) -> 9.1871268185974E-051 | K27: of:=[.$A$3] -> 0.0001
A28: 29 | B28: of:=EXP(LN(1000)/[.A$9])^[.A28]/1000 -> 501187.233627273 | C28: of:=[.B28]/8 -> 62648.4042034091 | D28: of:=[.B28]/8*1024 -> 64151965.904291 | E28: of:=[.E$3]/([.E$4]*[.$D28]) -> 0.00000003429357103853 | F28: of:=BETADIST([.E28];[.E$3];[.$D28]-[.E$31]+1) -> 3.72007617911219E-015 | G28: of:=[.G$3]/([.G$4]*[.$D28]) -> 0.00000002182318156997 | H28: of:=BETADIST([.G28];[.G$3];[.$D28]-[.G$3]+1) -> 0.00000000034645210788 | I28: of:=[.I$3]/([.I$4]*[.$D28]) -> 0.00000012470389468556 | J28: of:=BETADIST([.I28];[.I$3];[.$D28]-[.I$3]+1) -> 9.1874916867933E-051 | K28: of:=[.$A$3] -> 0.0001
A29: 30 | B29: of:=EXP(LN(1000)/[.A$9])^[.A29]/1000 -> 1000000 | C29: of:=[.B29]/8 -> 125000 | D29: of:=[.B29]/8*1024 -> 128000000 | E29: of:=[.E$3]/([.E$4]*[.$D29]) -> 0.0000000171875 | F29: of:=BETADIST([.E29];[.E$3];[.$D29]-[.E$31]+1) -> 3.72006892462807E-015 | G29: of:=[.G$3]/([.G$4]*[.$D29]) -> 0.0000000109375 | H29: of:=BETADIST([.G29];[.G$3];[.$D29]-[.G$3]+1) -> 0.00000000034645230633 | I29: of:=[.I$3]/([.I$4]*[.$D29]) -> 0.0000000625 | J29: of:=BETADIST([.I29];[.I$3];[.$D29]-[.I$3]+1) -> 9.18767455938373E-051 | K29: of:=[.$A$3] -> 0.0001
A30: 31 | B30: of:=EXP(LN(1000)/[.A$9])^[.A30]/1000 -> 1995262.31496888 | C30: of:=[.B30]/8 -> 249407.78937111 | D30: of:=[.B30]/8*1024 -> 255393576.316017 | E30: of:=[.E$3]/([.E$4]*[.$D30]) -> 0.00000000861415557797 | F30: of:=BETADIST([.E30];[.E$3];[.$D30]-[.E$31]+1) -> 3.72006528877829E-015 | G30: of:=[.G$3]/([.G$4]*[.$D30]) -> 0.0000000054817353678 | H30: of:=BETADIST([.G30];[.G$3];[.$D30]-[.G$3]+1) -> 0.00000000034645240579 | I30: of:=[.I$3]/([.I$4]*[.$D30]) -> 0.0000000313242021017 | J30: of:=BETADIST([.I30];[.I$3];[.$D30]-[.I$3]+1) -> 9.18776621413048E-051 | K30: of:=[.$A$3] -> 0.0001
A31: 32 | B31: of:=EXP(LN(1000)/[.A$9])^[.A31]/1000 -> 3981071.70553498 | C31: of:=[.B31]/8 -> 497633.963191873 | D31: of:=[.B31]/8*1024 -> 509577178.308478 | E31: of:=[.E$3]/([.E$4]*[.$D31]) -> 0.00000000431730480416 | F31: of:=BETADIST([.E31];[.E$3];[.$D31]-[.E$31]+1) -> 3.72006346653765E-015 | G31: of:=[.G$3]/([.G$4]*[.$D31]) -> 0.00000000274737578446 | H31: of:=BETADIST([.G31];[.G$3];[.$D31]-[.G$3]+1) -> 0.00000000034645245564 | I31: of:=[.I$3]/([.I$4]*[.$D31]) -> 0.00000001569929019693 | J31: of:=BETADIST([.I31];[.I$3];[.$D31]-[.I$3]+1) -> 9.1878121506527E-051 | K31: of:=[.$A$3] -> 0.0001
A32: 33 | B32: of:=EXP(LN(1000)/[.A$9])^[.A32]/1000 -> 7943282.34724283 | C32: of:=[.B32]/8 -> 992910.293405354 | D32: of:=[.B32]/8*1024 -> 1016740140.44708 | E32: of:=[.E$3]/([.E$4]*[.$D32]) -> 0.00000000216377805152 | F32: of:=BETADIST([.E32];[.E$3];[.$D32]-[.E$31]+1) -> 3.72006255325459E-015 | G32: of:=[.G$3]/([.G$4]*[.$D32]) -> 0.00000000137694966915 | H32: of:=BETADIST([.G32];[.G$3];[.$D32]-[.G$3]+1) -> 0.00000000034645248063 | I32: of:=[.I$3]/([.I$4]*[.$D32]) -> 0.00000000786828382371 | J32: of:=BETADIST([.I32];[.I$3];[.$D32]-[.I$3]+1) -> 9.18783517353885E-051 | K32: of:=[.$A$3] -> 0.0001
A33: 34 | B33: of:=EXP(LN(1000)/[.A$9])^[.A33]/1000 -> 15848931.9246112 | C33: of:=[.B33]/8 -> 1981116.4905764 | D33: of:=[.B33]/8*1024 -> 2028663286.35023 | E33: of:=[.E$3]/([.E$4]*[.$D33]) -> 0.00000000108445793583 | F33: of:=BETADIST([.E33];[.E$3];[.$D33]-[.E$31]+1) -> 3.72006209552877E-015 | G33: of:=[.G$3]/([.G$4]*[.$D33]) -> 0.00000000069010959553 | H33: of:=BETADIST([.G33];[.G$3];[.$D33]-[.G$3]+1) -> 0.00000000034645249315 | I33: of:=[.I$3]/([.I$4]*[.$D33]) -> 0.000000003943483403 | J33: of:=BETADIST([.I33];[.I$3];[.$D33]-[.I$3]+1) -> 9.18784671233572E-051 | K33: of:=[.$A$3] -> 0.0001
A34: 35 | B34: of:=EXP(LN(1000)/[.A$9])^[.A34]/1000 -> 31622776.6016839 | C34: of:=[.B34]/8 -> 3952847.07521049 | D34: of:=[.B34]/8*1024 -> 4047715405.01554 | E34: of:=[.E$3]/([.E$4]*[.$D34]) -> 0.00000000054351647284 | F34: of:=BETADIST([.E34];[.E$3];[.$D34]-[.E$31]+1) -> 3.72006186612247E-015 | G34: of:=[.G$3]/([.G$4]*[.$D34]) -> 0.00000000034587411908 | H34: of:=BETADIST([.G34];[.G$3];[.$D34]-[.G$3]+1) -> 0.00000000034645249942 | I34: of:=[.I$3]/([.I$4]*[.$D34]) -> 0.00000000197642353761 | J34: of:=BETADIST([.I34];[.I$3];[.$D34]-[.I$3]+1) -> 9.18785249543492E-051 | K34: of:=[.$A$3] -> 0.0001
A35: 36 | B35: of:=EXP(LN(1000)/[.A$9])^[.A35]/1000 -> 63095734.4480195 | C35: of:=[.B35]/8 -> 7886966.80600244 | D35: of:=[.B35]/8*1024 -> 8076254009.34649 | E35: of:=[.E$3]/([.E$4]*[.$D35]) -> 0.00000000027240351745 | F35: of:=BETADIST([.E35];[.E$3];[.$D35]-[.E$31]+1) -> 3.72006175114698E-015 | G35: of:=[.G$3]/([.G$4]*[.$D35]) -> 0.00000000017334769293 | H35: of:=BETADIST([.G35];[.G$3];[.$D35]-[.G$3]+1) -> 0.00000000034645250257 | I35: of:=[.I$3]/([.I$4]*[.$D35]) -> 0.00000000099055824529 | J35: of:=BETADIST([.I35];[.I$3];[.$D35]-[.I$3]+1) -> 9.18785539385758E-051 | K35: of:=[.$A$3] -> 0.0001
A36: 37 | B36: of:=EXP(LN(1000)/[.A$9])^[.A36]/1000 -> 125892541.179417 | C36: of:=[.B36]/8 -> 15736567.6474271 | D36: of:=[.B36]/8*1024 -> 16114245270.9654 | E36: of:=[.E$3]/([.E$4]*[.$D36]) -> 0.00000000013652516534 | F36: of:=BETADIST([.E36];[.E$3];[.$D36]-[.E$31]+1) -> 3.72006169352269E-015 | G36: of:=[.G$3]/([.G$4]*[.$D36]) -> 0.00000000008687965067 | H36: of:=BETADIST([.G36];[.G$3];[.$D36]-[.G$3]+1) -> 0.00000000034645250415 | I36: of:=[.I$3]/([.I$4]*[.$D36]) -> 0.0000000004964551467 | J36: of:=BETADIST([.I36];[.I$3];[.$D36]-[.I$3]+1) -> 9.18785684650562E-051 | K36: of:=[.$A$3] -> 0.0001

Sheet: Feuille3
A1: p | B1: sampling rate | C1: of:="1E-4" -> 1E-4
A2: N | B2: lower bound on the maximal n reaching the target
C4: target : | D4: of:="4E-15" -> 4E-15 | F4: (l-N)/N | G4: target : | H4: of:="1E-9" -> 1E-9 | J4: (l-N)/N | K4: target : | L4: of:="1E-50" -> 1E-50 | N4: (l-N)/N
A5: k | B5: of:="l (in kw)" -> l (in kw) | C5: N | D5: of:="t < "&[.D4] -> t < 4E-15 | E5: N (in kw) | F5: of:="t < "&[.D4]&", p="&[.$C$1]&"" -> t < 4E-15, p=1E-4 | G5: n | H5: of:="t < "&[.H4] -> t < 1E-9 | I5: n (in kw) | J5: of:="t < "&[.H4]&", p="&[.$C$1]&"" -> t < 1E-9, p=1E-4 | K5: n | L5: of:="t < "&[.L4] -> t < 1E-50 | M5: n (in kw) | N5: of:="t < "&[.L4]&", p="&[.$C$1]&"" -> t < 1E-50, p=1E-4 | O5: l/N=10
A6: 1 | B6: of:=[.A6]/[.$C$1]/1024 -> 9.765625 | C6: 0 | D6: of:=BETADIST([.$C$1];[.$A6];[.C6]-[.$A6]+1) ->  | E6: of:=[.C6]/1024 -> 0 | F6: of:=[.$B6]/[.E6]-1 ->  | G6: 0 | H6: of:=BETADIST([.$C$1];[.$A6];[.G6]-[.$A6]+1) ->  | I6: of:=[.G6]/1024 -> 0 | J6: of:=[.$B6]/[.I6]-1 ->  | K6: 0 | L6: of:=BETADIST([.$C$1];[.$A6];[.K6]-[.$A6]+1) ->  | M6: of:=[.K6]/1024 -> 0 | N6: of:=[.$B6]/[.M6]-1 ->  | O6: 9
A7: 2 | B7: of:=[.A7]/[.$C$1]/1024 -> 19.53125 | C7: 0 | D7: of:=BETADIST([.$C$1];[.$A7];[.C7]-[.$A7]+1) ->  | E7: of:=[.C7]/1024 -> 0 | F7: of:=[.$B7]/[.E7]-1 ->  | G7: 1.16 | H7: of:=BETADIST([.$C$1];[.$A7];[.G7]-[.$A7]+1) -> 0.00000000092805197159 | I7: of:=[.G7]/1024 -> 0.0011328125 | J7: of:=[.$B7]/[.I7]-1 -> 17240.3793103448 | K7: 0 | L7: of:=BETADIST([.$C$1];[.$A7];[.K7]-[.$A7]+1) ->  | M7: of:=[.K7]/1024 -> 0 | N7: of:=[.$B7]/[.M7]-1 ->  | O7: 9
A8: 5 | B8: of:=[.A8]/[.$C$1]/1024 -> 48.828125 | C8: 36 | D8: of:=BETADIST([.$C$1];[.$A8];[.C8]-[.$A8]+1) -> 3.76019355093547E-015 | E8: of:=[.C8]/1024 -> 0.03515625 | F8: of:=[.$B8]/[.E8]-1 -> 1387.88888888889 | G8: 415 | H8: of:=BETADIST([.$C$1];[.$A8];[.G8]-[.$A8]+1) -> 0.00000000096766383612 | I8: of:=[.G8]/1024 -> 0.4052734375 | J8: of:=[.$B8]/[.I8]-1 -> 119.481927710843 | K8: 0 | L8: of:=BETADIST([.$C$1];[.$A8];[.K8]-[.$A8]+1) ->  | M8: of:=[.K8]/1024 -> 0 | N8: of:=[.$B8]/[.M8]-1 ->  | O8: 9
A9: of:=[.A6]*10 -> 10 | B9: of:=[.A9]/[.$C$1]/1024 -> 97.65625 | C9: 1670 | D9: of:=BETADIST([.$C$1];[.$A9];[.C9]-[.$A9]+1) -> 3.89203193926106E-015 | E9: of:=[.C9]/1024 -> 1.630859375 | F9: of:=[.$B9]/[.E9]-1 -> 58.8802395209581 | G9: 6020 | H9: of:=BETADIST([.$C$1];[.$A9];[.G9]-[.$A9]+1) -> 0.00000000099132122546 | I9: of:=[.G9]/1024 -> 5.87890625 | J9: of:=[.$B9]/[.I9]-1 -> 15.6112956810631 | K9: 0 | L9: of:=BETADIST([.$C$1];[.$A9];[.K9]-[.$A9]+1) ->  | M9: of:=[.K9]/1024 -> 0 | N9: of:=[.$B9]/[.M9]-1 ->  | O9: 9
A10: of:=[.A7]*10 -> 20 | B10: of:=[.A10]/[.$C$1]/1024 -> 195.3125 | C10: 17200 | D10: of:=BETADIST([.$C$1];[.$A10];[.C10]-[.$A10]+1) -> 4.07761754864348E-015 | E10: of:=[.C10]/1024 -> 16.796875 | F10: of:=[.$B10]/[.E10]-1 -> 10.6279069767442 | G10: 34600 | H10: of:=BETADIST([.$C$1];[.$A10];[.G10]-[.$A10]+1) -> 0.00000000093015530702 | I10: of:=[.G10]/1024 -> 33.7890625 | J10: of:=[.$B10]/[.I10]-1 -> 4.78034682080925 | K10: 272 | L10: of:=BETADIST([.$C$1];[.$A10];[.K10]-[.$A10]+1) -> 9.63699661644203E-051 | M10: of:=[.K10]/1024 -> 0.265625 | N10: of:=[.$B10]/[.M10]-1 -> 734.294117647059 | O10: 9
A11: 30 | B11: of:=[.A11]/[.$C$1]/1024 -> 292.96875 | D11: of:=BETADIST([.$C$1];[.$A11];[.C11]-[.$A11]+1) ->  | H11: of:=BETADIST([.$C$1];[.$A11];[.G11]-[.$A11]+1) ->  | K11: 2630 | L11: of:=BETADIST([.$C$1];[.$A11];[.K11]-[.$A11]+1) -> 9.85474334934846E-051 | M11: of:=[.K11]/1024 -> 2.568359375 | N11: of:=[.$B11]/[.M11]-1 -> 113.068441064639 | O11: 9
A12: of:=[.A8]*10 -> 50 | B12: of:=[.A12]/[.$C$1]/1024 -> 488.28125 | C12: 129000 | D12: of:=BETADIST([.$C$1];[.$A12];[.C12]-[.$A12]+1) -> 3.69362339457326E-015 | E12: of:=[.C12]/1024 -> 125.9765625 | F12: of:=[.$B12]/[.E12]-1 -> 2.87596899224806 | G12: 184500 | H12: of:=BETADIST([.$C$1];[.$A12];[.G12]-[.$A12]+1) -> 0.00000000098931294503 | I12: of:=[.G12]/1024 -> 180.17578125 | J12: of:=[.$B12]/[.I12]-1 -> 1.710027100271 | K12: 20290 | L12: of:=BETADIST([.$C$1];[.$A12];[.K12]-[.$A12]+1) -> 9.8470060613259E-051 | M12: of:=[.K12]/1024 -> 19.814453125 | N12: of:=[.$B12]/[.M12]-1 -> 23.6426811237063 | O12: 9
A13: of:=[.A9]*10 -> 100 | B13: of:=[.A13]/[.$C$1]/1024 -> 976.5625 | C13: 408000 | D13: of:=BETADIST([.$C$1];[.$A13];[.C13]-[.$A13]+1) -> 3.96078452395453E-015 | E13: of:=[.C13]/1024 -> 398.4375 | F13: of:=[.$B13]/[.E13]-1 -> 1.45098039215686 | G13: 511000 | H13: of:=BETADIST([.$C$1];[.$A13];[.G13]-[.$A13]+1) -> 0.00000000095640225212 | I13: of:=[.G13]/1024 -> 499.0234375 | J13: of:=[.$B13]/[.I13]-1 -> 0.956947162426614 | K13: 137600 | L13: of:=BETADIST([.$C$1];[.$A13];[.K13]-[.$A13]+1) -> 9.28587098945816E-051 | M13: of:=[.K13]/1024 -> 134.375 | N13: of:=[.$B13]/[.M13]-1 -> 6.26744186046512 | O13: 9
A14: of:=[.A10]*10 -> 200 | B14: of:=[.A14]/[.$C$1]/1024 -> 1953.125 | C14: 1080000 | D14: of:=BETADIST([.$C$1];[.$A14];[.C14]-[.$A14]+1) -> 1.63785302308378E-015 | E14: of:=[.C14]/1024 -> 1054.6875 | F14: of:=[.$B14]/[.E14]-1 -> 0.851851851851852 | G14: 1264000 | H14: of:=BETADIST([.$C$1];[.$A14];[.G14]-[.$A14]+1) -> 0.0000000009581405172 | I14: of:=[.G14]/1024 -> 1234.375 | J14: of:=[.$B14]/[.I14]-1 -> 0.582278481012658 | K14: 555000 | L14: of:=BETADIST([.$C$1];[.$A14];[.K14]-[.$A14]+1) -> 9.77803385163055E-051 | M14: of:=[.K14]/1024 -> 541.9921875 | N14: of:=[.$B14]/[.M14]-1 -> 2.6036036036036 | O14: 9
A15: of:=[.A12]*10 -> 500 | B15: of:=[.A15]/[.$C$1]/1024 -> 4882.8125 | C15: 3450000 | D15: of:=BETADIST([.$C$1];[.$A15];[.C15]-[.$A15]+1) -> 3.10932479057671E-015 | E15: of:=[.C15]/1024 -> 3369.140625 | F15: of:=[.$B15]/[.E15]-1 -> 0.449275362318841 | G15: 3773000 | H15: of:=BETADIST([.$C$1];[.$A15];[.G15]-[.$A15]+1) -> 0.00000000099249867423 | I15: of:=[.G15]/1024 -> 3684.5703125 | J15: of:=[.$B15]/[.I15]-1 -> 0.32520540683806 | K15: 2357000 | L15: of:=BETADIST([.$C$1];[.$A15];[.K15]-[.$A15]+1) -> 9.98078698232122E-051 | M15: of:=[.K15]/1024 -> 2301.7578125 | N15: of:=[.$B15]/[.M15]-1 -> 1.12134068731438 | O15: 9
A16: of:=[.A13]*10 -> 1000 | B16: of:=[.A16]/[.$C$1]/1024 -> 9765.625 | C16: 7700000 | D16: of:=BETADIST([.$C$1];[.$A16];[.C16]-[.$A16]+1) -> 1.28828930197189E-015 | E16: of:=[.C16]/1024 -> 7519.53125 | F16: of:=[.$B16]/[.E16]-1 -> 0.298701298701299 | G16: 8218000 | H16: of:=BETADIST([.$C$1];[.$A16];[.G16]-[.$A16]+1) -> 0.00000000099079796996 | I16: of:=[.G16]/1024 -> 8025.390625 | J16: of:=[.$B16]/[.I16]-1 -> 0.216841080554879 | K16: 5987000 | L16: of:=BETADIST([.$C$1];[.$A16];[.K16]-[.$A16]+1) -> 9.58504043582877E-051 | M16: of:=[.K16]/1024 -> 5846.6796875 | N16: of:=[.$B16]/[.M16]-1 -> 0.670285618840822 | O16: 9
A17: of:=[.A14]*10 -> 2000 | B17: of:=[.A17]/[.$C$1]/1024 -> 19531.25 | C17: 16720000 | D17: of:=BETADIST([.$C$1];[.$A17];[.C17]-[.$A17]+1) -> 3.87950764161659E-015 | E17: of:=[.C17]/1024 -> 16328.125 | F17: of:=[.$B17]/[.E17]-1 -> 0.196172248803828 | G17: 17430000 | H17: of:=BETADIST([.$C$1];[.$A17];[.G17]-[.$A17]+1) -> 0.00000000095136316278 | I17: of:=[.G17]/1024 -> 17021.484375 | J17: of:=[.$B17]/[.I17]-1 -> 0.147446930579461 | K17: 14040000 | L17: of:=BETADIST([.$C$1];[.$A17];[.K17]-[.$A17]+1) -> 9.60931142947321E-051 | M17: of:=[.K17]/1024 -> 13710.9375 | N17: of:=[.$B17]/[.M17]-1 -> 0.424501424501425 | O17: 9
A18: of:=[.A15]*10 -> 5000 | B18: of:=[.A18]/[.$C$1]/1024 -> 48828.125 | C18: 44700000 | D18: of:=BETADIST([.$C$1];[.$A18];[.C18]-[.$A18]+1) -> 3.81728104031765E-015 | E18: of:=[.C18]/1024 -> 43652.34375 | F18: of:=[.$B18]/[.E18]-1 -> 0.118568232662192 | G18: 45865000 | H18: of:=BETADIST([.$C$1];[.$A18];[.G18]-[.$A18]+1) -> 0.00000000091177325416 | I18: of:=[.G18]/1024 -> 44790.0390625 | J18: of:=[.$B18]/[.I18]-1 -> 0.0901558922925978 | K18: 40165000 | L18: of:=BETADIST([.$C$1];[.$A18];[.K18]-[.$A18]+1) -> 9.29055802449768E-051 | M18: of:=[.K18]/1024 -> 39223.6328125 | N18: of:=[.$B18]/[.M18]-1 -> 0.244864932154861 | O18: 9
A19: of:=[.A16]*10 -> 10000 | B19: of:=[.A19]/[.$C$1]/1024 -> 97656.25 | C19: 92400000 | D19: of:=BETADIST([.$C$1];[.$A19];[.C19]-[.$A19]+1) -> 3.13006340537563E-015 | E19: of:=[.C19]/1024 -> 90234.375 | F19: of:=[.$B19]/[.E19]-1 -> 0.0822510822510822 | G19: 94118000 | H19: of:=BETADIST([.$C$1];[.$A19];[.G19]-[.$A19]+1) -> 0.00000000099630287563 | I19: of:=[.G19]/1024 -> 91912.109375 | J19: of:=[.$B19]/[.I19]-1 -> 0.0624960156399415 | K19: 85796000 | L19: of:=BETADIST([.$C$1];[.$A19];[.K19]-[.$A19]+1) -> 9.63456749713668E-051 | M19: of:=[.K19]/1024 -> 83785.15625 | N19: of:=[.$B19]/[.M19]-1 -> 0.165555503753089 | O19: 9
A20: of:=[.A17]*10 -> 20000 | B20: of:=[.A20]/[.$C$1]/1024 -> 195312.5 | C20: 189200000 | D20: of:=BETADIST([.$C$1];[.$A20];[.C20]-[.$A20]+1) -> 3.7207936027547E-015 | E20: of:=[.C20]/1024 -> 184765.625 | F20: of:=[.$B20]/[.E20]-1 -> 0.0570824524312896 | G20: 191634000 | H20: of:=BETADIST([.$C$1];[.$A20];[.G20]-[.$A20]+1) -> 0.00000000099788404294 | I20: of:=[.G20]/1024 -> 187142.578125 | J20: of:=[.$B20]/[.I20]-1 -> 0.0436561361762526 | K20: 179610000 | L20: of:=BETADIST([.$C$1];[.$A20];[.K20]-[.$A20]+1) -> 9.37340105807164E-051 | M20: of:=[.K20]/1024 -> 175400.390625 | N20: of:=[.$B20]/[.M20]-1 -> 0.113523745893881 | O20: 9
A21: of:=[.A18]*10 -> 50000 | B21: of:=[.A21]/[.$C$1]/1024 -> 488281.25 | C21: 482800000 | D21: of:=BETADIST([.$C$1];[.$A21];[.C21]-[.$A21]+1) -> 3.5980117528505E-015 | E21: of:=[.C21]/1024 -> 471484.375 | F21: of:=[.$B21]/[.E21]-1 -> 0.0356255178127589 | G21: 486700000 | H21: of:=BETADIST([.$C$1];[.$A21];[.G21]-[.$A21]+1) -> 0.000000000984635852 | I21: of:=[.G21]/1024 -> 475292.96875 | J21: of:=[.$B21]/[.I21]-1 -> 0.0273268954181221 | K21: 467340000 | L21: of:=BETADIST([.$C$1];[.$A21];[.K21]-[.$A21]+1) -> 9.61151517625196E-051 | M21: of:=[.K21]/1024 -> 456386.71875 | N21: of:=[.$B21]/[.M21]-1 -> 0.0698848803868704 | O21: 9
A22: of:=[.A19]*10 -> 100000 | B22: of:=[.A22]/[.$C$1]/1024 -> 976562.5 | C22: 975000000 | D22: of:=BETADIST([.$C$1];[.$A22];[.C22]-[.$A22]+1) -> 7.8127684166595E-016 | E22: of:=[.C22]/1024 -> 952148.4375 | F22: of:=[.$B22]/[.E22]-1 -> 0.0256410256410255 | G22: 981150000 | H22: of:=BETADIST([.$C$1];[.$A22];[.G22]-[.$A22]+1) -> 0.0000000009987453144 | I22: of:=[.G22]/1024 -> 958154.296875 | J22: of:=[.$B22]/[.I22]-1 -> 0.0192121490088162 | K22: 953500000 | L22: of:=BETADIST([.$C$1];[.$A22];[.K22]-[.$A22]+1) -> 9.24052251728348E-051 | M22: of:=[.K22]/1024 -> 931152.34375 | N22: of:=[.$B22]/[.M22]-1 -> 0.048767697954903 | O22: 9
A23: of:=[.A20]*10 -> 200000 | B23: of:=[.A23]/[.$C$1]/1024 -> 1953125 | C23: 1965000000 | D23: of:=BETADIST([.$C$1];[.$A23];[.C23]-[.$A23]+1) -> 1.74491088341356E-015 | E23: of:=[.C23]/1024 -> 1918945.3125 | F23: of:=[.$B23]/[.E23]-1 -> 0.0178117048346056 | G23: 1973290000 | H23: of:=BETADIST([.$C$1];[.$A23];[.G23]-[.$A23]+1) -> 0.00000000099335790083 | I23: of:=[.G23]/1024 -> 1927041.015625 | J23: of:=[.$B23]/[.I23]-1 -> 0.0135357702111703 | K23: 1933950000 | L23: of:=BETADIST([.$C$1];[.$A23];[.K23]-[.$A23]+1) -> 9.74972622921521E-051 | M23: of:=[.K23]/1024 -> 1888623.046875 | N23: of:=[.$B23]/[.M23]-1 -> 0.0341528995061919 | O23: 9
A24: of:=[.A21]*10 -> 500000 | B24: of:=[.A24]/[.$C$1]/1024 -> 4882812.5 | C24: 4945000000 | D24: of:=BETADIST([.$C$1];[.$A24];[.C24]-[.$A24]+1) -> 2.93293788024565E-015 | E24: of:=[.C24]/1024 -> 4829101.5625 | F24: of:=[.$B24]/[.E24]-1 -> 0.0111223458038423 | G24: 4957600000 | H24: of:=BETADIST([.$C$1];[.$A24];[.G24]-[.$A24]+1) -> 0.00000000090988042222 | I24: of:=[.G24]/1024 -> 4841406.25 | J24: of:=[.$B24]/[.I24]-1 -> 0.00855252541552365 | K24: 4895100000 | L24: of:=BETADIST([.$C$1];[.$A24];[.K24]-[.$A24]+1) -> 8.99249550679343E-051 | M24: of:=[.K24]/1024 -> 4780371.09375 | N24: of:=[.$B24]/[.M24]-1 -> 0.0214295928581643 | O24: 9
A25: of:=[.A22]*10 -> 1000000 | B25: of:=[.A25]/[.$C$1]/1024 -> 9765625 | C25: 9922500000 | D25: of:=BETADIST([.$C$1];[.$A25];[.C25]-[.$A25]+1) -> 3.91911163586248E-015 | E25: of:=[.C25]/1024 -> 9689941.40625 | F25: of:=[.$B25]/[.E25]-1 -> 0.00781053162005541 | G25: 9940000000 | H25: of:=BETADIST([.$C$1];[.$A25];[.G25]-[.$A25]+1) -> 0.00000000091618590512 | I25: of:=[.G25]/1024 -> 9707031.25 | J25: of:=[.$B25]/[.I25]-1 -> 0.00603621730382287 | K25: 9851300000 | L25: of:=BETADIST([.$C$1];[.$A25];[.K25]-[.$A25]+1) -> 8.42373356295156E-051 | M25: of:=[.K25]/1024 -> 9620410.15625 | N25: of:=[.$B25]/[.M25]-1 -> 0.0150944545389948 | O25: 9